{
    "componentChunkName": "component---src-templates-page-js",
    "path": "/current/guide/tutorial/",
    "result": {"data":{"page":{"slug":"/current/guide/tutorial/","edit_url":"https://github.com/adaltas/node-nikita/edit/master/docs/content/guide/tutorial.md","version":{"alias":"current"},"frontmatter":{"title":"Tutorial","titleHtml":"<h1>Tutorial</h1>","description":"Instructions on how to get up and running","keywords":null},"parent":{"body":"var _excluded = [\"components\"];\n\nfunction _extends() { _extends = Object.assign ? Object.assign.bind() : function (target) { for (var i = 1; i < arguments.length; i++) { var source = arguments[i]; for (var key in source) { if (Object.prototype.hasOwnProperty.call(source, key)) { target[key] = source[key]; } } } return target; }; return _extends.apply(this, arguments); }\n\nfunction _objectWithoutProperties(source, excluded) { if (source == null) return {}; var target = _objectWithoutPropertiesLoose(source, excluded); var key, i; if (Object.getOwnPropertySymbols) { var sourceSymbolKeys = Object.getOwnPropertySymbols(source); for (i = 0; i < sourceSymbolKeys.length; i++) { key = sourceSymbolKeys[i]; if (excluded.indexOf(key) >= 0) continue; if (!Object.prototype.propertyIsEnumerable.call(source, key)) continue; target[key] = source[key]; } } return target; }\n\nfunction _objectWithoutPropertiesLoose(source, excluded) { if (source == null) return {}; var target = {}; var sourceKeys = Object.keys(source); var key, i; for (i = 0; i < sourceKeys.length; i++) { key = sourceKeys[i]; if (excluded.indexOf(key) >= 0) continue; target[key] = source[key]; } return target; }\n\n/* @jsxRuntime classic */\n\n/* @jsx mdx */\nvar _frontmatter = {\n  \"description\": \"Instructions on how to get up and running\",\n  \"sort\": 1\n};\nvar layoutProps = {\n  _frontmatter: _frontmatter\n};\nvar MDXLayout = \"wrapper\";\nreturn function MDXContent(_ref) {\n  var components = _ref.components,\n      props = _objectWithoutProperties(_ref, _excluded);\n\n  return mdx(MDXLayout, _extends({}, layoutProps, props, {\n    components: components,\n    mdxType: \"MDXLayout\"\n  }), mdx(\"p\", null, \"This tutorial covers the basics to get started and to use Nikita. It is organized in 4 sections:\"), mdx(\"ul\", null, mdx(\"li\", {\n    parentName: \"ul\"\n  }, mdx(\"a\", {\n    parentName: \"li\",\n    \"href\": \"#what-is-nikita\"\n  }, \"What is Nikita?\")), mdx(\"li\", {\n    parentName: \"ul\"\n  }, mdx(\"a\", {\n    parentName: \"li\",\n    \"href\": \"#installation-instructions\"\n  }, \"Installation instructions\")), mdx(\"li\", {\n    parentName: \"ul\"\n  }, mdx(\"a\", {\n    parentName: \"li\",\n    \"href\": \"#core-concepts\"\n  }, \"Core concepts\")), mdx(\"li\", {\n    parentName: \"ul\"\n  }, mdx(\"a\", {\n    parentName: \"li\",\n    \"href\": \"#real-life-example\"\n  }, \"Real-life example\"))), mdx(\"p\", null, \"Feel free to skip the second section if you are familiar with Node.js and its ecosystem.\"), mdx(\"p\", null, \"For detailed information, navigate the documentation or submit an issue if you don't find the answers to your questions. Also, if you are looking for examples, the source code is well documented and its test coverage quite complete. We highly encourage you to navigate the tests. Tests are self-contained and very easy to understand. They also provide you the guaranty of reading a working code.\"), mdx(\"h2\", {\n    \"id\": \"what-is-nikita\",\n    \"style\": {\n      \"position\": \"relative\"\n    }\n  }, mdx(\"a\", {\n    parentName: \"h2\",\n    \"href\": \"#what-is-nikita\",\n    \"aria-label\": \"what is nikita permalink\",\n    \"className\": \"anchor before\"\n  }, mdx(\"svg\", {\n    parentName: \"a\",\n    \"aria-hidden\": \"true\",\n    \"focusable\": \"false\",\n    \"height\": \"16\",\n    \"version\": \"1.1\",\n    \"viewBox\": \"0 0 16 16\",\n    \"width\": \"16\"\n  }, mdx(\"path\", {\n    parentName: \"svg\",\n    \"fillRule\": \"evenodd\",\n    \"d\": \"M4 9h1v1H4c-1.5 0-3-1.69-3-3.5S2.55 3 4 3h4c1.45 0 3 1.69 3 3.5 0 1.41-.91 2.72-2 3.25V8.59c.58-.45 1-1.27 1-2.09C10 5.22 8.98 4 8 4H4c-.98 0-2 1.22-2 2.5S3 9 4 9zm9-3h-1v1h1c1 0 2 1.22 2 2.5S13.98 12 13 12H9c-.98 0-2-1.22-2-2.5 0-.83.42-1.64 1-2.09V6.25c-1.09.53-2 1.84-2 3.25C6 11.31 7.55 13 9 13h4c1.45 0 3-1.69 3-3.5S14.5 6 13 6z\"\n  }))), \"What is Nikita?\"), mdx(\"p\", null, \"Nikita is a toolkit to automate the execution of deployment workflows. Use one of the \", mdx(\"a\", {\n    parentName: \"p\",\n    \"href\": \"/current/actions/\"\n  }, \"many available actions\"), \" or create your own functions to build simple to complex deployment pipelines and infrastructures. Actions are transparently executed locally or remotely over SSH from any host.\"), mdx(\"h3\", {\n    \"id\": \"technologies\",\n    \"style\": {\n      \"position\": \"relative\"\n    }\n  }, mdx(\"a\", {\n    parentName: \"h3\",\n    \"href\": \"#technologies\",\n    \"aria-label\": \"technologies permalink\",\n    \"className\": \"anchor before\"\n  }, mdx(\"svg\", {\n    parentName: \"a\",\n    \"aria-hidden\": \"true\",\n    \"focusable\": \"false\",\n    \"height\": \"16\",\n    \"version\": \"1.1\",\n    \"viewBox\": \"0 0 16 16\",\n    \"width\": \"16\"\n  }, mdx(\"path\", {\n    parentName: \"svg\",\n    \"fillRule\": \"evenodd\",\n    \"d\": \"M4 9h1v1H4c-1.5 0-3-1.69-3-3.5S2.55 3 4 3h4c1.45 0 3 1.69 3 3.5 0 1.41-.91 2.72-2 3.25V8.59c.58-.45 1-1.27 1-2.09C10 5.22 8.98 4 8 4H4c-.98 0-2 1.22-2 2.5S3 9 4 9zm9-3h-1v1h1c1 0 2 1.22 2 2.5S13.98 12 13 12H9c-.98 0-2-1.22-2-2.5 0-.83.42-1.64 1-2.09V6.25c-1.09.53-2 1.84-2 3.25C6 11.31 7.55 13 9 13h4c1.45 0 3-1.69 3-3.5S14.5 6 13 6z\"\n  }))), \"Technologies\"), mdx(\"p\", null, \"Nikita is written in JavaScript and executed with Node.js. It is available on \", mdx(\"a\", {\n    parentName: \"p\",\n    \"href\": \"https://www.npmjs.com/package/nikita\"\n  }, \"NPM\"), \".\"), mdx(\"h3\", {\n    \"id\": \"use-cases\",\n    \"style\": {\n      \"position\": \"relative\"\n    }\n  }, mdx(\"a\", {\n    parentName: \"h3\",\n    \"href\": \"#use-cases\",\n    \"aria-label\": \"use cases permalink\",\n    \"className\": \"anchor before\"\n  }, mdx(\"svg\", {\n    parentName: \"a\",\n    \"aria-hidden\": \"true\",\n    \"focusable\": \"false\",\n    \"height\": \"16\",\n    \"version\": \"1.1\",\n    \"viewBox\": \"0 0 16 16\",\n    \"width\": \"16\"\n  }, mdx(\"path\", {\n    parentName: \"svg\",\n    \"fillRule\": \"evenodd\",\n    \"d\": \"M4 9h1v1H4c-1.5 0-3-1.69-3-3.5S2.55 3 4 3h4c1.45 0 3 1.69 3 3.5 0 1.41-.91 2.72-2 3.25V8.59c.58-.45 1-1.27 1-2.09C10 5.22 8.98 4 8 4H4c-.98 0-2 1.22-2 2.5S3 9 4 9zm9-3h-1v1h1c1 0 2 1.22 2 2.5S13.98 12 13 12H9c-.98 0-2-1.22-2-2.5 0-.83.42-1.64 1-2.09V6.25c-1.09.53-2 1.84-2 3.25C6 11.31 7.55 13 9 13h4c1.45 0 3-1.69 3-3.5S14.5 6 13 6z\"\n  }))), \"Use cases\"), mdx(\"p\", null, \"It serves multiple purposes. For example, it can be used in a website with a Node.js backend, where you want to execute actions (writing files, copy, move, executing custom scripts...) or you can use it to automate and orchestrate components' deployments (installations, functional tests, lifecycle management...).\"), mdx(\"p\", null, \"Take a view at \", mdx(\"a\", {\n    parentName: \"p\",\n    \"href\": \"https://github.com/ryba-io/ryba\"\n  }, \"Ryba\"), \" which contains playbooks to set up and manage Big Data systems.\"), mdx(\"h3\", {\n    \"id\": \"supported-platforms\",\n    \"style\": {\n      \"position\": \"relative\"\n    }\n  }, mdx(\"a\", {\n    parentName: \"h3\",\n    \"href\": \"#supported-platforms\",\n    \"aria-label\": \"supported platforms permalink\",\n    \"className\": \"anchor before\"\n  }, mdx(\"svg\", {\n    parentName: \"a\",\n    \"aria-hidden\": \"true\",\n    \"focusable\": \"false\",\n    \"height\": \"16\",\n    \"version\": \"1.1\",\n    \"viewBox\": \"0 0 16 16\",\n    \"width\": \"16\"\n  }, mdx(\"path\", {\n    parentName: \"svg\",\n    \"fillRule\": \"evenodd\",\n    \"d\": \"M4 9h1v1H4c-1.5 0-3-1.69-3-3.5S2.55 3 4 3h4c1.45 0 3 1.69 3 3.5 0 1.41-.91 2.72-2 3.25V8.59c.58-.45 1-1.27 1-2.09C10 5.22 8.98 4 8 4H4c-.98 0-2 1.22-2 2.5S3 9 4 9zm9-3h-1v1h1c1 0 2 1.22 2 2.5S13.98 12 13 12H9c-.98 0-2-1.22-2-2.5 0-.83.42-1.64 1-2.09V6.25c-1.09.53-2 1.84-2 3.25C6 11.31 7.55 13 9 13h4c1.45 0 3-1.69 3-3.5S14.5 6 13 6z\"\n  }))), \"Supported platforms\"), mdx(\"p\", null, \"Nikita targets Unix-like systems including Linux and macOS. Windows is not supported as a targeting node where actions are executed. It is however known to work as a Nikita host. This means you can run Nikita from a Windows host and target Linux nodes over SSH.\"), mdx(\"p\", null, \"Throughout this tutorial, it is assumed you work on Linux or macOS. To be able to run the same code examples without modifications on Windows, you can install a Linux virtual machine or use Docker.\"), mdx(\"p\", null, \"At the end of the tutorial, you will learn how to use Nikita over SSH. This way, your Windows host is used to create your workflow and you can target a remote host like a server, a virtual machine, or a container.\"), mdx(\"h3\", {\n    \"id\": \"what-is-inside-nikita\",\n    \"style\": {\n      \"position\": \"relative\"\n    }\n  }, mdx(\"a\", {\n    parentName: \"h3\",\n    \"href\": \"#what-is-inside-nikita\",\n    \"aria-label\": \"what is inside nikita permalink\",\n    \"className\": \"anchor before\"\n  }, mdx(\"svg\", {\n    parentName: \"a\",\n    \"aria-hidden\": \"true\",\n    \"focusable\": \"false\",\n    \"height\": \"16\",\n    \"version\": \"1.1\",\n    \"viewBox\": \"0 0 16 16\",\n    \"width\": \"16\"\n  }, mdx(\"path\", {\n    parentName: \"svg\",\n    \"fillRule\": \"evenodd\",\n    \"d\": \"M4 9h1v1H4c-1.5 0-3-1.69-3-3.5S2.55 3 4 3h4c1.45 0 3 1.69 3 3.5 0 1.41-.91 2.72-2 3.25V8.59c.58-.45 1-1.27 1-2.09C10 5.22 8.98 4 8 4H4c-.98 0-2 1.22-2 2.5S3 9 4 9zm9-3h-1v1h1c1 0 2 1.22 2 2.5S13.98 12 13 12H9c-.98 0-2-1.22-2-2.5 0-.83.42-1.64 1-2.09V6.25c-1.09.53-2 1.84-2 3.25C6 11.31 7.55 13 9 13h4c1.45 0 3-1.69 3-3.5S14.5 6 13 6z\"\n  }))), \"What is inside Nikita?\"), mdx(\"p\", null, \"Nikita comes with a set of default functions. It is bundled with many handy functions covering a large range of usages:\"), mdx(\"ul\", null, mdx(\"li\", {\n    parentName: \"ul\"\n  }, \"write files\"), mdx(\"li\", {\n    parentName: \"ul\"\n  }, \"execute shell commands\"), mdx(\"li\", {\n    parentName: \"ul\"\n  }, \"package-management\"), mdx(\"li\", {\n    parentName: \"ul\"\n  }, \"run docker containers\")), mdx(\"p\", null, \"You are encouraged to extend Nikita with your own \", mdx(\"a\", {\n    parentName: \"p\",\n    \"href\": \"/current/api/\"\n  }, \"actions\"), \". In its simplest form, writing an action is just about writing a plain vanilla JavaScript function.\"), mdx(\"h2\", {\n    \"id\": \"installation-instructions\",\n    \"style\": {\n      \"position\": \"relative\"\n    }\n  }, mdx(\"a\", {\n    parentName: \"h2\",\n    \"href\": \"#installation-instructions\",\n    \"aria-label\": \"installation instructions permalink\",\n    \"className\": \"anchor before\"\n  }, mdx(\"svg\", {\n    parentName: \"a\",\n    \"aria-hidden\": \"true\",\n    \"focusable\": \"false\",\n    \"height\": \"16\",\n    \"version\": \"1.1\",\n    \"viewBox\": \"0 0 16 16\",\n    \"width\": \"16\"\n  }, mdx(\"path\", {\n    parentName: \"svg\",\n    \"fillRule\": \"evenodd\",\n    \"d\": \"M4 9h1v1H4c-1.5 0-3-1.69-3-3.5S2.55 3 4 3h4c1.45 0 3 1.69 3 3.5 0 1.41-.91 2.72-2 3.25V8.59c.58-.45 1-1.27 1-2.09C10 5.22 8.98 4 8 4H4c-.98 0-2 1.22-2 2.5S3 9 4 9zm9-3h-1v1h1c1 0 2 1.22 2 2.5S13.98 12 13 12H9c-.98 0-2-1.22-2-2.5 0-.83.42-1.64 1-2.09V6.25c-1.09.53-2 1.84-2 3.25C6 11.31 7.55 13 9 13h4c1.45 0 3-1.69 3-3.5S14.5 6 13 6z\"\n  }))), \"Installation instructions\"), mdx(\"h3\", {\n    \"id\": \"dependencies\",\n    \"style\": {\n      \"position\": \"relative\"\n    }\n  }, mdx(\"a\", {\n    parentName: \"h3\",\n    \"href\": \"#dependencies\",\n    \"aria-label\": \"dependencies permalink\",\n    \"className\": \"anchor before\"\n  }, mdx(\"svg\", {\n    parentName: \"a\",\n    \"aria-hidden\": \"true\",\n    \"focusable\": \"false\",\n    \"height\": \"16\",\n    \"version\": \"1.1\",\n    \"viewBox\": \"0 0 16 16\",\n    \"width\": \"16\"\n  }, mdx(\"path\", {\n    parentName: \"svg\",\n    \"fillRule\": \"evenodd\",\n    \"d\": \"M4 9h1v1H4c-1.5 0-3-1.69-3-3.5S2.55 3 4 3h4c1.45 0 3 1.69 3 3.5 0 1.41-.91 2.72-2 3.25V8.59c.58-.45 1-1.27 1-2.09C10 5.22 8.98 4 8 4H4c-.98 0-2 1.22-2 2.5S3 9 4 9zm9-3h-1v1h1c1 0 2 1.22 2 2.5S13.98 12 13 12H9c-.98 0-2-1.22-2-2.5 0-.83.42-1.64 1-2.09V6.25c-1.09.53-2 1.84-2 3.25C6 11.31 7.55 13 9 13h4c1.45 0 3-1.69 3-3.5S14.5 6 13 6z\"\n  }))), \"Dependencies\"), mdx(\"p\", null, \"To run your code, you must have Node.js and NPM (or YARN) installed. The procedure depends on your operating system. There are multiple alternatives to install Node.js:\"), mdx(\"ul\", null, mdx(\"li\", {\n    parentName: \"ul\"\n  }, mdx(\"a\", {\n    parentName: \"li\",\n    \"href\": \"https://nodejs.org/en/download/\"\n  }, \"Download\"), mdx(\"br\", {\n    parentName: \"li\"\n  }), \"The \", mdx(\"a\", {\n    parentName: \"li\",\n    \"href\": \"https://nodejs.org/en/download/\"\n  }, \"official download page\"), \" provides you with the choices of downloading an installer, the binary files, and the source code.\"), mdx(\"li\", {\n    parentName: \"ul\"\n  }, mdx(\"a\", {\n    parentName: \"li\",\n    \"href\": \"https://nodejs.org/en/download/package-manager/\"\n  }, \"Package manager\"), mdx(\"br\", {\n    parentName: \"li\"\n  }), \"The \", mdx(\"a\", {\n    parentName: \"li\",\n    \"href\": \"https://nodejs.org/en/download/package-manager/\"\n  }, \"package manager\"), \" is probably the fastest and easiest way to get Node.js installed and ready while being upgraded in the future. The choice of package managers will depend on your system.\"), mdx(\"li\", {\n    parentName: \"ul\"\n  }, \"Node.js version manager\\n\", mdx(\"a\", {\n    parentName: \"li\",\n    \"href\": \"https://github.com/creationix/nvm\"\n  }, \"NVM\"), \" and \", mdx(\"a\", {\n    parentName: \"li\",\n    \"href\": \"https://github.com/tj/n\"\n  }, \"N\"), \" will manage multiple versions of Node.js in parallel. For advanced users, this is the recommended procedure. We personally use \", mdx(\"a\", {\n    parentName: \"li\",\n    \"href\": \"https://github.com/tj/n\"\n  }, \"N\"), \".\")), mdx(\"p\", null, \"Once installed, you should have the \", mdx(\"code\", {\n    parentName: \"p\",\n    \"className\": \"language-text\"\n  }, \"node\"), \" and \", mdx(\"code\", {\n    parentName: \"p\",\n    \"className\": \"language-text\"\n  }, \"npm\"), \" commands available from your terminal.\"), mdx(\"h3\", {\n    \"id\": \"initialization\",\n    \"style\": {\n      \"position\": \"relative\"\n    }\n  }, mdx(\"a\", {\n    parentName: \"h3\",\n    \"href\": \"#initialization\",\n    \"aria-label\": \"initialization permalink\",\n    \"className\": \"anchor before\"\n  }, mdx(\"svg\", {\n    parentName: \"a\",\n    \"aria-hidden\": \"true\",\n    \"focusable\": \"false\",\n    \"height\": \"16\",\n    \"version\": \"1.1\",\n    \"viewBox\": \"0 0 16 16\",\n    \"width\": \"16\"\n  }, mdx(\"path\", {\n    parentName: \"svg\",\n    \"fillRule\": \"evenodd\",\n    \"d\": \"M4 9h1v1H4c-1.5 0-3-1.69-3-3.5S2.55 3 4 3h4c1.45 0 3 1.69 3 3.5 0 1.41-.91 2.72-2 3.25V8.59c.58-.45 1-1.27 1-2.09C10 5.22 8.98 4 8 4H4c-.98 0-2 1.22-2 2.5S3 9 4 9zm9-3h-1v1h1c1 0 2 1.22 2 2.5S13.98 12 13 12H9c-.98 0-2-1.22-2-2.5 0-.83.42-1.64 1-2.09V6.25c-1.09.53-2 1.84-2 3.25C6 11.31 7.55 13 9 13h4c1.45 0 3-1.69 3-3.5S14.5 6 13 6z\"\n  }))), \"Initialization\"), mdx(\"p\", null, \"A Nikita project is commonly a Node.js package. Everything is a file and it doesn't require you to rely on any external software such as a database. For this reason, it naturally integrates with \", mdx(\"a\", {\n    parentName: \"p\",\n    \"href\": \"https://en.wikipedia.org/wiki/Version_control\"\n  }, \"version control systems (VCS)\"), \" to track development iterations. Several tools are available such as \", mdx(\"a\", {\n    parentName: \"p\",\n    \"href\": \"https://git-scm.com/\"\n  }, \"Git\"), \" and \", mdx(\"a\", {\n    parentName: \"p\",\n    \"href\": \"https://www.mercurial-scm.org/\"\n  }, \"Mercurial\"), \". In this tutorial, we will be using \", mdx(\"a\", {\n    parentName: \"p\",\n    \"href\": \"https://git-scm.com/\"\n  }, \"Git\"), \" and publish the source code to the \", mdx(\"a\", {\n    parentName: \"p\",\n    \"href\": \"https://github.com/adaltas/node-nikita-tutorial\"\n  }, \"node-nikita-tutorial repository on GitHub\"), \".\"), mdx(\"p\", null, \"We start by initializing a new Git project:\"), mdx(\"div\", {\n    \"className\": \"gatsby-highlight\",\n    \"data-language\": \"bash\"\n  }, mdx(\"pre\", {\n    parentName: \"div\",\n    \"className\": \"language-bash\"\n  }, mdx(\"code\", {\n    parentName: \"pre\",\n    \"className\": \"language-bash\"\n  }, mdx(\"span\", {\n    parentName: \"code\",\n    \"className\": \"token comment\"\n  }, \"# Create a new folder\"), \"\\n\", mdx(\"span\", {\n    parentName: \"code\",\n    \"className\": \"token function\"\n  }, \"mkdir\"), \" tutorial\\n\", mdx(\"span\", {\n    parentName: \"code\",\n    \"className\": \"token builtin class-name\"\n  }, \"cd\"), \" tutorial\\n\", mdx(\"span\", {\n    parentName: \"code\",\n    \"className\": \"token comment\"\n  }, \"# Initialize the git repository\"), \"\\n\", mdx(\"span\", {\n    parentName: \"code\",\n    \"className\": \"token function\"\n  }, \"git\"), \" init\\n\", mdx(\"span\", {\n    parentName: \"code\",\n    \"className\": \"token comment\"\n  }, \"# Change the URL with your remote repository URL\"), \"\\n\", mdx(\"span\", {\n    parentName: \"code\",\n    \"className\": \"token function\"\n  }, \"git\"), \" remote \", mdx(\"span\", {\n    parentName: \"code\",\n    \"className\": \"token function\"\n  }, \"add\"), \" origin https://github.com/adaltas/node-nikita-tutorial.git\\n\", mdx(\"span\", {\n    parentName: \"code\",\n    \"className\": \"token comment\"\n  }, \"# Ignore files\"), \"\\n\", mdx(\"span\", {\n    parentName: \"code\",\n    \"className\": \"token function\"\n  }, \"cat\"), \" \", mdx(\"span\", {\n    parentName: \"code\",\n    \"className\": \"token operator\"\n  }, \">\"), \" .gitignore \", mdx(\"span\", {\n    parentName: \"code\",\n    \"className\": \"token operator\"\n  }, \"<<\"), mdx(\"span\", {\n    parentName: \"code\",\n    \"className\": \"token string\"\n  }, \"MD\\n.*\\n/node_modules\\n!.gitignore\\nMD\"), \"\\n\", mdx(\"span\", {\n    parentName: \"code\",\n    \"className\": \"token comment\"\n  }, \"# Generate the readme file\"), \"\\n\", mdx(\"span\", {\n    parentName: \"code\",\n    \"className\": \"token function\"\n  }, \"cat\"), \" \", mdx(\"span\", {\n    parentName: \"code\",\n    \"className\": \"token operator\"\n  }, \">\"), \" README.md \", mdx(\"span\", {\n    parentName: \"code\",\n    \"className\": \"token operator\"\n  }, \"<<\"), mdx(\"span\", {\n    parentName: \"code\",\n    \"className\": \"token string\"\n  }, \"MD\\n# Nikita tutorial\\n\\nYou will learn how to create a new project as well as the fundamentals of using\\nNikita to automate the deployment of systems.\\n\\nPlease refer to the [official project documentation](http://nikita.adaltas.com/current/guide/tutorial/)\\nfor additional information.\\nMD\"), \"\\n\", mdx(\"span\", {\n    parentName: \"code\",\n    \"className\": \"token comment\"\n  }, \"# Commit to git the project description\"), \"\\n\", mdx(\"span\", {\n    parentName: \"code\",\n    \"className\": \"token function\"\n  }, \"git\"), \" \", mdx(\"span\", {\n    parentName: \"code\",\n    \"className\": \"token function\"\n  }, \"add\"), \" .gitignore README.md\\n\", mdx(\"span\", {\n    parentName: \"code\",\n    \"className\": \"token function\"\n  }, \"git\"), \" commit -m \", mdx(\"span\", {\n    parentName: \"code\",\n    \"className\": \"token string\"\n  }, \"\\\"Project description\\\"\")))), mdx(\"p\", null, \"A Nikita project is a Node.js project. Thus, we will use the \", mdx(\"code\", {\n    parentName: \"p\",\n    \"className\": \"language-text\"\n  }, \"npm init\"), \" command to create a new project. This is a common way to bootstrap a project with a default package definition file. The project's unique required dependency is \", mdx(\"code\", {\n    parentName: \"p\",\n    \"className\": \"language-text\"\n  }, \"nikita\"), \". There is no other external dependency to declare unless you need to.\"), mdx(\"div\", {\n    \"className\": \"gatsby-highlight\",\n    \"data-language\": \"bash\"\n  }, mdx(\"pre\", {\n    parentName: \"div\",\n    \"className\": \"language-bash\"\n  }, mdx(\"code\", {\n    parentName: \"pre\",\n    \"className\": \"language-bash\"\n  }, mdx(\"span\", {\n    parentName: \"code\",\n    \"className\": \"token comment\"\n  }, \"# Initialize a new project\"), \"\\n\", mdx(\"span\", {\n    parentName: \"code\",\n    \"className\": \"token function\"\n  }, \"npm\"), \" init\\n\", mdx(\"span\", {\n    parentName: \"code\",\n    \"className\": \"token comment\"\n  }, \"# Declare the Nikita dependency\"), \"\\n\", mdx(\"span\", {\n    parentName: \"code\",\n    \"className\": \"token function\"\n  }, \"npm\"), \" \", mdx(\"span\", {\n    parentName: \"code\",\n    \"className\": \"token function\"\n  }, \"add\"), \" nikita\\n\", mdx(\"span\", {\n    parentName: \"code\",\n    \"className\": \"token function\"\n  }, \"curl\"), \" https://raw.githubusercontent.com/adaltas/node-nikita/master/LICENSE -o LICENSE\\n\", mdx(\"span\", {\n    parentName: \"code\",\n    \"className\": \"token comment\"\n  }, \"# Commit to git the Node.js package declaration file\"), \"\\n\", mdx(\"span\", {\n    parentName: \"code\",\n    \"className\": \"token function\"\n  }, \"git\"), \" \", mdx(\"span\", {\n    parentName: \"code\",\n    \"className\": \"token function\"\n  }, \"add\"), \" package.json package-lock.json LICENSE\\n\", mdx(\"span\", {\n    parentName: \"code\",\n    \"className\": \"token function\"\n  }, \"git\"), \" commit -a -m \", mdx(\"span\", {\n    parentName: \"code\",\n    \"className\": \"token string\"\n  }, \"\\\"Package declaration file\\\"\")))), mdx(\"p\", null, \"The \", mdx(\"code\", {\n    parentName: \"p\",\n    \"className\": \"language-text\"\n  }, \"npm init\"), \" command will ask you a few questions such as the project name and its version. You may run with default answers using the \", mdx(\"code\", {\n    parentName: \"p\",\n    \"className\": \"language-text\"\n  }, \"-y\"), \" option or get inspiration from this output:\"), mdx(\"div\", {\n    \"className\": \"gatsby-highlight\",\n    \"data-language\": \"text\"\n  }, mdx(\"pre\", {\n    parentName: \"div\",\n    \"className\": \"language-text\"\n  }, mdx(\"code\", {\n    parentName: \"pre\",\n    \"className\": \"language-text\"\n  }, \"package name: (tutorial) nikita-tutorial\\nversion: (1.0.0) 0.0.0\\ndescription: Learn how to use Nikita\\nentry point: (index.js) app.js\\ntest command: mocha test/*.js\\ngit repository: https://github.com/adaltas/node-nikita-tutorial.git\\nkeywords: nikita tutorial\\nauthor: David Worms\\nlicense: (ISC) BSD-3-Clause\"))), mdx(\"p\", null, \"A \", mdx(\"a\", {\n    parentName: \"p\",\n    \"href\": \"https://gist.github.com/robertkowalski/7620849\"\n  }, \"list of possible licenses\"), \" is available on Github.\"), mdx(\"h2\", {\n    \"id\": \"core-concepts\",\n    \"style\": {\n      \"position\": \"relative\"\n    }\n  }, mdx(\"a\", {\n    parentName: \"h2\",\n    \"href\": \"#core-concepts\",\n    \"aria-label\": \"core concepts permalink\",\n    \"className\": \"anchor before\"\n  }, mdx(\"svg\", {\n    parentName: \"a\",\n    \"aria-hidden\": \"true\",\n    \"focusable\": \"false\",\n    \"height\": \"16\",\n    \"version\": \"1.1\",\n    \"viewBox\": \"0 0 16 16\",\n    \"width\": \"16\"\n  }, mdx(\"path\", {\n    parentName: \"svg\",\n    \"fillRule\": \"evenodd\",\n    \"d\": \"M4 9h1v1H4c-1.5 0-3-1.69-3-3.5S2.55 3 4 3h4c1.45 0 3 1.69 3 3.5 0 1.41-.91 2.72-2 3.25V8.59c.58-.45 1-1.27 1-2.09C10 5.22 8.98 4 8 4H4c-.98 0-2 1.22-2 2.5S3 9 4 9zm9-3h-1v1h1c1 0 2 1.22 2 2.5S13.98 12 13 12H9c-.98 0-2-1.22-2-2.5 0-.83.42-1.64 1-2.09V6.25c-1.09.53-2 1.84-2 3.25C6 11.31 7.55 13 9 13h4c1.45 0 3-1.69 3-3.5S14.5 6 13 6z\"\n  }))), \"Core concepts\"), mdx(\"p\", null, \"Before installing something useful, let's learn a few basics. Nikita is executed by the Node.js engine. It implies some experience in JavaScript. You don't need to be a JS Ninja but some basic knowledge is required.\"), mdx(\"h3\", {\n    \"id\": \"about-coffeescript\",\n    \"style\": {\n      \"position\": \"relative\"\n    }\n  }, mdx(\"a\", {\n    parentName: \"h3\",\n    \"href\": \"#about-coffeescript\",\n    \"aria-label\": \"about coffeescript permalink\",\n    \"className\": \"anchor before\"\n  }, mdx(\"svg\", {\n    parentName: \"a\",\n    \"aria-hidden\": \"true\",\n    \"focusable\": \"false\",\n    \"height\": \"16\",\n    \"version\": \"1.1\",\n    \"viewBox\": \"0 0 16 16\",\n    \"width\": \"16\"\n  }, mdx(\"path\", {\n    parentName: \"svg\",\n    \"fillRule\": \"evenodd\",\n    \"d\": \"M4 9h1v1H4c-1.5 0-3-1.69-3-3.5S2.55 3 4 3h4c1.45 0 3 1.69 3 3.5 0 1.41-.91 2.72-2 3.25V8.59c.58-.45 1-1.27 1-2.09C10 5.22 8.98 4 8 4H4c-.98 0-2 1.22-2 2.5S3 9 4 9zm9-3h-1v1h1c1 0 2 1.22 2 2.5S13.98 12 13 12H9c-.98 0-2-1.22-2-2.5 0-.83.42-1.64 1-2.09V6.25c-1.09.53-2 1.84-2 3.25C6 11.31 7.55 13 9 13h4c1.45 0 3-1.69 3-3.5S14.5 6 13 6z\"\n  }))), \"About CoffeeScript\"), mdx(\"p\", null, \"This tutorial is written in JavaScript to get you started quickly. If you navigate the Nikita source code, you'll see it is written in CoffeeScript, a language that transpiles into JavaScript before being executed by the Node.js engine. Run \", mdx(\"code\", {\n    parentName: \"p\",\n    \"className\": \"language-text\"\n  }, \"npm install -g coffeescript\"), \" to install CoffeeScript globally. Unless you used a Node.js version manager, you will probably encounter a permission error. Read the NPM chapter about \", mdx(\"a\", {\n    parentName: \"p\",\n    \"href\": \"https://docs.npmjs.com/getting-started/fixing-npm-permissions\"\n  }, \"permissions\"), \" to select a solution or install it locally without the \", mdx(\"code\", {\n    parentName: \"p\",\n    \"className\": \"language-text\"\n  }, \"-g\"), \" option and use the command \", mdx(\"code\", {\n    parentName: \"p\",\n    \"className\": \"language-text\"\n  }, \"npx coffee\"), \" instead of \", mdx(\"code\", {\n    parentName: \"p\",\n    \"className\": \"language-text\"\n  }, \"coffee\"), \". The \", mdx(\"code\", {\n    parentName: \"p\",\n    \"className\": \"language-text\"\n  }, \"npx\"), \" command is available within all Node.js installation.\"), mdx(\"p\", null, \"CoffeeScript has a very clean syntax and is perfectly suited to the declarative aspect of the Nikita API. In the end, the source code looks like one written in YAML while preserving the advantages of a procedural language like JavaScript. A second advantage we found with CoffeeScript is its \", mdx(\"a\", {\n    parentName: \"p\",\n    \"href\": \"http://coffeescript.org/#literate\"\n  }, \"literate functionality\"), \" which lets you write Markdown files with CoffeeScript code inside. Your source code looks a bit like a Notebook, it is a markdown document with documentation and code organized in blocks.\"), mdx(\"h3\", {\n    \"id\": \"action\",\n    \"style\": {\n      \"position\": \"relative\"\n    }\n  }, mdx(\"a\", {\n    parentName: \"h3\",\n    \"href\": \"#action\",\n    \"aria-label\": \"action permalink\",\n    \"className\": \"anchor before\"\n  }, mdx(\"svg\", {\n    parentName: \"a\",\n    \"aria-hidden\": \"true\",\n    \"focusable\": \"false\",\n    \"height\": \"16\",\n    \"version\": \"1.1\",\n    \"viewBox\": \"0 0 16 16\",\n    \"width\": \"16\"\n  }, mdx(\"path\", {\n    parentName: \"svg\",\n    \"fillRule\": \"evenodd\",\n    \"d\": \"M4 9h1v1H4c-1.5 0-3-1.69-3-3.5S2.55 3 4 3h4c1.45 0 3 1.69 3 3.5 0 1.41-.91 2.72-2 3.25V8.59c.58-.45 1-1.27 1-2.09C10 5.22 8.98 4 8 4H4c-.98 0-2 1.22-2 2.5S3 9 4 9zm9-3h-1v1h1c1 0 2 1.22 2 2.5S13.98 12 13 12H9c-.98 0-2-1.22-2-2.5 0-.83.42-1.64 1-2.09V6.25c-1.09.53-2 1.84-2 3.25C6 11.31 7.55 13 9 13h4c1.45 0 3-1.69 3-3.5S14.5 6 13 6z\"\n  }))), \"Action\"), mdx(\"p\", null, \"An action is the basic building block in Nikita. It is basically a function, called a handler, with some associated configuration, called \", mdx(\"code\", {\n    parentName: \"p\",\n    \"className\": \"language-text\"\n  }, \"config\"), \". It is materialized as a JavaScript object, for example:\"), mdx(\"div\", {\n    \"className\": \"gatsby-highlight\",\n    \"data-language\": \"js\"\n  }, mdx(\"pre\", {\n    parentName: \"div\",\n    \"className\": \"language-js\"\n  }, mdx(\"code\", {\n    parentName: \"pre\",\n    \"className\": \"language-js\"\n  }, mdx(\"span\", {\n    parentName: \"code\",\n    \"className\": \"token punctuation\"\n  }, \"{\"), \"\\n  \", mdx(\"span\", {\n    parentName: \"code\",\n    \"className\": \"token literal-property property\"\n  }, \"who\"), mdx(\"span\", {\n    parentName: \"code\",\n    \"className\": \"token operator\"\n  }, \":\"), \" \", mdx(\"span\", {\n    parentName: \"code\",\n    \"className\": \"token string\"\n  }, \"'leon'\"), mdx(\"span\", {\n    parentName: \"code\",\n    \"className\": \"token punctuation\"\n  }, \",\"), \"\\n  \", mdx(\"span\", {\n    parentName: \"code\",\n    \"className\": \"token function-variable function\"\n  }, \"$handler\"), mdx(\"span\", {\n    parentName: \"code\",\n    \"className\": \"token operator\"\n  }, \":\"), \" \", mdx(\"span\", {\n    parentName: \"code\",\n    \"className\": \"token keyword\"\n  }, \"function\"), mdx(\"span\", {\n    parentName: \"code\",\n    \"className\": \"token punctuation\"\n  }, \"(\"), mdx(\"span\", {\n    parentName: \"code\",\n    \"className\": \"token parameter\"\n  }, mdx(\"span\", {\n    parentName: \"span\",\n    \"className\": \"token punctuation\"\n  }, \"{\"), \"config\", mdx(\"span\", {\n    parentName: \"span\",\n    \"className\": \"token punctuation\"\n  }, \"}\")), mdx(\"span\", {\n    parentName: \"code\",\n    \"className\": \"token punctuation\"\n  }, \")\"), \" \", mdx(\"span\", {\n    parentName: \"code\",\n    \"className\": \"token punctuation\"\n  }, \"{\"), \"\\n    console\", mdx(\"span\", {\n    parentName: \"code\",\n    \"className\": \"token punctuation\"\n  }, \".\"), mdx(\"span\", {\n    parentName: \"code\",\n    \"className\": \"token function\"\n  }, \"info\"), mdx(\"span\", {\n    parentName: \"code\",\n    \"className\": \"token punctuation\"\n  }, \"(\"), \"config\", mdx(\"span\", {\n    parentName: \"code\",\n    \"className\": \"token punctuation\"\n  }, \".\"), \"who\", mdx(\"span\", {\n    parentName: \"code\",\n    \"className\": \"token punctuation\"\n  }, \")\"), \"\\n  \", mdx(\"span\", {\n    parentName: \"code\",\n    \"className\": \"token punctuation\"\n  }, \"}\"), \"\\n\", mdx(\"span\", {\n    parentName: \"code\",\n    \"className\": \"token punctuation\"\n  }, \"}\")))), mdx(\"p\", null, \"As you can see, \", mdx(\"code\", {\n    parentName: \"p\",\n    \"className\": \"language-text\"\n  }, \"config\"), \" is made available as a destructure property of the first argument that the handler receives.\"), mdx(\"h3\", {\n    \"id\": \"calling-actions\",\n    \"style\": {\n      \"position\": \"relative\"\n    }\n  }, mdx(\"a\", {\n    parentName: \"h3\",\n    \"href\": \"#calling-actions\",\n    \"aria-label\": \"calling actions permalink\",\n    \"className\": \"anchor before\"\n  }, mdx(\"svg\", {\n    parentName: \"a\",\n    \"aria-hidden\": \"true\",\n    \"focusable\": \"false\",\n    \"height\": \"16\",\n    \"version\": \"1.1\",\n    \"viewBox\": \"0 0 16 16\",\n    \"width\": \"16\"\n  }, mdx(\"path\", {\n    parentName: \"svg\",\n    \"fillRule\": \"evenodd\",\n    \"d\": \"M4 9h1v1H4c-1.5 0-3-1.69-3-3.5S2.55 3 4 3h4c1.45 0 3 1.69 3 3.5 0 1.41-.91 2.72-2 3.25V8.59c.58-.45 1-1.27 1-2.09C10 5.22 8.98 4 8 4H4c-.98 0-2 1.22-2 2.5S3 9 4 9zm9-3h-1v1h1c1 0 2 1.22 2 2.5S13.98 12 13 12H9c-.98 0-2-1.22-2-2.5 0-.83.42-1.64 1-2.09V6.25c-1.09.53-2 1.84-2 3.25C6 11.31 7.55 13 9 13h4c1.45 0 3-1.69 3-3.5S14.5 6 13 6z\"\n  }))), \"Calling actions\"), mdx(\"p\", null, \"To execute an action, you must create a Nikita session and execute the \", mdx(\"code\", {\n    parentName: \"p\",\n    \"className\": \"language-text\"\n  }, \"call\"), \" function:\"), mdx(\"div\", {\n    \"className\": \"gatsby-highlight\",\n    \"data-language\": \"js\"\n  }, mdx(\"pre\", {\n    parentName: \"div\",\n    \"className\": \"language-js\"\n  }, mdx(\"code\", {\n    parentName: \"pre\",\n    \"className\": \"language-js\"\n  }, mdx(\"span\", {\n    parentName: \"code\",\n    \"className\": \"token comment\"\n  }, \"// New Nikita session\"), \"\\nnikita\\n\", mdx(\"span\", {\n    parentName: \"code\",\n    \"className\": \"token comment\"\n  }, \"// Call an action\"), \"\\n\", mdx(\"span\", {\n    parentName: \"code\",\n    \"className\": \"token punctuation\"\n  }, \".\"), mdx(\"span\", {\n    parentName: \"code\",\n    \"className\": \"token function\"\n  }, \"call\"), mdx(\"span\", {\n    parentName: \"code\",\n    \"className\": \"token punctuation\"\n  }, \"(\"), mdx(\"span\", {\n    parentName: \"code\",\n    \"className\": \"token punctuation\"\n  }, \"{\"), \"\\n  \", mdx(\"span\", {\n    parentName: \"code\",\n    \"className\": \"token literal-property property\"\n  }, \"who\"), mdx(\"span\", {\n    parentName: \"code\",\n    \"className\": \"token operator\"\n  }, \":\"), \" \", mdx(\"span\", {\n    parentName: \"code\",\n    \"className\": \"token string\"\n  }, \"'leon'\"), mdx(\"span\", {\n    parentName: \"code\",\n    \"className\": \"token punctuation\"\n  }, \",\"), \"\\n  \", mdx(\"span\", {\n    parentName: \"code\",\n    \"className\": \"token function-variable function\"\n  }, \"$handler\"), mdx(\"span\", {\n    parentName: \"code\",\n    \"className\": \"token operator\"\n  }, \":\"), \" \", mdx(\"span\", {\n    parentName: \"code\",\n    \"className\": \"token keyword\"\n  }, \"function\"), mdx(\"span\", {\n    parentName: \"code\",\n    \"className\": \"token punctuation\"\n  }, \"(\"), mdx(\"span\", {\n    parentName: \"code\",\n    \"className\": \"token parameter\"\n  }, mdx(\"span\", {\n    parentName: \"span\",\n    \"className\": \"token punctuation\"\n  }, \"{\"), \"config\", mdx(\"span\", {\n    parentName: \"span\",\n    \"className\": \"token punctuation\"\n  }, \"}\")), mdx(\"span\", {\n    parentName: \"code\",\n    \"className\": \"token punctuation\"\n  }, \")\"), \" \", mdx(\"span\", {\n    parentName: \"code\",\n    \"className\": \"token punctuation\"\n  }, \"{\"), \"\\n    console\", mdx(\"span\", {\n    parentName: \"code\",\n    \"className\": \"token punctuation\"\n  }, \".\"), mdx(\"span\", {\n    parentName: \"code\",\n    \"className\": \"token function\"\n  }, \"info\"), mdx(\"span\", {\n    parentName: \"code\",\n    \"className\": \"token punctuation\"\n  }, \"(\"), \"config\", mdx(\"span\", {\n    parentName: \"code\",\n    \"className\": \"token punctuation\"\n  }, \".\"), \"who\", mdx(\"span\", {\n    parentName: \"code\",\n    \"className\": \"token punctuation\"\n  }, \")\"), \"\\n  \", mdx(\"span\", {\n    parentName: \"code\",\n    \"className\": \"token punctuation\"\n  }, \"}\"), \"\\n\", mdx(\"span\", {\n    parentName: \"code\",\n    \"className\": \"token punctuation\"\n  }, \"}\"), mdx(\"span\", {\n    parentName: \"code\",\n    \"className\": \"token punctuation\"\n  }, \")\")))), mdx(\"p\", null, \"The function \", mdx(\"code\", {\n    parentName: \"p\",\n    \"className\": \"language-text\"\n  }, \"nikita.call\"), \" is very flexible in how arguments are passed. It receives zero to multiple objects which will be merged together. Also, a function is interpreted as the action handler, being converted to an object with the \", mdx(\"code\", {\n    parentName: \"p\",\n    \"className\": \"language-text\"\n  }, \"handler\"), \" property. It means the previous example could be rewritten as:\"), mdx(\"div\", {\n    \"className\": \"gatsby-highlight\",\n    \"data-language\": \"js\"\n  }, mdx(\"pre\", {\n    parentName: \"div\",\n    \"className\": \"language-js\"\n  }, mdx(\"code\", {\n    parentName: \"pre\",\n    \"className\": \"language-js\"\n  }, mdx(\"span\", {\n    parentName: \"code\",\n    \"className\": \"token comment\"\n  }, \"// New Nikita session\"), \"\\nnikita\\n\", mdx(\"span\", {\n    parentName: \"code\",\n    \"className\": \"token comment\"\n  }, \"// Call an action\"), \"\\n\", mdx(\"span\", {\n    parentName: \"code\",\n    \"className\": \"token punctuation\"\n  }, \".\"), mdx(\"span\", {\n    parentName: \"code\",\n    \"className\": \"token function\"\n  }, \"call\"), mdx(\"span\", {\n    parentName: \"code\",\n    \"className\": \"token punctuation\"\n  }, \"(\"), mdx(\"span\", {\n    parentName: \"code\",\n    \"className\": \"token punctuation\"\n  }, \"{\"), \"\\n  \", mdx(\"span\", {\n    parentName: \"code\",\n    \"className\": \"token literal-property property\"\n  }, \"who\"), mdx(\"span\", {\n    parentName: \"code\",\n    \"className\": \"token operator\"\n  }, \":\"), \" \", mdx(\"span\", {\n    parentName: \"code\",\n    \"className\": \"token string\"\n  }, \"'leon'\"), \"\\n\", mdx(\"span\", {\n    parentName: \"code\",\n    \"className\": \"token punctuation\"\n  }, \"}\"), mdx(\"span\", {\n    parentName: \"code\",\n    \"className\": \"token punctuation\"\n  }, \",\"), \" \", mdx(\"span\", {\n    parentName: \"code\",\n    \"className\": \"token keyword\"\n  }, \"function\"), mdx(\"span\", {\n    parentName: \"code\",\n    \"className\": \"token punctuation\"\n  }, \"(\"), mdx(\"span\", {\n    parentName: \"code\",\n    \"className\": \"token parameter\"\n  }, mdx(\"span\", {\n    parentName: \"span\",\n    \"className\": \"token punctuation\"\n  }, \"{\"), \"config\", mdx(\"span\", {\n    parentName: \"span\",\n    \"className\": \"token punctuation\"\n  }, \"}\")), mdx(\"span\", {\n    parentName: \"code\",\n    \"className\": \"token punctuation\"\n  }, \")\"), \" \", mdx(\"span\", {\n    parentName: \"code\",\n    \"className\": \"token punctuation\"\n  }, \"{\"), \"\\n  console\", mdx(\"span\", {\n    parentName: \"code\",\n    \"className\": \"token punctuation\"\n  }, \".\"), mdx(\"span\", {\n    parentName: \"code\",\n    \"className\": \"token function\"\n  }, \"info\"), mdx(\"span\", {\n    parentName: \"code\",\n    \"className\": \"token punctuation\"\n  }, \"(\"), \"config\", mdx(\"span\", {\n    parentName: \"code\",\n    \"className\": \"token punctuation\"\n  }, \".\"), \"who\", mdx(\"span\", {\n    parentName: \"code\",\n    \"className\": \"token punctuation\"\n  }, \")\"), \"\\n\", mdx(\"span\", {\n    parentName: \"code\",\n    \"className\": \"token punctuation\"\n  }, \"}\"), mdx(\"span\", {\n    parentName: \"code\",\n    \"className\": \"token punctuation\"\n  }, \")\")))), mdx(\"h3\", {\n    \"id\": \"parent-action-and-children\",\n    \"style\": {\n      \"position\": \"relative\"\n    }\n  }, mdx(\"a\", {\n    parentName: \"h3\",\n    \"href\": \"#parent-action-and-children\",\n    \"aria-label\": \"parent action and children permalink\",\n    \"className\": \"anchor before\"\n  }, mdx(\"svg\", {\n    parentName: \"a\",\n    \"aria-hidden\": \"true\",\n    \"focusable\": \"false\",\n    \"height\": \"16\",\n    \"version\": \"1.1\",\n    \"viewBox\": \"0 0 16 16\",\n    \"width\": \"16\"\n  }, mdx(\"path\", {\n    parentName: \"svg\",\n    \"fillRule\": \"evenodd\",\n    \"d\": \"M4 9h1v1H4c-1.5 0-3-1.69-3-3.5S2.55 3 4 3h4c1.45 0 3 1.69 3 3.5 0 1.41-.91 2.72-2 3.25V8.59c.58-.45 1-1.27 1-2.09C10 5.22 8.98 4 8 4H4c-.98 0-2 1.22-2 2.5S3 9 4 9zm9-3h-1v1h1c1 0 2 1.22 2 2.5S13.98 12 13 12H9c-.98 0-2-1.22-2-2.5 0-.83.42-1.64 1-2.09V6.25c-1.09.53-2 1.84-2 3.25C6 11.31 7.55 13 9 13h4c1.45 0 3-1.69 3-3.5S14.5 6 13 6z\"\n  }))), \"Parent action and children\"), mdx(\"p\", null, \"The Nikita session is organized as a hierarchical tree of actions. The parent is an action of the higher level in the session tree. All Nikita's actions have a parent action except the root Nikita action instantiating a Nikita session. The children are the actions executed in the handler of a parent action using the \", mdx(\"a\", {\n    parentName: \"p\",\n    \"href\": \"https://developer.mozilla.org/en-US/docs/Web/JavaScript/Reference/Operators/this\"\n  }, mdx(\"code\", {\n    parentName: \"a\",\n    \"className\": \"language-text\"\n  }, \"this\"), \" keyword\"), \":\"), mdx(\"div\", {\n    \"className\": \"gatsby-highlight\",\n    \"data-language\": \"js\"\n  }, mdx(\"pre\", {\n    parentName: \"div\",\n    \"className\": \"language-js\"\n  }, mdx(\"code\", {\n    parentName: \"pre\",\n    \"className\": \"language-js\"\n  }, mdx(\"span\", {\n    parentName: \"code\",\n    \"className\": \"token comment\"\n  }, \"// Root action\"), \"\\n\", mdx(\"span\", {\n    parentName: \"code\",\n    \"className\": \"token function\"\n  }, \"nikita\"), mdx(\"span\", {\n    parentName: \"code\",\n    \"className\": \"token punctuation\"\n  }, \"(\"), mdx(\"span\", {\n    parentName: \"code\",\n    \"className\": \"token keyword\"\n  }, \"function\"), mdx(\"span\", {\n    parentName: \"code\",\n    \"className\": \"token punctuation\"\n  }, \"(\"), mdx(\"span\", {\n    parentName: \"code\",\n    \"className\": \"token punctuation\"\n  }, \")\"), \" \", mdx(\"span\", {\n    parentName: \"code\",\n    \"className\": \"token punctuation\"\n  }, \"{\"), \"\\n  console\", mdx(\"span\", {\n    parentName: \"code\",\n    \"className\": \"token punctuation\"\n  }, \".\"), mdx(\"span\", {\n    parentName: \"code\",\n    \"className\": \"token function\"\n  }, \"info\"), mdx(\"span\", {\n    parentName: \"code\",\n    \"className\": \"token punctuation\"\n  }, \"(\"), mdx(\"span\", {\n    parentName: \"code\",\n    \"className\": \"token string\"\n  }, \"'I am root'\"), mdx(\"span\", {\n    parentName: \"code\",\n    \"className\": \"token punctuation\"\n  }, \")\"), \"\\n\", mdx(\"span\", {\n    parentName: \"code\",\n    \"className\": \"token punctuation\"\n  }, \"}\"), mdx(\"span\", {\n    parentName: \"code\",\n    \"className\": \"token punctuation\"\n  }, \")\"), \"\\n\", mdx(\"span\", {\n    parentName: \"code\",\n    \"className\": \"token comment\"\n  }, \"// Parent action\"), \"\\n\", mdx(\"span\", {\n    parentName: \"code\",\n    \"className\": \"token punctuation\"\n  }, \".\"), mdx(\"span\", {\n    parentName: \"code\",\n    \"className\": \"token function\"\n  }, \"call\"), mdx(\"span\", {\n    parentName: \"code\",\n    \"className\": \"token punctuation\"\n  }, \"(\"), mdx(\"span\", {\n    parentName: \"code\",\n    \"className\": \"token keyword\"\n  }, \"function\"), mdx(\"span\", {\n    parentName: \"code\",\n    \"className\": \"token punctuation\"\n  }, \"(\"), mdx(\"span\", {\n    parentName: \"code\",\n    \"className\": \"token punctuation\"\n  }, \")\"), \" \", mdx(\"span\", {\n    parentName: \"code\",\n    \"className\": \"token punctuation\"\n  }, \"{\"), \"\\n  console\", mdx(\"span\", {\n    parentName: \"code\",\n    \"className\": \"token punctuation\"\n  }, \".\"), mdx(\"span\", {\n    parentName: \"code\",\n    \"className\": \"token function\"\n  }, \"info\"), mdx(\"span\", {\n    parentName: \"code\",\n    \"className\": \"token punctuation\"\n  }, \"(\"), mdx(\"span\", {\n    parentName: \"code\",\n    \"className\": \"token string\"\n  }, \"'I am parent'\"), mdx(\"span\", {\n    parentName: \"code\",\n    \"className\": \"token punctuation\"\n  }, \")\"), \"\\n  \", mdx(\"span\", {\n    parentName: \"code\",\n    \"className\": \"token comment\"\n  }, \"// Child action\"), \"\\n  \", mdx(\"span\", {\n    parentName: \"code\",\n    \"className\": \"token keyword\"\n  }, \"this\"), mdx(\"span\", {\n    parentName: \"code\",\n    \"className\": \"token punctuation\"\n  }, \".\"), mdx(\"span\", {\n    parentName: \"code\",\n    \"className\": \"token function\"\n  }, \"call\"), mdx(\"span\", {\n    parentName: \"code\",\n    \"className\": \"token punctuation\"\n  }, \"(\"), mdx(\"span\", {\n    parentName: \"code\",\n    \"className\": \"token keyword\"\n  }, \"function\"), mdx(\"span\", {\n    parentName: \"code\",\n    \"className\": \"token punctuation\"\n  }, \"(\"), mdx(\"span\", {\n    parentName: \"code\",\n    \"className\": \"token punctuation\"\n  }, \")\"), \" \", mdx(\"span\", {\n    parentName: \"code\",\n    \"className\": \"token punctuation\"\n  }, \"{\"), \"\\n    console\", mdx(\"span\", {\n    parentName: \"code\",\n    \"className\": \"token punctuation\"\n  }, \".\"), mdx(\"span\", {\n    parentName: \"code\",\n    \"className\": \"token function\"\n  }, \"info\"), mdx(\"span\", {\n    parentName: \"code\",\n    \"className\": \"token punctuation\"\n  }, \"(\"), mdx(\"span\", {\n    parentName: \"code\",\n    \"className\": \"token string\"\n  }, \"'I am child'\"), mdx(\"span\", {\n    parentName: \"code\",\n    \"className\": \"token punctuation\"\n  }, \")\"), \"\\n  \", mdx(\"span\", {\n    parentName: \"code\",\n    \"className\": \"token punctuation\"\n  }, \"}\"), mdx(\"span\", {\n    parentName: \"code\",\n    \"className\": \"token punctuation\"\n  }, \")\"), \"\\n\", mdx(\"span\", {\n    parentName: \"code\",\n    \"className\": \"token punctuation\"\n  }, \"}\"), mdx(\"span\", {\n    parentName: \"code\",\n    \"className\": \"token punctuation\"\n  }, \")\")))), mdx(\"p\", null, \"Alternatively, you can use \", mdx(\"a\", {\n    parentName: \"p\",\n    \"href\": \"https://developer.mozilla.org/en-US/docs/Web/JavaScript/Reference/Functions/Arrow_functions\"\n  }, \"JavaScript arrow function expressions\"), \" to reduce the syntax. In such a case, to call a child action you must use the \", mdx(\"a\", {\n    parentName: \"p\",\n    \"href\": \"/current/api/context/\"\n  }, mdx(\"code\", {\n    parentName: \"a\",\n    \"className\": \"language-text\"\n  }, \"context\"), \" property\"), \", because arrow functions don't accept a custom \", mdx(\"code\", {\n    parentName: \"p\",\n    \"className\": \"language-text\"\n  }, \"this\"), \" binding. \", mdx(\"code\", {\n    parentName: \"p\",\n    \"className\": \"language-text\"\n  }, \"context\"), \" is available inside the handler as a property of the first argument:\"), mdx(\"div\", {\n    \"className\": \"gatsby-highlight\",\n    \"data-language\": \"js\"\n  }, mdx(\"pre\", {\n    parentName: \"div\",\n    \"className\": \"language-js\"\n  }, mdx(\"code\", {\n    parentName: \"pre\",\n    \"className\": \"language-js\"\n  }, mdx(\"span\", {\n    parentName: \"code\",\n    \"className\": \"token comment\"\n  }, \"// Root action\"), \"\\n\", mdx(\"span\", {\n    parentName: \"code\",\n    \"className\": \"token function\"\n  }, \"nikita\"), mdx(\"span\", {\n    parentName: \"code\",\n    \"className\": \"token punctuation\"\n  }, \"(\"), mdx(\"span\", {\n    parentName: \"code\",\n    \"className\": \"token punctuation\"\n  }, \"(\"), mdx(\"span\", {\n    parentName: \"code\",\n    \"className\": \"token punctuation\"\n  }, \")\"), \" \", mdx(\"span\", {\n    parentName: \"code\",\n    \"className\": \"token operator\"\n  }, \"=>\"), \" \", mdx(\"span\", {\n    parentName: \"code\",\n    \"className\": \"token punctuation\"\n  }, \"{\"), \"\\n  console\", mdx(\"span\", {\n    parentName: \"code\",\n    \"className\": \"token punctuation\"\n  }, \".\"), mdx(\"span\", {\n    parentName: \"code\",\n    \"className\": \"token function\"\n  }, \"info\"), mdx(\"span\", {\n    parentName: \"code\",\n    \"className\": \"token punctuation\"\n  }, \"(\"), mdx(\"span\", {\n    parentName: \"code\",\n    \"className\": \"token string\"\n  }, \"'I am root'\"), mdx(\"span\", {\n    parentName: \"code\",\n    \"className\": \"token punctuation\"\n  }, \")\"), \"\\n\", mdx(\"span\", {\n    parentName: \"code\",\n    \"className\": \"token punctuation\"\n  }, \"}\"), mdx(\"span\", {\n    parentName: \"code\",\n    \"className\": \"token punctuation\"\n  }, \")\"), \"\\n\", mdx(\"span\", {\n    parentName: \"code\",\n    \"className\": \"token comment\"\n  }, \"// Parent action\"), \"\\n\", mdx(\"span\", {\n    parentName: \"code\",\n    \"className\": \"token punctuation\"\n  }, \".\"), mdx(\"span\", {\n    parentName: \"code\",\n    \"className\": \"token function\"\n  }, \"call\"), mdx(\"span\", {\n    parentName: \"code\",\n    \"className\": \"token punctuation\"\n  }, \"(\"), mdx(\"span\", {\n    parentName: \"code\",\n    \"className\": \"token punctuation\"\n  }, \"(\"), mdx(\"span\", {\n    parentName: \"code\",\n    \"className\": \"token parameter\"\n  }, mdx(\"span\", {\n    parentName: \"span\",\n    \"className\": \"token punctuation\"\n  }, \"{\"), \"context\", mdx(\"span\", {\n    parentName: \"span\",\n    \"className\": \"token punctuation\"\n  }, \"}\")), mdx(\"span\", {\n    parentName: \"code\",\n    \"className\": \"token punctuation\"\n  }, \")\"), \" \", mdx(\"span\", {\n    parentName: \"code\",\n    \"className\": \"token operator\"\n  }, \"=>\"), \" \", mdx(\"span\", {\n    parentName: \"code\",\n    \"className\": \"token punctuation\"\n  }, \"{\"), \"\\n  console\", mdx(\"span\", {\n    parentName: \"code\",\n    \"className\": \"token punctuation\"\n  }, \".\"), mdx(\"span\", {\n    parentName: \"code\",\n    \"className\": \"token function\"\n  }, \"info\"), mdx(\"span\", {\n    parentName: \"code\",\n    \"className\": \"token punctuation\"\n  }, \"(\"), mdx(\"span\", {\n    parentName: \"code\",\n    \"className\": \"token string\"\n  }, \"'I am parent'\"), mdx(\"span\", {\n    parentName: \"code\",\n    \"className\": \"token punctuation\"\n  }, \")\"), \"\\n  \", mdx(\"span\", {\n    parentName: \"code\",\n    \"className\": \"token comment\"\n  }, \"// Child action\"), \"\\n  \", mdx(\"span\", {\n    parentName: \"code\",\n    \"className\": \"token function\"\n  }, \"context\"), mdx(\"span\", {\n    parentName: \"code\",\n    \"className\": \"token punctuation\"\n  }, \".\"), mdx(\"span\", {\n    parentName: \"code\",\n    \"className\": \"token function\"\n  }, \"call\"), mdx(\"span\", {\n    parentName: \"code\",\n    \"className\": \"token punctuation\"\n  }, \"(\"), mdx(\"span\", {\n    parentName: \"code\",\n    \"className\": \"token punctuation\"\n  }, \"(\"), mdx(\"span\", {\n    parentName: \"code\",\n    \"className\": \"token punctuation\"\n  }, \")\"), \" \", mdx(\"span\", {\n    parentName: \"code\",\n    \"className\": \"token operator\"\n  }, \"=>\"), \" \", mdx(\"span\", {\n    parentName: \"code\",\n    \"className\": \"token punctuation\"\n  }, \"{\"), \"\\n    console\", mdx(\"span\", {\n    parentName: \"code\",\n    \"className\": \"token punctuation\"\n  }, \".\"), mdx(\"span\", {\n    parentName: \"code\",\n    \"className\": \"token function\"\n  }, \"info\"), mdx(\"span\", {\n    parentName: \"code\",\n    \"className\": \"token punctuation\"\n  }, \"(\"), mdx(\"span\", {\n    parentName: \"code\",\n    \"className\": \"token string\"\n  }, \"'I am child'\"), mdx(\"span\", {\n    parentName: \"code\",\n    \"className\": \"token punctuation\"\n  }, \")\"), \"\\n  \", mdx(\"span\", {\n    parentName: \"code\",\n    \"className\": \"token punctuation\"\n  }, \"}\"), mdx(\"span\", {\n    parentName: \"code\",\n    \"className\": \"token punctuation\"\n  }, \")\"), \"\\n\", mdx(\"span\", {\n    parentName: \"code\",\n    \"className\": \"token punctuation\"\n  }, \"}\"), mdx(\"span\", {\n    parentName: \"code\",\n    \"className\": \"token punctuation\"\n  }, \")\")))), mdx(\"h3\", {\n    \"id\": \"action-promise\",\n    \"style\": {\n      \"position\": \"relative\"\n    }\n  }, mdx(\"a\", {\n    parentName: \"h3\",\n    \"href\": \"#action-promise\",\n    \"aria-label\": \"action promise permalink\",\n    \"className\": \"anchor before\"\n  }, mdx(\"svg\", {\n    parentName: \"a\",\n    \"aria-hidden\": \"true\",\n    \"focusable\": \"false\",\n    \"height\": \"16\",\n    \"version\": \"1.1\",\n    \"viewBox\": \"0 0 16 16\",\n    \"width\": \"16\"\n  }, mdx(\"path\", {\n    parentName: \"svg\",\n    \"fillRule\": \"evenodd\",\n    \"d\": \"M4 9h1v1H4c-1.5 0-3-1.69-3-3.5S2.55 3 4 3h4c1.45 0 3 1.69 3 3.5 0 1.41-.91 2.72-2 3.25V8.59c.58-.45 1-1.27 1-2.09C10 5.22 8.98 4 8 4H4c-.98 0-2 1.22-2 2.5S3 9 4 9zm9-3h-1v1h1c1 0 2 1.22 2 2.5S13.98 12 13 12H9c-.98 0-2-1.22-2-2.5 0-.83.42-1.64 1-2.09V6.25c-1.09.53-2 1.84-2 3.25C6 11.31 7.55 13 9 13h4c1.45 0 3-1.69 3-3.5S14.5 6 13 6z\"\n  }))), \"Action promise\"), mdx(\"p\", null, \"Nikita's actions always resolve \", mdx(\"a\", {\n    parentName: \"p\",\n    \"href\": \"https://nodejs.dev/learn/understanding-javascript-promises\"\n  }, \"Javascript Promises\"), \", they either fulfill with an action output or reject an error. To access the \", mdx(\"a\", {\n    parentName: \"p\",\n    \"href\": \"/current/api/output/\"\n  }, \"action output\"), \", you have to use the Promise API or simply use the \", mdx(\"a\", {\n    parentName: \"p\",\n    \"href\": \"https://nodejs.dev/learn/modern-asynchronous-javascript-with-async-and-await\"\n  }, mdx(\"code\", {\n    parentName: \"a\",\n    \"className\": \"language-text\"\n  }, \"async/await\"), \" construction\"), \" to get the returned value.\"), mdx(\"div\", {\n    \"className\": \"gatsby-highlight\",\n    \"data-language\": \"js\"\n  }, mdx(\"pre\", {\n    parentName: \"div\",\n    \"className\": \"language-js\"\n  }, mdx(\"code\", {\n    parentName: \"pre\",\n    \"className\": \"language-js\"\n  }, mdx(\"span\", {\n    parentName: \"code\",\n    \"className\": \"token comment\"\n  }, \"// Call asynchronous function\"), \"\\n\", mdx(\"span\", {\n    parentName: \"code\",\n    \"className\": \"token punctuation\"\n  }, \"(\"), mdx(\"span\", {\n    parentName: \"code\",\n    \"className\": \"token keyword\"\n  }, \"async\"), \" \", mdx(\"span\", {\n    parentName: \"code\",\n    \"className\": \"token punctuation\"\n  }, \"(\"), mdx(\"span\", {\n    parentName: \"code\",\n    \"className\": \"token punctuation\"\n  }, \")\"), \" \", mdx(\"span\", {\n    parentName: \"code\",\n    \"className\": \"token operator\"\n  }, \"=>\"), \" \", mdx(\"span\", {\n    parentName: \"code\",\n    \"className\": \"token punctuation\"\n  }, \"{\"), \"\\n  \", mdx(\"span\", {\n    parentName: \"code\",\n    \"className\": \"token comment\"\n  }, \"// Define empty array\"), \"\\n  history \", mdx(\"span\", {\n    parentName: \"code\",\n    \"className\": \"token operator\"\n  }, \"=\"), \" \", mdx(\"span\", {\n    parentName: \"code\",\n    \"className\": \"token punctuation\"\n  }, \"[\"), mdx(\"span\", {\n    parentName: \"code\",\n    \"className\": \"token punctuation\"\n  }, \"]\"), \"\\n  \", mdx(\"span\", {\n    parentName: \"code\",\n    \"className\": \"token comment\"\n  }, \"// Access the action output\"), \"\\n  \", mdx(\"span\", {\n    parentName: \"code\",\n    \"className\": \"token keyword\"\n  }, \"const\"), \" result \", mdx(\"span\", {\n    parentName: \"code\",\n    \"className\": \"token operator\"\n  }, \"=\"), \" \", mdx(\"span\", {\n    parentName: \"code\",\n    \"className\": \"token keyword\"\n  }, \"await\"), \" \", mdx(\"span\", {\n    parentName: \"code\",\n    \"className\": \"token function\"\n  }, \"nikita\"), mdx(\"span\", {\n    parentName: \"code\",\n    \"className\": \"token punctuation\"\n  }, \".\"), mdx(\"span\", {\n    parentName: \"code\",\n    \"className\": \"token function\"\n  }, \"call\"), mdx(\"span\", {\n    parentName: \"code\",\n    \"className\": \"token punctuation\"\n  }, \"(\"), mdx(\"span\", {\n    parentName: \"code\",\n    \"className\": \"token punctuation\"\n  }, \"(\"), mdx(\"span\", {\n    parentName: \"code\",\n    \"className\": \"token punctuation\"\n  }, \")\"), \" \", mdx(\"span\", {\n    parentName: \"code\",\n    \"className\": \"token operator\"\n  }, \"=>\"), \" \", mdx(\"span\", {\n    parentName: \"code\",\n    \"className\": \"token string\"\n  }, \"'first'\"), mdx(\"span\", {\n    parentName: \"code\",\n    \"className\": \"token punctuation\"\n  }, \")\"), \"\\n  \", mdx(\"span\", {\n    parentName: \"code\",\n    \"className\": \"token comment\"\n  }, \"// Run next synchronous function\"), \"\\n  history\", mdx(\"span\", {\n    parentName: \"code\",\n    \"className\": \"token punctuation\"\n  }, \".\"), mdx(\"span\", {\n    parentName: \"code\",\n    \"className\": \"token function\"\n  }, \"push\"), mdx(\"span\", {\n    parentName: \"code\",\n    \"className\": \"token punctuation\"\n  }, \"(\"), \"result\", mdx(\"span\", {\n    parentName: \"code\",\n    \"className\": \"token punctuation\"\n  }, \")\"), \"\\n  \", mdx(\"span\", {\n    parentName: \"code\",\n    \"className\": \"token comment\"\n  }, \"// Print array\"), \"\\n  console\", mdx(\"span\", {\n    parentName: \"code\",\n    \"className\": \"token punctuation\"\n  }, \".\"), mdx(\"span\", {\n    parentName: \"code\",\n    \"className\": \"token function\"\n  }, \"info\"), mdx(\"span\", {\n    parentName: \"code\",\n    \"className\": \"token punctuation\"\n  }, \"(\"), \"history\", mdx(\"span\", {\n    parentName: \"code\",\n    \"className\": \"token punctuation\"\n  }, \")\"), \" \", mdx(\"span\", {\n    parentName: \"code\",\n    \"className\": \"token comment\"\n  }, \"// [ 'first' ]\"), \"\\n\", mdx(\"span\", {\n    parentName: \"code\",\n    \"className\": \"token punctuation\"\n  }, \"}\"), mdx(\"span\", {\n    parentName: \"code\",\n    \"className\": \"token punctuation\"\n  }, \")\"), mdx(\"span\", {\n    parentName: \"code\",\n    \"className\": \"token punctuation\"\n  }, \"(\"), mdx(\"span\", {\n    parentName: \"code\",\n    \"className\": \"token punctuation\"\n  }, \")\")))), mdx(\"p\", null, \"Nikita also provides you the guarantee that your actions are executed sequentially. The following example is calling 3 asynchronous actions of various duration. The \", mdx(\"code\", {\n    parentName: \"p\",\n    \"className\": \"language-text\"\n  }, \"history\"), \" array records their order of execution:\"), mdx(\"div\", {\n    \"className\": \"gatsby-highlight\",\n    \"data-language\": \"js\"\n  }, mdx(\"pre\", {\n    parentName: \"div\",\n    \"className\": \"language-js\"\n  }, mdx(\"code\", {\n    parentName: \"pre\",\n    \"className\": \"language-js\"\n  }, mdx(\"span\", {\n    parentName: \"code\",\n    \"className\": \"token keyword\"\n  }, \"const\"), \" assert \", mdx(\"span\", {\n    parentName: \"code\",\n    \"className\": \"token operator\"\n  }, \"=\"), \" \", mdx(\"span\", {\n    parentName: \"code\",\n    \"className\": \"token function\"\n  }, \"require\"), mdx(\"span\", {\n    parentName: \"code\",\n    \"className\": \"token punctuation\"\n  }, \"(\"), mdx(\"span\", {\n    parentName: \"code\",\n    \"className\": \"token string\"\n  }, \"'assert'\"), mdx(\"span\", {\n    parentName: \"code\",\n    \"className\": \"token punctuation\"\n  }, \")\"), mdx(\"span\", {\n    parentName: \"code\",\n    \"className\": \"token punctuation\"\n  }, \";\"), \"\\n\", mdx(\"span\", {\n    parentName: \"code\",\n    \"className\": \"token punctuation\"\n  }, \"(\"), mdx(\"span\", {\n    parentName: \"code\",\n    \"className\": \"token keyword\"\n  }, \"async\"), \" \", mdx(\"span\", {\n    parentName: \"code\",\n    \"className\": \"token punctuation\"\n  }, \"(\"), mdx(\"span\", {\n    parentName: \"code\",\n    \"className\": \"token punctuation\"\n  }, \")\"), \" \", mdx(\"span\", {\n    parentName: \"code\",\n    \"className\": \"token operator\"\n  }, \"=>\"), \" \", mdx(\"span\", {\n    parentName: \"code\",\n    \"className\": \"token punctuation\"\n  }, \"{\"), \"\\n  \", mdx(\"span\", {\n    parentName: \"code\",\n    \"className\": \"token comment\"\n  }, \"// Define empty array\"), \"\\n  \", mdx(\"span\", {\n    parentName: \"code\",\n    \"className\": \"token keyword\"\n  }, \"var\"), \" history \", mdx(\"span\", {\n    parentName: \"code\",\n    \"className\": \"token operator\"\n  }, \"=\"), \" \", mdx(\"span\", {\n    parentName: \"code\",\n    \"className\": \"token punctuation\"\n  }, \"[\"), mdx(\"span\", {\n    parentName: \"code\",\n    \"className\": \"token punctuation\"\n  }, \"]\"), \"\\n  \", mdx(\"span\", {\n    parentName: \"code\",\n    \"className\": \"token comment\"\n  }, \"// Await result from Promise\"), \"\\n  \", mdx(\"span\", {\n    parentName: \"code\",\n    \"className\": \"token keyword\"\n  }, \"var\"), \" result \", mdx(\"span\", {\n    parentName: \"code\",\n    \"className\": \"token operator\"\n  }, \"=\"), \" \", mdx(\"span\", {\n    parentName: \"code\",\n    \"className\": \"token keyword\"\n  }, \"await\"), \" \", mdx(\"span\", {\n    parentName: \"code\",\n    \"className\": \"token function\"\n  }, \"nikita\"), mdx(\"span\", {\n    parentName: \"code\",\n    \"className\": \"token punctuation\"\n  }, \"(\"), mdx(\"span\", {\n    parentName: \"code\",\n    \"className\": \"token keyword\"\n  }, \"async\"), \" \", mdx(\"span\", {\n    parentName: \"code\",\n    \"className\": \"token keyword\"\n  }, \"function\"), mdx(\"span\", {\n    parentName: \"code\",\n    \"className\": \"token punctuation\"\n  }, \"(\"), mdx(\"span\", {\n    parentName: \"code\",\n    \"className\": \"token punctuation\"\n  }, \")\"), \" \", mdx(\"span\", {\n    parentName: \"code\",\n    \"className\": \"token punctuation\"\n  }, \"{\"), \"\\n    \", mdx(\"span\", {\n    parentName: \"code\",\n    \"className\": \"token comment\"\n  }, \"// Call 1st action\"), \"\\n    \", mdx(\"span\", {\n    parentName: \"code\",\n    \"className\": \"token keyword\"\n  }, \"this\"), mdx(\"span\", {\n    parentName: \"code\",\n    \"className\": \"token punctuation\"\n  }, \".\"), mdx(\"span\", {\n    parentName: \"code\",\n    \"className\": \"token function\"\n  }, \"call\"), mdx(\"span\", {\n    parentName: \"code\",\n    \"className\": \"token punctuation\"\n  }, \"(\"), mdx(\"span\", {\n    parentName: \"code\",\n    \"className\": \"token punctuation\"\n  }, \"(\"), mdx(\"span\", {\n    parentName: \"code\",\n    \"className\": \"token punctuation\"\n  }, \")\"), \" \", mdx(\"span\", {\n    parentName: \"code\",\n    \"className\": \"token operator\"\n  }, \"=>\"), \" \", mdx(\"span\", {\n    parentName: \"code\",\n    \"className\": \"token punctuation\"\n  }, \"{\"), \"\\n      \", mdx(\"span\", {\n    parentName: \"code\",\n    \"className\": \"token comment\"\n  }, \"// Fulfilled in 200ms\"), \"\\n      \", mdx(\"span\", {\n    parentName: \"code\",\n    \"className\": \"token keyword\"\n  }, \"return\"), \" \", mdx(\"span\", {\n    parentName: \"code\",\n    \"className\": \"token keyword\"\n  }, \"new\"), \" \", mdx(\"span\", {\n    parentName: \"code\",\n    \"className\": \"token class-name\"\n  }, \"Promise\"), mdx(\"span\", {\n    parentName: \"code\",\n    \"className\": \"token punctuation\"\n  }, \"(\"), mdx(\"span\", {\n    parentName: \"code\",\n    \"className\": \"token punctuation\"\n  }, \"(\"), mdx(\"span\", {\n    parentName: \"code\",\n    \"className\": \"token parameter\"\n  }, \"resolve\"), mdx(\"span\", {\n    parentName: \"code\",\n    \"className\": \"token punctuation\"\n  }, \")\"), \" \", mdx(\"span\", {\n    parentName: \"code\",\n    \"className\": \"token operator\"\n  }, \"=>\"), \" \", mdx(\"span\", {\n    parentName: \"code\",\n    \"className\": \"token punctuation\"\n  }, \"{\"), \"\\n        \", mdx(\"span\", {\n    parentName: \"code\",\n    \"className\": \"token function\"\n  }, \"setTimeout\"), mdx(\"span\", {\n    parentName: \"code\",\n    \"className\": \"token punctuation\"\n  }, \"(\"), mdx(\"span\", {\n    parentName: \"code\",\n    \"className\": \"token punctuation\"\n  }, \"(\"), mdx(\"span\", {\n    parentName: \"code\",\n    \"className\": \"token punctuation\"\n  }, \")\"), \" \", mdx(\"span\", {\n    parentName: \"code\",\n    \"className\": \"token operator\"\n  }, \"=>\"), \" \", mdx(\"span\", {\n    parentName: \"code\",\n    \"className\": \"token punctuation\"\n  }, \"{\"), \"\\n          history\", mdx(\"span\", {\n    parentName: \"code\",\n    \"className\": \"token punctuation\"\n  }, \".\"), mdx(\"span\", {\n    parentName: \"code\",\n    \"className\": \"token function\"\n  }, \"push\"), mdx(\"span\", {\n    parentName: \"code\",\n    \"className\": \"token punctuation\"\n  }, \"(\"), mdx(\"span\", {\n    parentName: \"code\",\n    \"className\": \"token string\"\n  }, \"'first'\"), mdx(\"span\", {\n    parentName: \"code\",\n    \"className\": \"token punctuation\"\n  }, \")\"), \"\\n          \", mdx(\"span\", {\n    parentName: \"code\",\n    \"className\": \"token function\"\n  }, \"resolve\"), mdx(\"span\", {\n    parentName: \"code\",\n    \"className\": \"token punctuation\"\n  }, \"(\"), mdx(\"span\", {\n    parentName: \"code\",\n    \"className\": \"token punctuation\"\n  }, \")\"), \"\\n        \", mdx(\"span\", {\n    parentName: \"code\",\n    \"className\": \"token punctuation\"\n  }, \"}\"), mdx(\"span\", {\n    parentName: \"code\",\n    \"className\": \"token punctuation\"\n  }, \",\"), \" \", mdx(\"span\", {\n    parentName: \"code\",\n    \"className\": \"token number\"\n  }, \"200\"), mdx(\"span\", {\n    parentName: \"code\",\n    \"className\": \"token punctuation\"\n  }, \")\"), \"\\n      \", mdx(\"span\", {\n    parentName: \"code\",\n    \"className\": \"token punctuation\"\n  }, \"}\"), mdx(\"span\", {\n    parentName: \"code\",\n    \"className\": \"token punctuation\"\n  }, \")\"), \"\\n    \", mdx(\"span\", {\n    parentName: \"code\",\n    \"className\": \"token punctuation\"\n  }, \"}\"), mdx(\"span\", {\n    parentName: \"code\",\n    \"className\": \"token punctuation\"\n  }, \")\"), \"\\n    \", mdx(\"span\", {\n    parentName: \"code\",\n    \"className\": \"token comment\"\n  }, \"// Call 2nd action\"), \"\\n    \", mdx(\"span\", {\n    parentName: \"code\",\n    \"className\": \"token keyword\"\n  }, \"this\"), mdx(\"span\", {\n    parentName: \"code\",\n    \"className\": \"token punctuation\"\n  }, \".\"), mdx(\"span\", {\n    parentName: \"code\",\n    \"className\": \"token function\"\n  }, \"call\"), mdx(\"span\", {\n    parentName: \"code\",\n    \"className\": \"token punctuation\"\n  }, \"(\"), mdx(\"span\", {\n    parentName: \"code\",\n    \"className\": \"token punctuation\"\n  }, \"(\"), mdx(\"span\", {\n    parentName: \"code\",\n    \"className\": \"token punctuation\"\n  }, \")\"), \" \", mdx(\"span\", {\n    parentName: \"code\",\n    \"className\": \"token operator\"\n  }, \"=>\"), \" \", mdx(\"span\", {\n    parentName: \"code\",\n    \"className\": \"token punctuation\"\n  }, \"{\"), \"\\n      \", mdx(\"span\", {\n    parentName: \"code\",\n    \"className\": \"token comment\"\n  }, \"// Fulfilled in 100ms\"), \"\\n      \", mdx(\"span\", {\n    parentName: \"code\",\n    \"className\": \"token keyword\"\n  }, \"return\"), \" \", mdx(\"span\", {\n    parentName: \"code\",\n    \"className\": \"token keyword\"\n  }, \"new\"), \" \", mdx(\"span\", {\n    parentName: \"code\",\n    \"className\": \"token class-name\"\n  }, \"Promise\"), mdx(\"span\", {\n    parentName: \"code\",\n    \"className\": \"token punctuation\"\n  }, \"(\"), mdx(\"span\", {\n    parentName: \"code\",\n    \"className\": \"token punctuation\"\n  }, \"(\"), mdx(\"span\", {\n    parentName: \"code\",\n    \"className\": \"token parameter\"\n  }, \"resolve\"), mdx(\"span\", {\n    parentName: \"code\",\n    \"className\": \"token punctuation\"\n  }, \")\"), \" \", mdx(\"span\", {\n    parentName: \"code\",\n    \"className\": \"token operator\"\n  }, \"=>\"), \" \", mdx(\"span\", {\n    parentName: \"code\",\n    \"className\": \"token punctuation\"\n  }, \"{\"), \"\\n        \", mdx(\"span\", {\n    parentName: \"code\",\n    \"className\": \"token function\"\n  }, \"setTimeout\"), mdx(\"span\", {\n    parentName: \"code\",\n    \"className\": \"token punctuation\"\n  }, \"(\"), mdx(\"span\", {\n    parentName: \"code\",\n    \"className\": \"token punctuation\"\n  }, \"(\"), mdx(\"span\", {\n    parentName: \"code\",\n    \"className\": \"token punctuation\"\n  }, \")\"), \" \", mdx(\"span\", {\n    parentName: \"code\",\n    \"className\": \"token operator\"\n  }, \"=>\"), \" \", mdx(\"span\", {\n    parentName: \"code\",\n    \"className\": \"token punctuation\"\n  }, \"{\"), \"\\n          history\", mdx(\"span\", {\n    parentName: \"code\",\n    \"className\": \"token punctuation\"\n  }, \".\"), mdx(\"span\", {\n    parentName: \"code\",\n    \"className\": \"token function\"\n  }, \"push\"), mdx(\"span\", {\n    parentName: \"code\",\n    \"className\": \"token punctuation\"\n  }, \"(\"), mdx(\"span\", {\n    parentName: \"code\",\n    \"className\": \"token string\"\n  }, \"'second'\"), mdx(\"span\", {\n    parentName: \"code\",\n    \"className\": \"token punctuation\"\n  }, \")\"), \"\\n          \", mdx(\"span\", {\n    parentName: \"code\",\n    \"className\": \"token function\"\n  }, \"resolve\"), mdx(\"span\", {\n    parentName: \"code\",\n    \"className\": \"token punctuation\"\n  }, \"(\"), mdx(\"span\", {\n    parentName: \"code\",\n    \"className\": \"token punctuation\"\n  }, \")\"), \"\\n        \", mdx(\"span\", {\n    parentName: \"code\",\n    \"className\": \"token punctuation\"\n  }, \"}\"), mdx(\"span\", {\n    parentName: \"code\",\n    \"className\": \"token punctuation\"\n  }, \",\"), \" \", mdx(\"span\", {\n    parentName: \"code\",\n    \"className\": \"token number\"\n  }, \"100\"), mdx(\"span\", {\n    parentName: \"code\",\n    \"className\": \"token punctuation\"\n  }, \")\"), \"\\n      \", mdx(\"span\", {\n    parentName: \"code\",\n    \"className\": \"token punctuation\"\n  }, \"}\"), mdx(\"span\", {\n    parentName: \"code\",\n    \"className\": \"token punctuation\"\n  }, \")\"), \"\\n    \", mdx(\"span\", {\n    parentName: \"code\",\n    \"className\": \"token punctuation\"\n  }, \"}\"), mdx(\"span\", {\n    parentName: \"code\",\n    \"className\": \"token punctuation\"\n  }, \")\"), \"\\n    \", mdx(\"span\", {\n    parentName: \"code\",\n    \"className\": \"token comment\"\n  }, \"// Return 3rd action\"), \"\\n    \", mdx(\"span\", {\n    parentName: \"code\",\n    \"className\": \"token keyword\"\n  }, \"return\"), \" \", mdx(\"span\", {\n    parentName: \"code\",\n    \"className\": \"token keyword\"\n  }, \"this\"), mdx(\"span\", {\n    parentName: \"code\",\n    \"className\": \"token punctuation\"\n  }, \".\"), mdx(\"span\", {\n    parentName: \"code\",\n    \"className\": \"token function\"\n  }, \"call\"), mdx(\"span\", {\n    parentName: \"code\",\n    \"className\": \"token punctuation\"\n  }, \"(\"), mdx(\"span\", {\n    parentName: \"code\",\n    \"className\": \"token punctuation\"\n  }, \"(\"), mdx(\"span\", {\n    parentName: \"code\",\n    \"className\": \"token punctuation\"\n  }, \")\"), \" \", mdx(\"span\", {\n    parentName: \"code\",\n    \"className\": \"token operator\"\n  }, \"=>\"), \" \", mdx(\"span\", {\n    parentName: \"code\",\n    \"className\": \"token punctuation\"\n  }, \"{\"), \"\\n      \", mdx(\"span\", {\n    parentName: \"code\",\n    \"className\": \"token keyword\"\n  }, \"return\"), \" \", mdx(\"span\", {\n    parentName: \"code\",\n    \"className\": \"token string\"\n  }, \"'done'\"), \"\\n    \", mdx(\"span\", {\n    parentName: \"code\",\n    \"className\": \"token punctuation\"\n  }, \"}\"), mdx(\"span\", {\n    parentName: \"code\",\n    \"className\": \"token punctuation\"\n  }, \")\"), \"\\n  \", mdx(\"span\", {\n    parentName: \"code\",\n    \"className\": \"token punctuation\"\n  }, \"}\"), mdx(\"span\", {\n    parentName: \"code\",\n    \"className\": \"token punctuation\"\n  }, \")\"), \"\\n  \", mdx(\"span\", {\n    parentName: \"code\",\n    \"className\": \"token comment\"\n  }, \"// Assert sequential execution\"), \"\\n  assert\", mdx(\"span\", {\n    parentName: \"code\",\n    \"className\": \"token punctuation\"\n  }, \".\"), mdx(\"span\", {\n    parentName: \"code\",\n    \"className\": \"token function\"\n  }, \"equal\"), mdx(\"span\", {\n    parentName: \"code\",\n    \"className\": \"token punctuation\"\n  }, \"(\"), \"result\", mdx(\"span\", {\n    parentName: \"code\",\n    \"className\": \"token punctuation\"\n  }, \",\"), \" \", mdx(\"span\", {\n    parentName: \"code\",\n    \"className\": \"token string\"\n  }, \"'done'\"), mdx(\"span\", {\n    parentName: \"code\",\n    \"className\": \"token punctuation\"\n  }, \")\"), \"\\n  assert\", mdx(\"span\", {\n    parentName: \"code\",\n    \"className\": \"token punctuation\"\n  }, \".\"), mdx(\"span\", {\n    parentName: \"code\",\n    \"className\": \"token function\"\n  }, \"deepEqual\"), mdx(\"span\", {\n    parentName: \"code\",\n    \"className\": \"token punctuation\"\n  }, \"(\"), \"history\", mdx(\"span\", {\n    parentName: \"code\",\n    \"className\": \"token punctuation\"\n  }, \",\"), \" \", mdx(\"span\", {\n    parentName: \"code\",\n    \"className\": \"token punctuation\"\n  }, \"[\"), mdx(\"span\", {\n    parentName: \"code\",\n    \"className\": \"token string\"\n  }, \"'first'\"), mdx(\"span\", {\n    parentName: \"code\",\n    \"className\": \"token punctuation\"\n  }, \",\"), mdx(\"span\", {\n    parentName: \"code\",\n    \"className\": \"token string\"\n  }, \"'second'\"), mdx(\"span\", {\n    parentName: \"code\",\n    \"className\": \"token punctuation\"\n  }, \"]\"), mdx(\"span\", {\n    parentName: \"code\",\n    \"className\": \"token punctuation\"\n  }, \")\"), \"\\n\", mdx(\"span\", {\n    parentName: \"code\",\n    \"className\": \"token punctuation\"\n  }, \"}\"), mdx(\"span\", {\n    parentName: \"code\",\n    \"className\": \"token punctuation\"\n  }, \")\"), mdx(\"span\", {\n    parentName: \"code\",\n    \"className\": \"token punctuation\"\n  }, \"(\"), mdx(\"span\", {\n    parentName: \"code\",\n    \"className\": \"token punctuation\"\n  }, \")\"), \"\\n\"))), mdx(\"h3\", {\n    \"id\": \"error-handling\",\n    \"style\": {\n      \"position\": \"relative\"\n    }\n  }, mdx(\"a\", {\n    parentName: \"h3\",\n    \"href\": \"#error-handling\",\n    \"aria-label\": \"error handling permalink\",\n    \"className\": \"anchor before\"\n  }, mdx(\"svg\", {\n    parentName: \"a\",\n    \"aria-hidden\": \"true\",\n    \"focusable\": \"false\",\n    \"height\": \"16\",\n    \"version\": \"1.1\",\n    \"viewBox\": \"0 0 16 16\",\n    \"width\": \"16\"\n  }, mdx(\"path\", {\n    parentName: \"svg\",\n    \"fillRule\": \"evenodd\",\n    \"d\": \"M4 9h1v1H4c-1.5 0-3-1.69-3-3.5S2.55 3 4 3h4c1.45 0 3 1.69 3 3.5 0 1.41-.91 2.72-2 3.25V8.59c.58-.45 1-1.27 1-2.09C10 5.22 8.98 4 8 4H4c-.98 0-2 1.22-2 2.5S3 9 4 9zm9-3h-1v1h1c1 0 2 1.22 2 2.5S13.98 12 13 12H9c-.98 0-2-1.22-2-2.5 0-.83.42-1.64 1-2.09V6.25c-1.09.53-2 1.84-2 3.25C6 11.31 7.55 13 9 13h4c1.45 0 3-1.69 3-3.5S14.5 6 13 6z\"\n  }))), \"Error handling\"), mdx(\"p\", null, \"However, since actions returned promises, they cannot throw errors and stop the execution flow. To ensure errors are properly handled, it is your responsibility to raise them.\"), mdx(\"p\", null, \"The above example must be rewritten to raise errors. For example, using the \", mdx(\"code\", {\n    parentName: \"p\",\n    \"className\": \"language-text\"\n  }, \"await\"), \" keyword, a simpler code looks like:\"), mdx(\"div\", {\n    \"className\": \"gatsby-highlight\",\n    \"data-language\": \"js\"\n  }, mdx(\"pre\", {\n    parentName: \"div\",\n    \"className\": \"language-js\"\n  }, mdx(\"code\", {\n    parentName: \"pre\",\n    \"className\": \"language-js\"\n  }, mdx(\"span\", {\n    parentName: \"code\",\n    \"className\": \"token keyword\"\n  }, \"const\"), \" assert \", mdx(\"span\", {\n    parentName: \"code\",\n    \"className\": \"token operator\"\n  }, \"=\"), \" \", mdx(\"span\", {\n    parentName: \"code\",\n    \"className\": \"token function\"\n  }, \"require\"), mdx(\"span\", {\n    parentName: \"code\",\n    \"className\": \"token punctuation\"\n  }, \"(\"), mdx(\"span\", {\n    parentName: \"code\",\n    \"className\": \"token string\"\n  }, \"'assert'\"), mdx(\"span\", {\n    parentName: \"code\",\n    \"className\": \"token punctuation\"\n  }, \")\"), mdx(\"span\", {\n    parentName: \"code\",\n    \"className\": \"token punctuation\"\n  }, \";\"), \"\\n\", mdx(\"span\", {\n    parentName: \"code\",\n    \"className\": \"token punctuation\"\n  }, \"(\"), mdx(\"span\", {\n    parentName: \"code\",\n    \"className\": \"token keyword\"\n  }, \"async\"), \" \", mdx(\"span\", {\n    parentName: \"code\",\n    \"className\": \"token punctuation\"\n  }, \"(\"), mdx(\"span\", {\n    parentName: \"code\",\n    \"className\": \"token punctuation\"\n  }, \")\"), \" \", mdx(\"span\", {\n    parentName: \"code\",\n    \"className\": \"token operator\"\n  }, \"=>\"), \" \", mdx(\"span\", {\n    parentName: \"code\",\n    \"className\": \"token punctuation\"\n  }, \"{\"), \"\\n  \", mdx(\"span\", {\n    parentName: \"code\",\n    \"className\": \"token keyword\"\n  }, \"try\"), \" \", mdx(\"span\", {\n    parentName: \"code\",\n    \"className\": \"token punctuation\"\n  }, \"{\"), \"\\n    \", mdx(\"span\", {\n    parentName: \"code\",\n    \"className\": \"token keyword\"\n  }, \"await\"), \" \", mdx(\"span\", {\n    parentName: \"code\",\n    \"className\": \"token function\"\n  }, \"nikita\"), mdx(\"span\", {\n    parentName: \"code\",\n    \"className\": \"token punctuation\"\n  }, \"(\"), mdx(\"span\", {\n    parentName: \"code\",\n    \"className\": \"token keyword\"\n  }, \"async\"), \" \", mdx(\"span\", {\n    parentName: \"code\",\n    \"className\": \"token keyword\"\n  }, \"function\"), mdx(\"span\", {\n    parentName: \"code\",\n    \"className\": \"token punctuation\"\n  }, \"(\"), mdx(\"span\", {\n    parentName: \"code\",\n    \"className\": \"token punctuation\"\n  }, \")\"), \" \", mdx(\"span\", {\n    parentName: \"code\",\n    \"className\": \"token punctuation\"\n  }, \"{\"), \"\\n      \", mdx(\"span\", {\n    parentName: \"code\",\n    \"className\": \"token keyword\"\n  }, \"await\"), \" \", mdx(\"span\", {\n    parentName: \"code\",\n    \"className\": \"token keyword\"\n  }, \"this\"), mdx(\"span\", {\n    parentName: \"code\",\n    \"className\": \"token punctuation\"\n  }, \".\"), mdx(\"span\", {\n    parentName: \"code\",\n    \"className\": \"token function\"\n  }, \"call\"), mdx(\"span\", {\n    parentName: \"code\",\n    \"className\": \"token punctuation\"\n  }, \"(\"), mdx(\"span\", {\n    parentName: \"code\",\n    \"className\": \"token keyword\"\n  }, \"function\"), mdx(\"span\", {\n    parentName: \"code\",\n    \"className\": \"token punctuation\"\n  }, \"(\"), mdx(\"span\", {\n    parentName: \"code\",\n    \"className\": \"token punctuation\"\n  }, \")\"), \" \", mdx(\"span\", {\n    parentName: \"code\",\n    \"className\": \"token punctuation\"\n  }, \"{\"), \"\\n        console\", mdx(\"span\", {\n    parentName: \"code\",\n    \"className\": \"token punctuation\"\n  }, \".\"), mdx(\"span\", {\n    parentName: \"code\",\n    \"className\": \"token function\"\n  }, \"info\"), mdx(\"span\", {\n    parentName: \"code\",\n    \"className\": \"token punctuation\"\n  }, \"(\"), mdx(\"span\", {\n    parentName: \"code\",\n    \"className\": \"token string\"\n  }, \"'called'\"), mdx(\"span\", {\n    parentName: \"code\",\n    \"className\": \"token punctuation\"\n  }, \")\"), \"\\n      \", mdx(\"span\", {\n    parentName: \"code\",\n    \"className\": \"token punctuation\"\n  }, \"}\"), mdx(\"span\", {\n    parentName: \"code\",\n    \"className\": \"token punctuation\"\n  }, \")\"), \"\\n      \", mdx(\"span\", {\n    parentName: \"code\",\n    \"className\": \"token keyword\"\n  }, \"await\"), \" \", mdx(\"span\", {\n    parentName: \"code\",\n    \"className\": \"token keyword\"\n  }, \"this\"), mdx(\"span\", {\n    parentName: \"code\",\n    \"className\": \"token punctuation\"\n  }, \".\"), mdx(\"span\", {\n    parentName: \"code\",\n    \"className\": \"token function\"\n  }, \"call\"), mdx(\"span\", {\n    parentName: \"code\",\n    \"className\": \"token punctuation\"\n  }, \"(\"), mdx(\"span\", {\n    parentName: \"code\",\n    \"className\": \"token keyword\"\n  }, \"function\"), mdx(\"span\", {\n    parentName: \"code\",\n    \"className\": \"token punctuation\"\n  }, \"(\"), mdx(\"span\", {\n    parentName: \"code\",\n    \"className\": \"token punctuation\"\n  }, \")\"), \" \", mdx(\"span\", {\n    parentName: \"code\",\n    \"className\": \"token punctuation\"\n  }, \"{\"), \"\\n        \", mdx(\"span\", {\n    parentName: \"code\",\n    \"className\": \"token keyword\"\n  }, \"throw\"), \" \", mdx(\"span\", {\n    parentName: \"code\",\n    \"className\": \"token keyword\"\n  }, \"new\"), \" \", mdx(\"span\", {\n    parentName: \"code\",\n    \"className\": \"token class-name\"\n  }, \"Error\"), mdx(\"span\", {\n    parentName: \"code\",\n    \"className\": \"token punctuation\"\n  }, \"(\"), mdx(\"span\", {\n    parentName: \"code\",\n    \"className\": \"token string\"\n  }, \"'catch me'\"), mdx(\"span\", {\n    parentName: \"code\",\n    \"className\": \"token punctuation\"\n  }, \")\"), \"\\n      \", mdx(\"span\", {\n    parentName: \"code\",\n    \"className\": \"token punctuation\"\n  }, \"}\"), mdx(\"span\", {\n    parentName: \"code\",\n    \"className\": \"token punctuation\"\n  }, \")\"), \"\\n      \", mdx(\"span\", {\n    parentName: \"code\",\n    \"className\": \"token keyword\"\n  }, \"await\"), \" \", mdx(\"span\", {\n    parentName: \"code\",\n    \"className\": \"token keyword\"\n  }, \"this\"), mdx(\"span\", {\n    parentName: \"code\",\n    \"className\": \"token punctuation\"\n  }, \".\"), mdx(\"span\", {\n    parentName: \"code\",\n    \"className\": \"token function\"\n  }, \"call\"), mdx(\"span\", {\n    parentName: \"code\",\n    \"className\": \"token punctuation\"\n  }, \"(\"), mdx(\"span\", {\n    parentName: \"code\",\n    \"className\": \"token keyword\"\n  }, \"function\"), mdx(\"span\", {\n    parentName: \"code\",\n    \"className\": \"token punctuation\"\n  }, \"(\"), mdx(\"span\", {\n    parentName: \"code\",\n    \"className\": \"token punctuation\"\n  }, \")\"), \" \", mdx(\"span\", {\n    parentName: \"code\",\n    \"className\": \"token punctuation\"\n  }, \"{\"), \"\\n        console\", mdx(\"span\", {\n    parentName: \"code\",\n    \"className\": \"token punctuation\"\n  }, \".\"), mdx(\"span\", {\n    parentName: \"code\",\n    \"className\": \"token function\"\n  }, \"error\"), mdx(\"span\", {\n    parentName: \"code\",\n    \"className\": \"token punctuation\"\n  }, \"(\"), mdx(\"span\", {\n    parentName: \"code\",\n    \"className\": \"token string\"\n  }, \"'never called'\"), mdx(\"span\", {\n    parentName: \"code\",\n    \"className\": \"token punctuation\"\n  }, \")\"), \"\\n      \", mdx(\"span\", {\n    parentName: \"code\",\n    \"className\": \"token punctuation\"\n  }, \"}\"), mdx(\"span\", {\n    parentName: \"code\",\n    \"className\": \"token punctuation\"\n  }, \")\"), \"\\n    \", mdx(\"span\", {\n    parentName: \"code\",\n    \"className\": \"token punctuation\"\n  }, \"}\"), mdx(\"span\", {\n    parentName: \"code\",\n    \"className\": \"token punctuation\"\n  }, \")\"), \"\\n  \", mdx(\"span\", {\n    parentName: \"code\",\n    \"className\": \"token punctuation\"\n  }, \"}\"), \" \", mdx(\"span\", {\n    parentName: \"code\",\n    \"className\": \"token keyword\"\n  }, \"catch\"), mdx(\"span\", {\n    parentName: \"code\",\n    \"className\": \"token punctuation\"\n  }, \"(\"), \"err\", mdx(\"span\", {\n    parentName: \"code\",\n    \"className\": \"token punctuation\"\n  }, \")\"), \" \", mdx(\"span\", {\n    parentName: \"code\",\n    \"className\": \"token punctuation\"\n  }, \"{\"), \"\\n    assert\", mdx(\"span\", {\n    parentName: \"code\",\n    \"className\": \"token punctuation\"\n  }, \".\"), mdx(\"span\", {\n    parentName: \"code\",\n    \"className\": \"token function\"\n  }, \"equal\"), mdx(\"span\", {\n    parentName: \"code\",\n    \"className\": \"token punctuation\"\n  }, \"(\"), \"err\", mdx(\"span\", {\n    parentName: \"code\",\n    \"className\": \"token punctuation\"\n  }, \".\"), \"message\", mdx(\"span\", {\n    parentName: \"code\",\n    \"className\": \"token punctuation\"\n  }, \",\"), \" \", mdx(\"span\", {\n    parentName: \"code\",\n    \"className\": \"token string\"\n  }, \"'catch me'\"), mdx(\"span\", {\n    parentName: \"code\",\n    \"className\": \"token punctuation\"\n  }, \")\"), \"\\n  \", mdx(\"span\", {\n    parentName: \"code\",\n    \"className\": \"token punctuation\"\n  }, \"}\"), \"\\n\", mdx(\"span\", {\n    parentName: \"code\",\n    \"className\": \"token punctuation\"\n  }, \"}\"), mdx(\"span\", {\n    parentName: \"code\",\n    \"className\": \"token punctuation\"\n  }, \")\"), mdx(\"span\", {\n    parentName: \"code\",\n    \"className\": \"token punctuation\"\n  }, \"(\"), mdx(\"span\", {\n    parentName: \"code\",\n    \"className\": \"token punctuation\"\n  }, \")\")))), mdx(\"h3\", {\n    \"id\": \"cascading-outputs-and-errors\",\n    \"style\": {\n      \"position\": \"relative\"\n    }\n  }, mdx(\"a\", {\n    parentName: \"h3\",\n    \"href\": \"#cascading-outputs-and-errors\",\n    \"aria-label\": \"cascading outputs and errors permalink\",\n    \"className\": \"anchor before\"\n  }, mdx(\"svg\", {\n    parentName: \"a\",\n    \"aria-hidden\": \"true\",\n    \"focusable\": \"false\",\n    \"height\": \"16\",\n    \"version\": \"1.1\",\n    \"viewBox\": \"0 0 16 16\",\n    \"width\": \"16\"\n  }, mdx(\"path\", {\n    parentName: \"svg\",\n    \"fillRule\": \"evenodd\",\n    \"d\": \"M4 9h1v1H4c-1.5 0-3-1.69-3-3.5S2.55 3 4 3h4c1.45 0 3 1.69 3 3.5 0 1.41-.91 2.72-2 3.25V8.59c.58-.45 1-1.27 1-2.09C10 5.22 8.98 4 8 4H4c-.98 0-2 1.22-2 2.5S3 9 4 9zm9-3h-1v1h1c1 0 2 1.22 2 2.5S13.98 12 13 12H9c-.98 0-2-1.22-2-2.5 0-.83.42-1.64 1-2.09V6.25c-1.09.53-2 1.84-2 3.25C6 11.31 7.55 13 9 13h4c1.45 0 3-1.69 3-3.5S14.5 6 13 6z\"\n  }))), \"Cascading outputs and errors\"), mdx(\"p\", null, \"Instead of throw an error, it is also possible to return the promise of a child action. This way, both resolved output and errors are cascaded up to the parent actions:\"), mdx(\"div\", {\n    \"className\": \"gatsby-highlight\",\n    \"data-language\": \"js\"\n  }, mdx(\"pre\", {\n    parentName: \"div\",\n    \"className\": \"language-js\"\n  }, mdx(\"code\", {\n    parentName: \"pre\",\n    \"className\": \"language-js\"\n  }, mdx(\"span\", {\n    parentName: \"code\",\n    \"className\": \"token punctuation\"\n  }, \"(\"), mdx(\"span\", {\n    parentName: \"code\",\n    \"className\": \"token keyword\"\n  }, \"async\"), \" \", mdx(\"span\", {\n    parentName: \"code\",\n    \"className\": \"token punctuation\"\n  }, \"(\"), mdx(\"span\", {\n    parentName: \"code\",\n    \"className\": \"token punctuation\"\n  }, \")\"), \" \", mdx(\"span\", {\n    parentName: \"code\",\n    \"className\": \"token operator\"\n  }, \"=>\"), \" \", mdx(\"span\", {\n    parentName: \"code\",\n    \"className\": \"token punctuation\"\n  }, \"{\"), \"\\n  \", mdx(\"span\", {\n    parentName: \"code\",\n    \"className\": \"token keyword\"\n  }, \"try\"), \" \", mdx(\"span\", {\n    parentName: \"code\",\n    \"className\": \"token punctuation\"\n  }, \"{\"), \"\\n    \", mdx(\"span\", {\n    parentName: \"code\",\n    \"className\": \"token keyword\"\n  }, \"const\"), \" \", mdx(\"span\", {\n    parentName: \"code\",\n    \"className\": \"token punctuation\"\n  }, \"{\"), \"date\", mdx(\"span\", {\n    parentName: \"code\",\n    \"className\": \"token punctuation\"\n  }, \"}\"), \" \", mdx(\"span\", {\n    parentName: \"code\",\n    \"className\": \"token operator\"\n  }, \"=\"), \" \", mdx(\"span\", {\n    parentName: \"code\",\n    \"className\": \"token keyword\"\n  }, \"await\"), \" \", mdx(\"span\", {\n    parentName: \"code\",\n    \"className\": \"token function\"\n  }, \"nikita\"), mdx(\"span\", {\n    parentName: \"code\",\n    \"className\": \"token punctuation\"\n  }, \"(\"), mdx(\"span\", {\n    parentName: \"code\",\n    \"className\": \"token keyword\"\n  }, \"function\"), mdx(\"span\", {\n    parentName: \"code\",\n    \"className\": \"token punctuation\"\n  }, \"(\"), mdx(\"span\", {\n    parentName: \"code\",\n    \"className\": \"token punctuation\"\n  }, \")\"), \" \", mdx(\"span\", {\n    parentName: \"code\",\n    \"className\": \"token punctuation\"\n  }, \"{\"), \"\\n      \", mdx(\"span\", {\n    parentName: \"code\",\n    \"className\": \"token keyword\"\n  }, \"return\"), \" \", mdx(\"span\", {\n    parentName: \"code\",\n    \"className\": \"token keyword\"\n  }, \"this\"), mdx(\"span\", {\n    parentName: \"code\",\n    \"className\": \"token punctuation\"\n  }, \".\"), mdx(\"span\", {\n    parentName: \"code\",\n    \"className\": \"token function\"\n  }, \"call\"), mdx(\"span\", {\n    parentName: \"code\",\n    \"className\": \"token punctuation\"\n  }, \"(\"), mdx(\"span\", {\n    parentName: \"code\",\n    \"className\": \"token keyword\"\n  }, \"function\"), mdx(\"span\", {\n    parentName: \"code\",\n    \"className\": \"token punctuation\"\n  }, \"(\"), mdx(\"span\", {\n    parentName: \"code\",\n    \"className\": \"token punctuation\"\n  }, \")\"), \" \", mdx(\"span\", {\n    parentName: \"code\",\n    \"className\": \"token punctuation\"\n  }, \"{\"), \"\\n        \", mdx(\"span\", {\n    parentName: \"code\",\n    \"className\": \"token keyword\"\n  }, \"return\"), \" \", mdx(\"span\", {\n    parentName: \"code\",\n    \"className\": \"token keyword\"\n  }, \"this\"), mdx(\"span\", {\n    parentName: \"code\",\n    \"className\": \"token punctuation\"\n  }, \".\"), mdx(\"span\", {\n    parentName: \"code\",\n    \"className\": \"token function\"\n  }, \"call\"), mdx(\"span\", {\n    parentName: \"code\",\n    \"className\": \"token punctuation\"\n  }, \"(\"), mdx(\"span\", {\n    parentName: \"code\",\n    \"className\": \"token keyword\"\n  }, \"function\"), mdx(\"span\", {\n    parentName: \"code\",\n    \"className\": \"token punctuation\"\n  }, \"(\"), mdx(\"span\", {\n    parentName: \"code\",\n    \"className\": \"token punctuation\"\n  }, \")\"), \" \", mdx(\"span\", {\n    parentName: \"code\",\n    \"className\": \"token punctuation\"\n  }, \"{\"), \"\\n          \", mdx(\"span\", {\n    parentName: \"code\",\n    \"className\": \"token keyword\"\n  }, \"const\"), \" today \", mdx(\"span\", {\n    parentName: \"code\",\n    \"className\": \"token operator\"\n  }, \"=\"), \" \", mdx(\"span\", {\n    parentName: \"code\",\n    \"className\": \"token keyword\"\n  }, \"new\"), \" \", mdx(\"span\", {\n    parentName: \"code\",\n    \"className\": \"token class-name\"\n  }, \"Date\"), mdx(\"span\", {\n    parentName: \"code\",\n    \"className\": \"token punctuation\"\n  }, \"(\"), mdx(\"span\", {\n    parentName: \"code\",\n    \"className\": \"token punctuation\"\n  }, \")\"), \"\\n          \", mdx(\"span\", {\n    parentName: \"code\",\n    \"className\": \"token keyword\"\n  }, \"if\"), mdx(\"span\", {\n    parentName: \"code\",\n    \"className\": \"token punctuation\"\n  }, \"(\"), mdx(\"span\", {\n    parentName: \"code\",\n    \"className\": \"token punctuation\"\n  }, \"(\"), \"today\", mdx(\"span\", {\n    parentName: \"code\",\n    \"className\": \"token punctuation\"\n  }, \")\"), mdx(\"span\", {\n    parentName: \"code\",\n    \"className\": \"token punctuation\"\n  }, \".\"), mdx(\"span\", {\n    parentName: \"code\",\n    \"className\": \"token function\"\n  }, \"getDate\"), mdx(\"span\", {\n    parentName: \"code\",\n    \"className\": \"token punctuation\"\n  }, \"(\"), mdx(\"span\", {\n    parentName: \"code\",\n    \"className\": \"token punctuation\"\n  }, \")\"), \" \", mdx(\"span\", {\n    parentName: \"code\",\n    \"className\": \"token operator\"\n  }, \"===\"), \" \", mdx(\"span\", {\n    parentName: \"code\",\n    \"className\": \"token number\"\n  }, \"1\"), mdx(\"span\", {\n    parentName: \"code\",\n    \"className\": \"token punctuation\"\n  }, \")\"), \" \", mdx(\"span\", {\n    parentName: \"code\",\n    \"className\": \"token punctuation\"\n  }, \"{\"), \"\\n            \", mdx(\"span\", {\n    parentName: \"code\",\n    \"className\": \"token keyword\"\n  }, \"return\"), \" \", mdx(\"span\", {\n    parentName: \"code\",\n    \"className\": \"token punctuation\"\n  }, \"{\"), mdx(\"span\", {\n    parentName: \"code\",\n    \"className\": \"token literal-property property\"\n  }, \"date\"), mdx(\"span\", {\n    parentName: \"code\",\n    \"className\": \"token operator\"\n  }, \":\"), \" today\", mdx(\"span\", {\n    parentName: \"code\",\n    \"className\": \"token punctuation\"\n  }, \"}\"), \"\\n          \", mdx(\"span\", {\n    parentName: \"code\",\n    \"className\": \"token punctuation\"\n  }, \"}\"), \" \", mdx(\"span\", {\n    parentName: \"code\",\n    \"className\": \"token keyword\"\n  }, \"else\"), \" \", mdx(\"span\", {\n    parentName: \"code\",\n    \"className\": \"token punctuation\"\n  }, \"{\"), \"\\n            \", mdx(\"span\", {\n    parentName: \"code\",\n    \"className\": \"token keyword\"\n  }, \"throw\"), \" \", mdx(\"span\", {\n    parentName: \"code\",\n    \"className\": \"token function\"\n  }, \"Error\"), mdx(\"span\", {\n    parentName: \"code\",\n    \"className\": \"token punctuation\"\n  }, \"(\"), mdx(\"span\", {\n    parentName: \"code\",\n    \"className\": \"token string\"\n  }, \"\\\"Today is not the first day of the month\\\"\"), mdx(\"span\", {\n    parentName: \"code\",\n    \"className\": \"token punctuation\"\n  }, \")\"), \"\\n          \", mdx(\"span\", {\n    parentName: \"code\",\n    \"className\": \"token punctuation\"\n  }, \"}\"), \"\\n        \", mdx(\"span\", {\n    parentName: \"code\",\n    \"className\": \"token punctuation\"\n  }, \"}\"), mdx(\"span\", {\n    parentName: \"code\",\n    \"className\": \"token punctuation\"\n  }, \")\"), \"\\n      \", mdx(\"span\", {\n    parentName: \"code\",\n    \"className\": \"token punctuation\"\n  }, \"}\"), mdx(\"span\", {\n    parentName: \"code\",\n    \"className\": \"token punctuation\"\n  }, \")\"), \"\\n    \", mdx(\"span\", {\n    parentName: \"code\",\n    \"className\": \"token punctuation\"\n  }, \"}\"), mdx(\"span\", {\n    parentName: \"code\",\n    \"className\": \"token punctuation\"\n  }, \")\"), \"\\n    console\", mdx(\"span\", {\n    parentName: \"code\",\n    \"className\": \"token punctuation\"\n  }, \".\"), mdx(\"span\", {\n    parentName: \"code\",\n    \"className\": \"token function\"\n  }, \"info\"), mdx(\"span\", {\n    parentName: \"code\",\n    \"className\": \"token punctuation\"\n  }, \"(\"), \"date\", mdx(\"span\", {\n    parentName: \"code\",\n    \"className\": \"token punctuation\"\n  }, \")\"), \"\\n  \", mdx(\"span\", {\n    parentName: \"code\",\n    \"className\": \"token punctuation\"\n  }, \"}\"), \" \", mdx(\"span\", {\n    parentName: \"code\",\n    \"className\": \"token keyword\"\n  }, \"catch\"), mdx(\"span\", {\n    parentName: \"code\",\n    \"className\": \"token punctuation\"\n  }, \"(\"), \"err\", mdx(\"span\", {\n    parentName: \"code\",\n    \"className\": \"token punctuation\"\n  }, \")\"), \" \", mdx(\"span\", {\n    parentName: \"code\",\n    \"className\": \"token punctuation\"\n  }, \"{\"), \"\\n    console\", mdx(\"span\", {\n    parentName: \"code\",\n    \"className\": \"token punctuation\"\n  }, \".\"), mdx(\"span\", {\n    parentName: \"code\",\n    \"className\": \"token function\"\n  }, \"error\"), mdx(\"span\", {\n    parentName: \"code\",\n    \"className\": \"token punctuation\"\n  }, \"(\"), \"err\", mdx(\"span\", {\n    parentName: \"code\",\n    \"className\": \"token punctuation\"\n  }, \".\"), \"message\", mdx(\"span\", {\n    parentName: \"code\",\n    \"className\": \"token punctuation\"\n  }, \")\"), \"\\n  \", mdx(\"span\", {\n    parentName: \"code\",\n    \"className\": \"token punctuation\"\n  }, \"}\"), \"\\n\", mdx(\"span\", {\n    parentName: \"code\",\n    \"className\": \"token punctuation\"\n  }, \"}\"), mdx(\"span\", {\n    parentName: \"code\",\n    \"className\": \"token punctuation\"\n  }, \")\"), mdx(\"span\", {\n    parentName: \"code\",\n    \"className\": \"token punctuation\"\n  }, \"(\"), mdx(\"span\", {\n    parentName: \"code\",\n    \"className\": \"token punctuation\"\n  }, \")\")))), mdx(\"h3\", {\n    \"id\": \"passing-metadata\",\n    \"style\": {\n      \"position\": \"relative\"\n    }\n  }, mdx(\"a\", {\n    parentName: \"h3\",\n    \"href\": \"#passing-metadata\",\n    \"aria-label\": \"passing metadata permalink\",\n    \"className\": \"anchor before\"\n  }, mdx(\"svg\", {\n    parentName: \"a\",\n    \"aria-hidden\": \"true\",\n    \"focusable\": \"false\",\n    \"height\": \"16\",\n    \"version\": \"1.1\",\n    \"viewBox\": \"0 0 16 16\",\n    \"width\": \"16\"\n  }, mdx(\"path\", {\n    parentName: \"svg\",\n    \"fillRule\": \"evenodd\",\n    \"d\": \"M4 9h1v1H4c-1.5 0-3-1.69-3-3.5S2.55 3 4 3h4c1.45 0 3 1.69 3 3.5 0 1.41-.91 2.72-2 3.25V8.59c.58-.45 1-1.27 1-2.09C10 5.22 8.98 4 8 4H4c-.98 0-2 1.22-2 2.5S3 9 4 9zm9-3h-1v1h1c1 0 2 1.22 2 2.5S13.98 12 13 12H9c-.98 0-2-1.22-2-2.5 0-.83.42-1.64 1-2.09V6.25c-1.09.53-2 1.84-2 3.25C6 11.31 7.55 13 9 13h4c1.45 0 3-1.69 3-3.5S14.5 6 13 6z\"\n  }))), \"Passing \", mdx(\"code\", {\n    parentName: \"h3\",\n    \"className\": \"language-text\"\n  }, \"metadata\")), mdx(\"p\", null, \"Several properties are generic and globally available for every action. Examples include the \", mdx(\"code\", {\n    parentName: \"p\",\n    \"className\": \"language-text\"\n  }, \"header\"), \", \", mdx(\"code\", {\n    parentName: \"p\",\n    \"className\": \"language-text\"\n  }, \"retry\"), \" and \", mdx(\"code\", {\n    parentName: \"p\",\n    \"className\": \"language-text\"\n  }, \"relax\"), \" properties. Those are called \", mdx(\"a\", {\n    parentName: \"p\",\n    \"href\": \"/current/api/metadata/\"\n  }, \"metadata properties\"), \".\"), mdx(\"p\", null, \"They are not to be confused with \", mdx(\"a\", {\n    parentName: \"p\",\n    \"href\": \"/current/api/config/\"\n  }, \"configuration properties\"), \". A configuration property is declared and used by a single action. A metadata property applies to multiple if not all actions and are usually declared inside a plugin.\"), mdx(\"p\", null, \"To avoid naming collisions with configuration properties, metadata properties are prefixed with a dollar sign (\", mdx(\"code\", {\n    parentName: \"p\",\n    \"className\": \"language-text\"\n  }, \"$\"), \") and are available inside the action under the \", mdx(\"code\", {\n    parentName: \"p\",\n    \"className\": \"language-text\"\n  }, \"metadata\"), \" property:\"), mdx(\"div\", {\n    \"className\": \"gatsby-highlight\",\n    \"data-language\": \"js\"\n  }, mdx(\"pre\", {\n    parentName: \"div\",\n    \"className\": \"language-js\"\n  }, mdx(\"code\", {\n    parentName: \"pre\",\n    \"className\": \"language-js\"\n  }, mdx(\"span\", {\n    parentName: \"code\",\n    \"className\": \"token function\"\n  }, \"nikita\"), mdx(\"span\", {\n    parentName: \"code\",\n    \"className\": \"token punctuation\"\n  }, \"(\"), mdx(\"span\", {\n    parentName: \"code\",\n    \"className\": \"token punctuation\"\n  }, \"{\"), \"\\n  \", mdx(\"span\", {\n    parentName: \"code\",\n    \"className\": \"token literal-property property\"\n  }, \"$retry\"), mdx(\"span\", {\n    parentName: \"code\",\n    \"className\": \"token operator\"\n  }, \":\"), \" \", mdx(\"span\", {\n    parentName: \"code\",\n    \"className\": \"token number\"\n  }, \"3\"), \"\\n\", mdx(\"span\", {\n    parentName: \"code\",\n    \"className\": \"token punctuation\"\n  }, \"}\"), mdx(\"span\", {\n    parentName: \"code\",\n    \"className\": \"token punctuation\"\n  }, \",\"), \" \", mdx(\"span\", {\n    parentName: \"code\",\n    \"className\": \"token keyword\"\n  }, \"async\"), \" \", mdx(\"span\", {\n    parentName: \"code\",\n    \"className\": \"token keyword\"\n  }, \"function\"), mdx(\"span\", {\n    parentName: \"code\",\n    \"className\": \"token punctuation\"\n  }, \"(\"), mdx(\"span\", {\n    parentName: \"code\",\n    \"className\": \"token parameter\"\n  }, mdx(\"span\", {\n    parentName: \"span\",\n    \"className\": \"token punctuation\"\n  }, \"{\"), mdx(\"span\", {\n    parentName: \"span\",\n    \"className\": \"token literal-property property\"\n  }, \"metadata\"), mdx(\"span\", {\n    parentName: \"span\",\n    \"className\": \"token operator\"\n  }, \":\"), \" \", mdx(\"span\", {\n    parentName: \"span\",\n    \"className\": \"token punctuation\"\n  }, \"{\"), \"attempt\", mdx(\"span\", {\n    parentName: \"span\",\n    \"className\": \"token punctuation\"\n  }, \",\"), \" retry\", mdx(\"span\", {\n    parentName: \"span\",\n    \"className\": \"token punctuation\"\n  }, \"}\"), mdx(\"span\", {\n    parentName: \"span\",\n    \"className\": \"token punctuation\"\n  }, \"}\")), mdx(\"span\", {\n    parentName: \"code\",\n    \"className\": \"token punctuation\"\n  }, \")\"), \" \", mdx(\"span\", {\n    parentName: \"code\",\n    \"className\": \"token punctuation\"\n  }, \"{\"), \"\\n  \", mdx(\"span\", {\n    parentName: \"code\",\n    \"className\": \"token keyword\"\n  }, \"if\"), mdx(\"span\", {\n    parentName: \"code\",\n    \"className\": \"token punctuation\"\n  }, \"(\"), \"attempt \", mdx(\"span\", {\n    parentName: \"code\",\n    \"className\": \"token operator\"\n  }, \"<\"), \" retry\", mdx(\"span\", {\n    parentName: \"code\",\n    \"className\": \"token punctuation\"\n  }, \")\"), \" \", mdx(\"span\", {\n    parentName: \"code\",\n    \"className\": \"token punctuation\"\n  }, \"{\"), \"\\n    console\", mdx(\"span\", {\n    parentName: \"code\",\n    \"className\": \"token punctuation\"\n  }, \".\"), mdx(\"span\", {\n    parentName: \"code\",\n    \"className\": \"token function\"\n  }, \"info\"), mdx(\"span\", {\n    parentName: \"code\",\n    \"className\": \"token punctuation\"\n  }, \"(\"), mdx(\"span\", {\n    parentName: \"code\",\n    \"className\": \"token template-string\"\n  }, mdx(\"span\", {\n    parentName: \"span\",\n    \"className\": \"token template-punctuation string\"\n  }, \"`\"), mdx(\"span\", {\n    parentName: \"span\",\n    \"className\": \"token string\"\n  }, \"Attempt \"), mdx(\"span\", {\n    parentName: \"span\",\n    \"className\": \"token interpolation\"\n  }, mdx(\"span\", {\n    parentName: \"span\",\n    \"className\": \"token interpolation-punctuation punctuation\"\n  }, \"${\"), \"attempt\", mdx(\"span\", {\n    parentName: \"span\",\n    \"className\": \"token interpolation-punctuation punctuation\"\n  }, \"}\")), mdx(\"span\", {\n    parentName: \"span\",\n    \"className\": \"token string\"\n  }, \" out of \"), mdx(\"span\", {\n    parentName: \"span\",\n    \"className\": \"token interpolation\"\n  }, mdx(\"span\", {\n    parentName: \"span\",\n    \"className\": \"token interpolation-punctuation punctuation\"\n  }, \"${\"), \"retry\", mdx(\"span\", {\n    parentName: \"span\",\n    \"className\": \"token interpolation-punctuation punctuation\"\n  }, \"}\")), mdx(\"span\", {\n    parentName: \"span\",\n    \"className\": \"token template-punctuation string\"\n  }, \"`\")), mdx(\"span\", {\n    parentName: \"code\",\n    \"className\": \"token punctuation\"\n  }, \")\"), \"\\n    \", mdx(\"span\", {\n    parentName: \"code\",\n    \"className\": \"token keyword\"\n  }, \"throw\"), \" \", mdx(\"span\", {\n    parentName: \"code\",\n    \"className\": \"token keyword\"\n  }, \"new\"), \" \", mdx(\"span\", {\n    parentName: \"code\",\n    \"className\": \"token class-name\"\n  }, \"Error\"), mdx(\"span\", {\n    parentName: \"code\",\n    \"className\": \"token punctuation\"\n  }, \"(\"), mdx(\"span\", {\n    parentName: \"code\",\n    \"className\": \"token string\"\n  }, \"'Please retry'\"), mdx(\"span\", {\n    parentName: \"code\",\n    \"className\": \"token punctuation\"\n  }, \")\"), \"\\n  \", mdx(\"span\", {\n    parentName: \"code\",\n    \"className\": \"token punctuation\"\n  }, \"}\"), \" \", mdx(\"span\", {\n    parentName: \"code\",\n    \"className\": \"token keyword\"\n  }, \"else\"), \" \", mdx(\"span\", {\n    parentName: \"code\",\n    \"className\": \"token punctuation\"\n  }, \"{\"), \"\\n    \", mdx(\"span\", {\n    parentName: \"code\",\n    \"className\": \"token keyword\"\n  }, \"return\"), \" \", mdx(\"span\", {\n    parentName: \"code\",\n    \"className\": \"token boolean\"\n  }, \"true\"), \"\\n  \", mdx(\"span\", {\n    parentName: \"code\",\n    \"className\": \"token punctuation\"\n  }, \"}\"), \"\\n\", mdx(\"span\", {\n    parentName: \"code\",\n    \"className\": \"token punctuation\"\n  }, \"}\"), mdx(\"span\", {\n    parentName: \"code\",\n    \"className\": \"token punctuation\"\n  }, \")\"), \"\\n\", mdx(\"span\", {\n    parentName: \"code\",\n    \"className\": \"token comment\"\n  }, \"// Prints:\"), \"\\n\", mdx(\"span\", {\n    parentName: \"code\",\n    \"className\": \"token comment\"\n  }, \"// Attempt 0 out of 3\"), \"\\n\", mdx(\"span\", {\n    parentName: \"code\",\n    \"className\": \"token comment\"\n  }, \"// Attempt 1 out of 3\"), \"\\n\", mdx(\"span\", {\n    parentName: \"code\",\n    \"className\": \"token comment\"\n  }, \"// Attempt 2 out of 3\")))), mdx(\"p\", null, \"Note, the majority of properties prefixed with \", mdx(\"code\", {\n    parentName: \"p\",\n    \"className\": \"language-text\"\n  }, \"$\"), \" are metadata properties. There are however a few exceptions including \", mdx(\"code\", {\n    parentName: \"p\",\n    \"className\": \"language-text\"\n  }, \"$handler\"), \", \", mdx(\"code\", {\n    parentName: \"p\",\n    \"className\": \"language-text\"\n  }, \"$plugins\"), \", \", mdx(\"code\", {\n    parentName: \"p\",\n    \"className\": \"language-text\"\n  }, \"$ssh\"), \" as well as all \", mdx(\"a\", {\n    parentName: \"p\",\n    \"href\": \"/current/guide/conditions/\"\n  }, \"condition\"), \" and \", mdx(\"a\", {\n    parentName: \"p\",\n    \"href\": \"/current/guide/assertions/\"\n  }, \"assertion\"), \" properties.\"), mdx(\"h3\", {\n    \"id\": \"idempotence-and-status\",\n    \"style\": {\n      \"position\": \"relative\"\n    }\n  }, mdx(\"a\", {\n    parentName: \"h3\",\n    \"href\": \"#idempotence-and-status\",\n    \"aria-label\": \"idempotence and status permalink\",\n    \"className\": \"anchor before\"\n  }, mdx(\"svg\", {\n    parentName: \"a\",\n    \"aria-hidden\": \"true\",\n    \"focusable\": \"false\",\n    \"height\": \"16\",\n    \"version\": \"1.1\",\n    \"viewBox\": \"0 0 16 16\",\n    \"width\": \"16\"\n  }, mdx(\"path\", {\n    parentName: \"svg\",\n    \"fillRule\": \"evenodd\",\n    \"d\": \"M4 9h1v1H4c-1.5 0-3-1.69-3-3.5S2.55 3 4 3h4c1.45 0 3 1.69 3 3.5 0 1.41-.91 2.72-2 3.25V8.59c.58-.45 1-1.27 1-2.09C10 5.22 8.98 4 8 4H4c-.98 0-2 1.22-2 2.5S3 9 4 9zm9-3h-1v1h1c1 0 2 1.22 2 2.5S13.98 12 13 12H9c-.98 0-2-1.22-2-2.5 0-.83.42-1.64 1-2.09V6.25c-1.09.53-2 1.84-2 3.25C6 11.31 7.55 13 9 13h4c1.45 0 3-1.69 3-3.5S14.5 6 13 6z\"\n  }))), \"Idempotence and status\"), mdx(\"p\", null, \"In the context of software deployment, idempotence means that an action with the same parameters can be executed multiple times without changing the final state of the system. It is a fundamental concept and every action in Nikita follows this principle.\"), mdx(\"p\", null, \"The status is used and interpreted with different meanings but in most cases, it indicates that a change occurred. Read each action documentation in case of any doubt. For example, an action similar to the POSIX \", mdx(\"code\", {\n    parentName: \"p\",\n    \"className\": \"language-text\"\n  }, \"touch\"), \" command could be designed to return \", mdx(\"code\", {\n    parentName: \"p\",\n    \"className\": \"language-text\"\n  }, \"true\"), \" on its first run and \", mdx(\"code\", {\n    parentName: \"p\",\n    \"className\": \"language-text\"\n  }, \"false\"), \" later on because the file already exists:\"), mdx(\"blockquote\", null, mdx(\"p\", {\n    parentName: \"blockquote\"\n  }, \"Important: you will encounter an error the second time you execute this code because the target file will be present and status will be set to \", mdx(\"code\", {\n    parentName: \"p\",\n    \"className\": \"language-text\"\n  }, \"true\"), \" instead of \", mdx(\"code\", {\n    parentName: \"p\",\n    \"className\": \"language-text\"\n  }, \"false\"), \". Simply remove the file with \", mdx(\"code\", {\n    parentName: \"p\",\n    \"className\": \"language-text\"\n  }, \"rm /tmp/a_file\"), \" between each run to overcome this issue.\")), mdx(\"div\", {\n    \"className\": \"gatsby-highlight\",\n    \"data-language\": \"js\"\n  }, mdx(\"pre\", {\n    parentName: \"div\",\n    \"className\": \"language-js\"\n  }, mdx(\"code\", {\n    parentName: \"pre\",\n    \"className\": \"language-js\"\n  }, mdx(\"span\", {\n    parentName: \"code\",\n    \"className\": \"token comment\"\n  }, \"// Dependencies\"), \"\\n\", mdx(\"span\", {\n    parentName: \"code\",\n    \"className\": \"token keyword\"\n  }, \"const\"), \" assert \", mdx(\"span\", {\n    parentName: \"code\",\n    \"className\": \"token operator\"\n  }, \"=\"), \" \", mdx(\"span\", {\n    parentName: \"code\",\n    \"className\": \"token function\"\n  }, \"require\"), mdx(\"span\", {\n    parentName: \"code\",\n    \"className\": \"token punctuation\"\n  }, \"(\"), mdx(\"span\", {\n    parentName: \"code\",\n    \"className\": \"token string\"\n  }, \"'assert'\"), mdx(\"span\", {\n    parentName: \"code\",\n    \"className\": \"token punctuation\"\n  }, \")\"), mdx(\"span\", {\n    parentName: \"code\",\n    \"className\": \"token punctuation\"\n  }, \";\"), \"\\n\", mdx(\"span\", {\n    parentName: \"code\",\n    \"className\": \"token keyword\"\n  }, \"const\"), \" fs \", mdx(\"span\", {\n    parentName: \"code\",\n    \"className\": \"token operator\"\n  }, \"=\"), \" \", mdx(\"span\", {\n    parentName: \"code\",\n    \"className\": \"token function\"\n  }, \"require\"), mdx(\"span\", {\n    parentName: \"code\",\n    \"className\": \"token punctuation\"\n  }, \"(\"), mdx(\"span\", {\n    parentName: \"code\",\n    \"className\": \"token string\"\n  }, \"'fs'\"), mdx(\"span\", {\n    parentName: \"code\",\n    \"className\": \"token punctuation\"\n  }, \")\"), mdx(\"span\", {\n    parentName: \"code\",\n    \"className\": \"token punctuation\"\n  }, \".\"), \"promises\", mdx(\"span\", {\n    parentName: \"code\",\n    \"className\": \"token punctuation\"\n  }, \";\"), \"\\n\", mdx(\"span\", {\n    parentName: \"code\",\n    \"className\": \"token comment\"\n  }, \"// Touch implementation\"), \"\\n\", mdx(\"span\", {\n    parentName: \"code\",\n    \"className\": \"token keyword\"\n  }, \"const\"), \" \", mdx(\"span\", {\n    parentName: \"code\",\n    \"className\": \"token function-variable function\"\n  }, \"touch\"), \" \", mdx(\"span\", {\n    parentName: \"code\",\n    \"className\": \"token operator\"\n  }, \"=\"), \" \", mdx(\"span\", {\n    parentName: \"code\",\n    \"className\": \"token keyword\"\n  }, \"async\"), \" \", mdx(\"span\", {\n    parentName: \"code\",\n    \"className\": \"token punctuation\"\n  }, \"(\"), mdx(\"span\", {\n    parentName: \"code\",\n    \"className\": \"token parameter\"\n  }, mdx(\"span\", {\n    parentName: \"span\",\n    \"className\": \"token punctuation\"\n  }, \"{\"), \"config\", mdx(\"span\", {\n    parentName: \"span\",\n    \"className\": \"token punctuation\"\n  }, \"}\")), mdx(\"span\", {\n    parentName: \"code\",\n    \"className\": \"token punctuation\"\n  }, \")\"), \" \", mdx(\"span\", {\n    parentName: \"code\",\n    \"className\": \"token operator\"\n  }, \"=>\"), \" \", mdx(\"span\", {\n    parentName: \"code\",\n    \"className\": \"token punctuation\"\n  }, \"{\"), \"\\n  \", mdx(\"span\", {\n    parentName: \"code\",\n    \"className\": \"token keyword\"\n  }, \"try\"), \" \", mdx(\"span\", {\n    parentName: \"code\",\n    \"className\": \"token punctuation\"\n  }, \"{\"), \" \\n    \", mdx(\"span\", {\n    parentName: \"code\",\n    \"className\": \"token keyword\"\n  }, \"await\"), \" fs\", mdx(\"span\", {\n    parentName: \"code\",\n    \"className\": \"token punctuation\"\n  }, \".\"), mdx(\"span\", {\n    parentName: \"code\",\n    \"className\": \"token function\"\n  }, \"stat\"), mdx(\"span\", {\n    parentName: \"code\",\n    \"className\": \"token punctuation\"\n  }, \"(\"), mdx(\"span\", {\n    parentName: \"code\",\n    \"className\": \"token string\"\n  }, \"'/tmp/a_file'\"), mdx(\"span\", {\n    parentName: \"code\",\n    \"className\": \"token punctuation\"\n  }, \")\"), \"\\n    \", mdx(\"span\", {\n    parentName: \"code\",\n    \"className\": \"token keyword\"\n  }, \"return\"), \" \", mdx(\"span\", {\n    parentName: \"code\",\n    \"className\": \"token boolean\"\n  }, \"false\"), \"\\n  \", mdx(\"span\", {\n    parentName: \"code\",\n    \"className\": \"token punctuation\"\n  }, \"}\"), \" \", mdx(\"span\", {\n    parentName: \"code\",\n    \"className\": \"token keyword\"\n  }, \"catch\"), \" \", mdx(\"span\", {\n    parentName: \"code\",\n    \"className\": \"token punctuation\"\n  }, \"(\"), \"err\", mdx(\"span\", {\n    parentName: \"code\",\n    \"className\": \"token punctuation\"\n  }, \")\"), \" \", mdx(\"span\", {\n    parentName: \"code\",\n    \"className\": \"token punctuation\"\n  }, \"{\"), \"\\n    \", mdx(\"span\", {\n    parentName: \"code\",\n    \"className\": \"token keyword\"\n  }, \"if\"), \" \", mdx(\"span\", {\n    parentName: \"code\",\n    \"className\": \"token punctuation\"\n  }, \"(\"), \"err\", mdx(\"span\", {\n    parentName: \"code\",\n    \"className\": \"token punctuation\"\n  }, \".\"), \"code \", mdx(\"span\", {\n    parentName: \"code\",\n    \"className\": \"token operator\"\n  }, \"!==\"), \" \", mdx(\"span\", {\n    parentName: \"code\",\n    \"className\": \"token string\"\n  }, \"'ENOENT'\"), mdx(\"span\", {\n    parentName: \"code\",\n    \"className\": \"token punctuation\"\n  }, \")\"), \" \", mdx(\"span\", {\n    parentName: \"code\",\n    \"className\": \"token keyword\"\n  }, \"throw\"), \" err\\n    \", mdx(\"span\", {\n    parentName: \"code\",\n    \"className\": \"token keyword\"\n  }, \"await\"), \" fs\", mdx(\"span\", {\n    parentName: \"code\",\n    \"className\": \"token punctuation\"\n  }, \".\"), mdx(\"span\", {\n    parentName: \"code\",\n    \"className\": \"token function\"\n  }, \"writeFile\"), mdx(\"span\", {\n    parentName: \"code\",\n    \"className\": \"token punctuation\"\n  }, \"(\"), mdx(\"span\", {\n    parentName: \"code\",\n    \"className\": \"token string\"\n  }, \"'/tmp/a_file'\"), mdx(\"span\", {\n    parentName: \"code\",\n    \"className\": \"token punctuation\"\n  }, \",\"), \" \", mdx(\"span\", {\n    parentName: \"code\",\n    \"className\": \"token string\"\n  }, \"''\"), mdx(\"span\", {\n    parentName: \"code\",\n    \"className\": \"token punctuation\"\n  }, \")\"), \"\\n    \", mdx(\"span\", {\n    parentName: \"code\",\n    \"className\": \"token keyword\"\n  }, \"return\"), \" \", mdx(\"span\", {\n    parentName: \"code\",\n    \"className\": \"token boolean\"\n  }, \"true\"), \"\\n  \", mdx(\"span\", {\n    parentName: \"code\",\n    \"className\": \"token punctuation\"\n  }, \"}\"), \" \\n\", mdx(\"span\", {\n    parentName: \"code\",\n    \"className\": \"token punctuation\"\n  }, \"}\"), \"\\n\", mdx(\"span\", {\n    parentName: \"code\",\n    \"className\": \"token comment\"\n  }, \"// Calling actions\"), \"\\n\", mdx(\"span\", {\n    parentName: \"code\",\n    \"className\": \"token punctuation\"\n  }, \"(\"), mdx(\"span\", {\n    parentName: \"code\",\n    \"className\": \"token keyword\"\n  }, \"async\"), \" \", mdx(\"span\", {\n    parentName: \"code\",\n    \"className\": \"token punctuation\"\n  }, \"(\"), mdx(\"span\", {\n    parentName: \"code\",\n    \"className\": \"token punctuation\"\n  }, \")\"), \" \", mdx(\"span\", {\n    parentName: \"code\",\n    \"className\": \"token operator\"\n  }, \"=>\"), \" \", mdx(\"span\", {\n    parentName: \"code\",\n    \"className\": \"token punctuation\"\n  }, \"{\"), \"\\n  \", mdx(\"span\", {\n    parentName: \"code\",\n    \"className\": \"token comment\"\n  }, \"// First time calling touch\"), \"\\n  \", mdx(\"span\", {\n    parentName: \"code\",\n    \"className\": \"token keyword\"\n  }, \"var\"), \" \", mdx(\"span\", {\n    parentName: \"code\",\n    \"className\": \"token punctuation\"\n  }, \"{\"), \"$status\", mdx(\"span\", {\n    parentName: \"code\",\n    \"className\": \"token punctuation\"\n  }, \"}\"), \" \", mdx(\"span\", {\n    parentName: \"code\",\n    \"className\": \"token operator\"\n  }, \"=\"), \" \", mdx(\"span\", {\n    parentName: \"code\",\n    \"className\": \"token keyword\"\n  }, \"await\"), \" \", mdx(\"span\", {\n    parentName: \"code\",\n    \"className\": \"token function\"\n  }, \"nikita\"), mdx(\"span\", {\n    parentName: \"code\",\n    \"className\": \"token punctuation\"\n  }, \".\"), mdx(\"span\", {\n    parentName: \"code\",\n    \"className\": \"token function\"\n  }, \"call\"), mdx(\"span\", {\n    parentName: \"code\",\n    \"className\": \"token punctuation\"\n  }, \"(\"), \"touch\", mdx(\"span\", {\n    parentName: \"code\",\n    \"className\": \"token punctuation\"\n  }, \")\"), \"\\n  assert\", mdx(\"span\", {\n    parentName: \"code\",\n    \"className\": \"token punctuation\"\n  }, \".\"), mdx(\"span\", {\n    parentName: \"code\",\n    \"className\": \"token function\"\n  }, \"equal\"), mdx(\"span\", {\n    parentName: \"code\",\n    \"className\": \"token punctuation\"\n  }, \"(\"), \"$status\", mdx(\"span\", {\n    parentName: \"code\",\n    \"className\": \"token punctuation\"\n  }, \",\"), \" \", mdx(\"span\", {\n    parentName: \"code\",\n    \"className\": \"token boolean\"\n  }, \"true\"), mdx(\"span\", {\n    parentName: \"code\",\n    \"className\": \"token punctuation\"\n  }, \")\"), \"\\n  \", mdx(\"span\", {\n    parentName: \"code\",\n    \"className\": \"token comment\"\n  }, \"// Second time calling touch\"), \"\\n  \", mdx(\"span\", {\n    parentName: \"code\",\n    \"className\": \"token keyword\"\n  }, \"var\"), \" \", mdx(\"span\", {\n    parentName: \"code\",\n    \"className\": \"token punctuation\"\n  }, \"{\"), \"$status\", mdx(\"span\", {\n    parentName: \"code\",\n    \"className\": \"token punctuation\"\n  }, \"}\"), \" \", mdx(\"span\", {\n    parentName: \"code\",\n    \"className\": \"token operator\"\n  }, \"=\"), \" \", mdx(\"span\", {\n    parentName: \"code\",\n    \"className\": \"token keyword\"\n  }, \"await\"), \" \", mdx(\"span\", {\n    parentName: \"code\",\n    \"className\": \"token function\"\n  }, \"nikita\"), mdx(\"span\", {\n    parentName: \"code\",\n    \"className\": \"token punctuation\"\n  }, \".\"), mdx(\"span\", {\n    parentName: \"code\",\n    \"className\": \"token function\"\n  }, \"call\"), mdx(\"span\", {\n    parentName: \"code\",\n    \"className\": \"token punctuation\"\n  }, \"(\"), \"touch\", mdx(\"span\", {\n    parentName: \"code\",\n    \"className\": \"token punctuation\"\n  }, \")\"), \"\\n  assert\", mdx(\"span\", {\n    parentName: \"code\",\n    \"className\": \"token punctuation\"\n  }, \".\"), mdx(\"span\", {\n    parentName: \"code\",\n    \"className\": \"token function\"\n  }, \"equal\"), mdx(\"span\", {\n    parentName: \"code\",\n    \"className\": \"token punctuation\"\n  }, \"(\"), \"$status\", mdx(\"span\", {\n    parentName: \"code\",\n    \"className\": \"token punctuation\"\n  }, \",\"), \" \", mdx(\"span\", {\n    parentName: \"code\",\n    \"className\": \"token boolean\"\n  }, \"false\"), mdx(\"span\", {\n    parentName: \"code\",\n    \"className\": \"token punctuation\"\n  }, \")\"), \"\\n\", mdx(\"span\", {\n    parentName: \"code\",\n    \"className\": \"token punctuation\"\n  }, \"}\"), mdx(\"span\", {\n    parentName: \"code\",\n    \"className\": \"token punctuation\"\n  }, \")\"), mdx(\"span\", {\n    parentName: \"code\",\n    \"className\": \"token punctuation\"\n  }, \"(\"), mdx(\"span\", {\n    parentName: \"code\",\n    \"className\": \"token punctuation\"\n  }, \")\")))), mdx(\"p\", null, \"Note, there is an existing \", mdx(\"code\", {\n    parentName: \"p\",\n    \"className\": \"language-text\"\n  }, \"nikita.file.touch\"), \" action which does just that with additional functionalities such as detecting and applying changes of ownerships and permissions.\"), mdx(\"h3\", {\n    \"id\": \"external-actions\",\n    \"style\": {\n      \"position\": \"relative\"\n    }\n  }, mdx(\"a\", {\n    parentName: \"h3\",\n    \"href\": \"#external-actions\",\n    \"aria-label\": \"external actions permalink\",\n    \"className\": \"anchor before\"\n  }, mdx(\"svg\", {\n    parentName: \"a\",\n    \"aria-hidden\": \"true\",\n    \"focusable\": \"false\",\n    \"height\": \"16\",\n    \"version\": \"1.1\",\n    \"viewBox\": \"0 0 16 16\",\n    \"width\": \"16\"\n  }, mdx(\"path\", {\n    parentName: \"svg\",\n    \"fillRule\": \"evenodd\",\n    \"d\": \"M4 9h1v1H4c-1.5 0-3-1.69-3-3.5S2.55 3 4 3h4c1.45 0 3 1.69 3 3.5 0 1.41-.91 2.72-2 3.25V8.59c.58-.45 1-1.27 1-2.09C10 5.22 8.98 4 8 4H4c-.98 0-2 1.22-2 2.5S3 9 4 9zm9-3h-1v1h1c1 0 2 1.22 2 2.5S13.98 12 13 12H9c-.98 0-2-1.22-2-2.5 0-.83.42-1.64 1-2.09V6.25c-1.09.53-2 1.84-2 3.25C6 11.31 7.55 13 9 13h4c1.45 0 3-1.69 3-3.5S14.5 6 13 6z\"\n  }))), \"External actions\"), mdx(\"p\", null, \"In order to reuse our new \", mdx(\"code\", {\n    parentName: \"p\",\n    \"className\": \"language-text\"\n  }, \"touch\"), \" action, we could isolate it into a separate file. The new file is called a module in Node.js terminology. Nikita \", mdx(\"code\", {\n    parentName: \"p\",\n    \"className\": \"language-text\"\n  }, \"call\"), \" will accept the exported object or function. Let's create two files \\\"./lib/touch.js\\\" and \\\"app.js\\\":\"), mdx(\"p\", null, \"File \\\"./lib/touch.js\\\":\"), mdx(\"div\", {\n    \"className\": \"gatsby-highlight\",\n    \"data-language\": \"js\"\n  }, mdx(\"pre\", {\n    parentName: \"div\",\n    \"className\": \"language-js\"\n  }, mdx(\"code\", {\n    parentName: \"pre\",\n    \"className\": \"language-js\"\n  }, mdx(\"span\", {\n    parentName: \"code\",\n    \"className\": \"token comment\"\n  }, \"// Dependencies\"), \"\\n\", mdx(\"span\", {\n    parentName: \"code\",\n    \"className\": \"token keyword\"\n  }, \"const\"), \" fs \", mdx(\"span\", {\n    parentName: \"code\",\n    \"className\": \"token operator\"\n  }, \"=\"), \" \", mdx(\"span\", {\n    parentName: \"code\",\n    \"className\": \"token function\"\n  }, \"require\"), mdx(\"span\", {\n    parentName: \"code\",\n    \"className\": \"token punctuation\"\n  }, \"(\"), mdx(\"span\", {\n    parentName: \"code\",\n    \"className\": \"token string\"\n  }, \"'fs'\"), mdx(\"span\", {\n    parentName: \"code\",\n    \"className\": \"token punctuation\"\n  }, \")\"), mdx(\"span\", {\n    parentName: \"code\",\n    \"className\": \"token punctuation\"\n  }, \".\"), \"promises\", mdx(\"span\", {\n    parentName: \"code\",\n    \"className\": \"token punctuation\"\n  }, \";\"), \"\\n\", mdx(\"span\", {\n    parentName: \"code\",\n    \"className\": \"token comment\"\n  }, \"// Touch implementation\"), \"\\nmodule\", mdx(\"span\", {\n    parentName: \"code\",\n    \"className\": \"token punctuation\"\n  }, \".\"), mdx(\"span\", {\n    parentName: \"code\",\n    \"className\": \"token function-variable function\"\n  }, \"exports\"), \" \", mdx(\"span\", {\n    parentName: \"code\",\n    \"className\": \"token operator\"\n  }, \"=\"), \" \", mdx(\"span\", {\n    parentName: \"code\",\n    \"className\": \"token keyword\"\n  }, \"async\"), \" \", mdx(\"span\", {\n    parentName: \"code\",\n    \"className\": \"token punctuation\"\n  }, \"(\"), mdx(\"span\", {\n    parentName: \"code\",\n    \"className\": \"token parameter\"\n  }, mdx(\"span\", {\n    parentName: \"span\",\n    \"className\": \"token punctuation\"\n  }, \"{\"), \"config\", mdx(\"span\", {\n    parentName: \"span\",\n    \"className\": \"token punctuation\"\n  }, \"}\")), mdx(\"span\", {\n    parentName: \"code\",\n    \"className\": \"token punctuation\"\n  }, \")\"), \" \", mdx(\"span\", {\n    parentName: \"code\",\n    \"className\": \"token operator\"\n  }, \"=>\"), \" \", mdx(\"span\", {\n    parentName: \"code\",\n    \"className\": \"token punctuation\"\n  }, \"{\"), \"\\n  \", mdx(\"span\", {\n    parentName: \"code\",\n    \"className\": \"token keyword\"\n  }, \"try\"), \" \", mdx(\"span\", {\n    parentName: \"code\",\n    \"className\": \"token punctuation\"\n  }, \"{\"), \" \\n    \", mdx(\"span\", {\n    parentName: \"code\",\n    \"className\": \"token keyword\"\n  }, \"await\"), \" fs\", mdx(\"span\", {\n    parentName: \"code\",\n    \"className\": \"token punctuation\"\n  }, \".\"), mdx(\"span\", {\n    parentName: \"code\",\n    \"className\": \"token function\"\n  }, \"stat\"), mdx(\"span\", {\n    parentName: \"code\",\n    \"className\": \"token punctuation\"\n  }, \"(\"), mdx(\"span\", {\n    parentName: \"code\",\n    \"className\": \"token string\"\n  }, \"'/tmp/a_file'\"), mdx(\"span\", {\n    parentName: \"code\",\n    \"className\": \"token punctuation\"\n  }, \")\"), \"\\n    \", mdx(\"span\", {\n    parentName: \"code\",\n    \"className\": \"token keyword\"\n  }, \"return\"), \" \", mdx(\"span\", {\n    parentName: \"code\",\n    \"className\": \"token boolean\"\n  }, \"false\"), \"\\n  \", mdx(\"span\", {\n    parentName: \"code\",\n    \"className\": \"token punctuation\"\n  }, \"}\"), \" \", mdx(\"span\", {\n    parentName: \"code\",\n    \"className\": \"token keyword\"\n  }, \"catch\"), \" \", mdx(\"span\", {\n    parentName: \"code\",\n    \"className\": \"token punctuation\"\n  }, \"(\"), \"err\", mdx(\"span\", {\n    parentName: \"code\",\n    \"className\": \"token punctuation\"\n  }, \")\"), \" \", mdx(\"span\", {\n    parentName: \"code\",\n    \"className\": \"token punctuation\"\n  }, \"{\"), \"\\n    \", mdx(\"span\", {\n    parentName: \"code\",\n    \"className\": \"token keyword\"\n  }, \"if\"), \" \", mdx(\"span\", {\n    parentName: \"code\",\n    \"className\": \"token punctuation\"\n  }, \"(\"), \"err\", mdx(\"span\", {\n    parentName: \"code\",\n    \"className\": \"token punctuation\"\n  }, \".\"), \"code \", mdx(\"span\", {\n    parentName: \"code\",\n    \"className\": \"token operator\"\n  }, \"!==\"), \" \", mdx(\"span\", {\n    parentName: \"code\",\n    \"className\": \"token string\"\n  }, \"'ENOENT'\"), mdx(\"span\", {\n    parentName: \"code\",\n    \"className\": \"token punctuation\"\n  }, \")\"), \" \", mdx(\"span\", {\n    parentName: \"code\",\n    \"className\": \"token keyword\"\n  }, \"throw\"), \" err\\n    \", mdx(\"span\", {\n    parentName: \"code\",\n    \"className\": \"token keyword\"\n  }, \"await\"), \" fs\", mdx(\"span\", {\n    parentName: \"code\",\n    \"className\": \"token punctuation\"\n  }, \".\"), mdx(\"span\", {\n    parentName: \"code\",\n    \"className\": \"token function\"\n  }, \"writeFile\"), mdx(\"span\", {\n    parentName: \"code\",\n    \"className\": \"token punctuation\"\n  }, \"(\"), mdx(\"span\", {\n    parentName: \"code\",\n    \"className\": \"token string\"\n  }, \"'/tmp/a_file'\"), mdx(\"span\", {\n    parentName: \"code\",\n    \"className\": \"token punctuation\"\n  }, \",\"), \" \", mdx(\"span\", {\n    parentName: \"code\",\n    \"className\": \"token string\"\n  }, \"''\"), mdx(\"span\", {\n    parentName: \"code\",\n    \"className\": \"token punctuation\"\n  }, \")\"), \"\\n    \", mdx(\"span\", {\n    parentName: \"code\",\n    \"className\": \"token keyword\"\n  }, \"return\"), \" \", mdx(\"span\", {\n    parentName: \"code\",\n    \"className\": \"token boolean\"\n  }, \"true\"), \"\\n  \", mdx(\"span\", {\n    parentName: \"code\",\n    \"className\": \"token punctuation\"\n  }, \"}\"), \" \\n\", mdx(\"span\", {\n    parentName: \"code\",\n    \"className\": \"token punctuation\"\n  }, \"}\")))), mdx(\"p\", null, \"File \\\"./app.js\\\":\"), mdx(\"div\", {\n    \"className\": \"gatsby-highlight\",\n    \"data-language\": \"js\"\n  }, mdx(\"pre\", {\n    parentName: \"div\",\n    \"className\": \"language-js\"\n  }, mdx(\"code\", {\n    parentName: \"pre\",\n    \"className\": \"language-js\"\n  }, mdx(\"span\", {\n    parentName: \"code\",\n    \"className\": \"token comment\"\n  }, \"// Dependencies\"), \"\\n\", mdx(\"span\", {\n    parentName: \"code\",\n    \"className\": \"token keyword\"\n  }, \"const\"), \" assert \", mdx(\"span\", {\n    parentName: \"code\",\n    \"className\": \"token operator\"\n  }, \"=\"), \" \", mdx(\"span\", {\n    parentName: \"code\",\n    \"className\": \"token function\"\n  }, \"require\"), mdx(\"span\", {\n    parentName: \"code\",\n    \"className\": \"token punctuation\"\n  }, \"(\"), mdx(\"span\", {\n    parentName: \"code\",\n    \"className\": \"token string\"\n  }, \"'assert'\"), mdx(\"span\", {\n    parentName: \"code\",\n    \"className\": \"token punctuation\"\n  }, \")\"), mdx(\"span\", {\n    parentName: \"code\",\n    \"className\": \"token punctuation\"\n  }, \";\"), \"\\n\", mdx(\"span\", {\n    parentName: \"code\",\n    \"className\": \"token punctuation\"\n  }, \"(\"), mdx(\"span\", {\n    parentName: \"code\",\n    \"className\": \"token keyword\"\n  }, \"async\"), \" \", mdx(\"span\", {\n    parentName: \"code\",\n    \"className\": \"token punctuation\"\n  }, \"(\"), mdx(\"span\", {\n    parentName: \"code\",\n    \"className\": \"token punctuation\"\n  }, \")\"), \" \", mdx(\"span\", {\n    parentName: \"code\",\n    \"className\": \"token operator\"\n  }, \"=>\"), \" \", mdx(\"span\", {\n    parentName: \"code\",\n    \"className\": \"token punctuation\"\n  }, \"{\"), \"\\n  \", mdx(\"span\", {\n    parentName: \"code\",\n    \"className\": \"token comment\"\n  }, \"// New Nikita session\"), \"\\n  \", mdx(\"span\", {\n    parentName: \"code\",\n    \"className\": \"token keyword\"\n  }, \"var\"), \" \", mdx(\"span\", {\n    parentName: \"code\",\n    \"className\": \"token punctuation\"\n  }, \"{\"), \"$status\", mdx(\"span\", {\n    parentName: \"code\",\n    \"className\": \"token punctuation\"\n  }, \"}\"), \" \", mdx(\"span\", {\n    parentName: \"code\",\n    \"className\": \"token operator\"\n  }, \"=\"), \" \", mdx(\"span\", {\n    parentName: \"code\",\n    \"className\": \"token keyword\"\n  }, \"await\"), \" \", mdx(\"span\", {\n    parentName: \"code\",\n    \"className\": \"token function\"\n  }, \"nikita\"), mdx(\"span\", {\n    parentName: \"code\",\n    \"className\": \"token punctuation\"\n  }, \".\"), mdx(\"span\", {\n    parentName: \"code\",\n    \"className\": \"token function\"\n  }, \"call\"), mdx(\"span\", {\n    parentName: \"code\",\n    \"className\": \"token punctuation\"\n  }, \"(\"), mdx(\"span\", {\n    parentName: \"code\",\n    \"className\": \"token string\"\n  }, \"'./lib/touch'\"), mdx(\"span\", {\n    parentName: \"code\",\n    \"className\": \"token punctuation\"\n  }, \")\"), \"\\n  assert\", mdx(\"span\", {\n    parentName: \"code\",\n    \"className\": \"token punctuation\"\n  }, \".\"), mdx(\"span\", {\n    parentName: \"code\",\n    \"className\": \"token function\"\n  }, \"equal\"), mdx(\"span\", {\n    parentName: \"code\",\n    \"className\": \"token punctuation\"\n  }, \"(\"), \"$status\", mdx(\"span\", {\n    parentName: \"code\",\n    \"className\": \"token punctuation\"\n  }, \",\"), \" \", mdx(\"span\", {\n    parentName: \"code\",\n    \"className\": \"token boolean\"\n  }, \"true\"), mdx(\"span\", {\n    parentName: \"code\",\n    \"className\": \"token punctuation\"\n  }, \")\"), \"\\n\", mdx(\"span\", {\n    parentName: \"code\",\n    \"className\": \"token punctuation\"\n  }, \"}\"), mdx(\"span\", {\n    parentName: \"code\",\n    \"className\": \"token punctuation\"\n  }, \")\"), mdx(\"span\", {\n    parentName: \"code\",\n    \"className\": \"token punctuation\"\n  }, \"(\"), mdx(\"span\", {\n    parentName: \"code\",\n    \"className\": \"token punctuation\"\n  }, \")\")))), mdx(\"h3\", {\n    \"id\": \"passing-config\",\n    \"style\": {\n      \"position\": \"relative\"\n    }\n  }, mdx(\"a\", {\n    parentName: \"h3\",\n    \"href\": \"#passing-config\",\n    \"aria-label\": \"passing config permalink\",\n    \"className\": \"anchor before\"\n  }, mdx(\"svg\", {\n    parentName: \"a\",\n    \"aria-hidden\": \"true\",\n    \"focusable\": \"false\",\n    \"height\": \"16\",\n    \"version\": \"1.1\",\n    \"viewBox\": \"0 0 16 16\",\n    \"width\": \"16\"\n  }, mdx(\"path\", {\n    parentName: \"svg\",\n    \"fillRule\": \"evenodd\",\n    \"d\": \"M4 9h1v1H4c-1.5 0-3-1.69-3-3.5S2.55 3 4 3h4c1.45 0 3 1.69 3 3.5 0 1.41-.91 2.72-2 3.25V8.59c.58-.45 1-1.27 1-2.09C10 5.22 8.98 4 8 4H4c-.98 0-2 1.22-2 2.5S3 9 4 9zm9-3h-1v1h1c1 0 2 1.22 2 2.5S13.98 12 13 12H9c-.98 0-2-1.22-2-2.5 0-.83.42-1.64 1-2.09V6.25c-1.09.53-2 1.84-2 3.25C6 11.31 7.55 13 9 13h4c1.45 0 3-1.69 3-3.5S14.5 6 13 6z\"\n  }))), \"Passing \", mdx(\"code\", {\n    parentName: \"h3\",\n    \"className\": \"language-text\"\n  }, \"config\")), mdx(\"p\", null, \"The \", mdx(\"code\", {\n    parentName: \"p\",\n    \"className\": \"language-text\"\n  }, \"touch\"), \" action is now a separate Node.js module. It is a vanilla JavaScript function. You can create your own \", mdx(\"code\", {\n    parentName: \"p\",\n    \"className\": \"language-text\"\n  }, \"config\"), \" to control the behavior of your actions. In our example, we created the \", mdx(\"code\", {\n    parentName: \"p\",\n    \"className\": \"language-text\"\n  }, \"target\"), \" configuration property to know which file to touch:\"), mdx(\"p\", null, \"File \\\"./lib/touch.js\\\":\"), mdx(\"div\", {\n    \"className\": \"gatsby-highlight\",\n    \"data-language\": \"js\"\n  }, mdx(\"pre\", {\n    parentName: \"div\",\n    \"className\": \"language-js\"\n  }, mdx(\"code\", {\n    parentName: \"pre\",\n    \"className\": \"language-js\"\n  }, mdx(\"span\", {\n    parentName: \"code\",\n    \"className\": \"token comment\"\n  }, \"// Dependencies\"), \"\\n\", mdx(\"span\", {\n    parentName: \"code\",\n    \"className\": \"token keyword\"\n  }, \"const\"), \" fs \", mdx(\"span\", {\n    parentName: \"code\",\n    \"className\": \"token operator\"\n  }, \"=\"), \" \", mdx(\"span\", {\n    parentName: \"code\",\n    \"className\": \"token function\"\n  }, \"require\"), mdx(\"span\", {\n    parentName: \"code\",\n    \"className\": \"token punctuation\"\n  }, \"(\"), mdx(\"span\", {\n    parentName: \"code\",\n    \"className\": \"token string\"\n  }, \"'fs'\"), mdx(\"span\", {\n    parentName: \"code\",\n    \"className\": \"token punctuation\"\n  }, \")\"), mdx(\"span\", {\n    parentName: \"code\",\n    \"className\": \"token punctuation\"\n  }, \".\"), \"promises\", mdx(\"span\", {\n    parentName: \"code\",\n    \"className\": \"token punctuation\"\n  }, \";\"), \"\\n\", mdx(\"span\", {\n    parentName: \"code\",\n    \"className\": \"token comment\"\n  }, \"// Touch implementation\"), \"\\nmodule\", mdx(\"span\", {\n    parentName: \"code\",\n    \"className\": \"token punctuation\"\n  }, \".\"), mdx(\"span\", {\n    parentName: \"code\",\n    \"className\": \"token function-variable function\"\n  }, \"exports\"), \" \", mdx(\"span\", {\n    parentName: \"code\",\n    \"className\": \"token operator\"\n  }, \"=\"), \" \", mdx(\"span\", {\n    parentName: \"code\",\n    \"className\": \"token keyword\"\n  }, \"async\"), \" \", mdx(\"span\", {\n    parentName: \"code\",\n    \"className\": \"token punctuation\"\n  }, \"(\"), mdx(\"span\", {\n    parentName: \"code\",\n    \"className\": \"token parameter\"\n  }, mdx(\"span\", {\n    parentName: \"span\",\n    \"className\": \"token punctuation\"\n  }, \"{\"), \"config\", mdx(\"span\", {\n    parentName: \"span\",\n    \"className\": \"token punctuation\"\n  }, \"}\")), mdx(\"span\", {\n    parentName: \"code\",\n    \"className\": \"token punctuation\"\n  }, \")\"), \" \", mdx(\"span\", {\n    parentName: \"code\",\n    \"className\": \"token operator\"\n  }, \"=>\"), \" \", mdx(\"span\", {\n    parentName: \"code\",\n    \"className\": \"token punctuation\"\n  }, \"{\"), \"\\n  \", mdx(\"span\", {\n    parentName: \"code\",\n    \"className\": \"token keyword\"\n  }, \"try\"), \" \", mdx(\"span\", {\n    parentName: \"code\",\n    \"className\": \"token punctuation\"\n  }, \"{\"), \" \\n    \", mdx(\"span\", {\n    parentName: \"code\",\n    \"className\": \"token keyword\"\n  }, \"await\"), \" fs\", mdx(\"span\", {\n    parentName: \"code\",\n    \"className\": \"token punctuation\"\n  }, \".\"), mdx(\"span\", {\n    parentName: \"code\",\n    \"className\": \"token function\"\n  }, \"stat\"), mdx(\"span\", {\n    parentName: \"code\",\n    \"className\": \"token punctuation\"\n  }, \"(\"), \"config\", mdx(\"span\", {\n    parentName: \"code\",\n    \"className\": \"token punctuation\"\n  }, \".\"), \"target\", mdx(\"span\", {\n    parentName: \"code\",\n    \"className\": \"token punctuation\"\n  }, \")\"), \"\\n    \", mdx(\"span\", {\n    parentName: \"code\",\n    \"className\": \"token keyword\"\n  }, \"return\"), \" \", mdx(\"span\", {\n    parentName: \"code\",\n    \"className\": \"token boolean\"\n  }, \"false\"), \"\\n  \", mdx(\"span\", {\n    parentName: \"code\",\n    \"className\": \"token punctuation\"\n  }, \"}\"), \" \", mdx(\"span\", {\n    parentName: \"code\",\n    \"className\": \"token keyword\"\n  }, \"catch\"), \" \", mdx(\"span\", {\n    parentName: \"code\",\n    \"className\": \"token punctuation\"\n  }, \"(\"), \"err\", mdx(\"span\", {\n    parentName: \"code\",\n    \"className\": \"token punctuation\"\n  }, \")\"), \" \", mdx(\"span\", {\n    parentName: \"code\",\n    \"className\": \"token punctuation\"\n  }, \"{\"), \"\\n    \", mdx(\"span\", {\n    parentName: \"code\",\n    \"className\": \"token keyword\"\n  }, \"if\"), \" \", mdx(\"span\", {\n    parentName: \"code\",\n    \"className\": \"token punctuation\"\n  }, \"(\"), \"err\", mdx(\"span\", {\n    parentName: \"code\",\n    \"className\": \"token punctuation\"\n  }, \".\"), \"code \", mdx(\"span\", {\n    parentName: \"code\",\n    \"className\": \"token operator\"\n  }, \"!==\"), \" \", mdx(\"span\", {\n    parentName: \"code\",\n    \"className\": \"token string\"\n  }, \"'ENOENT'\"), mdx(\"span\", {\n    parentName: \"code\",\n    \"className\": \"token punctuation\"\n  }, \")\"), \" \", mdx(\"span\", {\n    parentName: \"code\",\n    \"className\": \"token keyword\"\n  }, \"throw\"), \" err\\n    \", mdx(\"span\", {\n    parentName: \"code\",\n    \"className\": \"token keyword\"\n  }, \"await\"), \" fs\", mdx(\"span\", {\n    parentName: \"code\",\n    \"className\": \"token punctuation\"\n  }, \".\"), mdx(\"span\", {\n    parentName: \"code\",\n    \"className\": \"token function\"\n  }, \"writeFile\"), mdx(\"span\", {\n    parentName: \"code\",\n    \"className\": \"token punctuation\"\n  }, \"(\"), \"config\", mdx(\"span\", {\n    parentName: \"code\",\n    \"className\": \"token punctuation\"\n  }, \".\"), \"target\", mdx(\"span\", {\n    parentName: \"code\",\n    \"className\": \"token punctuation\"\n  }, \",\"), \" \", mdx(\"span\", {\n    parentName: \"code\",\n    \"className\": \"token string\"\n  }, \"''\"), mdx(\"span\", {\n    parentName: \"code\",\n    \"className\": \"token punctuation\"\n  }, \")\"), \"\\n    \", mdx(\"span\", {\n    parentName: \"code\",\n    \"className\": \"token keyword\"\n  }, \"return\"), \" \", mdx(\"span\", {\n    parentName: \"code\",\n    \"className\": \"token boolean\"\n  }, \"true\"), \"\\n  \", mdx(\"span\", {\n    parentName: \"code\",\n    \"className\": \"token punctuation\"\n  }, \"}\"), \" \\n\", mdx(\"span\", {\n    parentName: \"code\",\n    \"className\": \"token punctuation\"\n  }, \"}\")))), mdx(\"p\", null, \"File \\\"./app.js\\\": \"), mdx(\"div\", {\n    \"className\": \"gatsby-highlight\",\n    \"data-language\": \"js\"\n  }, mdx(\"pre\", {\n    parentName: \"div\",\n    \"className\": \"language-js\"\n  }, mdx(\"code\", {\n    parentName: \"pre\",\n    \"className\": \"language-js\"\n  }, mdx(\"span\", {\n    parentName: \"code\",\n    \"className\": \"token comment\"\n  }, \"// Dependencies\"), \"\\n\", mdx(\"span\", {\n    parentName: \"code\",\n    \"className\": \"token keyword\"\n  }, \"const\"), \" assert \", mdx(\"span\", {\n    parentName: \"code\",\n    \"className\": \"token operator\"\n  }, \"=\"), \" \", mdx(\"span\", {\n    parentName: \"code\",\n    \"className\": \"token function\"\n  }, \"require\"), mdx(\"span\", {\n    parentName: \"code\",\n    \"className\": \"token punctuation\"\n  }, \"(\"), mdx(\"span\", {\n    parentName: \"code\",\n    \"className\": \"token string\"\n  }, \"'assert'\"), mdx(\"span\", {\n    parentName: \"code\",\n    \"className\": \"token punctuation\"\n  }, \")\"), mdx(\"span\", {\n    parentName: \"code\",\n    \"className\": \"token punctuation\"\n  }, \";\"), \"\\n\", mdx(\"span\", {\n    parentName: \"code\",\n    \"className\": \"token punctuation\"\n  }, \"(\"), mdx(\"span\", {\n    parentName: \"code\",\n    \"className\": \"token keyword\"\n  }, \"async\"), \" \", mdx(\"span\", {\n    parentName: \"code\",\n    \"className\": \"token punctuation\"\n  }, \"(\"), mdx(\"span\", {\n    parentName: \"code\",\n    \"className\": \"token punctuation\"\n  }, \")\"), \" \", mdx(\"span\", {\n    parentName: \"code\",\n    \"className\": \"token operator\"\n  }, \"=>\"), \" \", mdx(\"span\", {\n    parentName: \"code\",\n    \"className\": \"token punctuation\"\n  }, \"{\"), \"\\n  \", mdx(\"span\", {\n    parentName: \"code\",\n    \"className\": \"token comment\"\n  }, \"// New Nikita session\"), \"\\n  \", mdx(\"span\", {\n    parentName: \"code\",\n    \"className\": \"token keyword\"\n  }, \"var\"), \" \", mdx(\"span\", {\n    parentName: \"code\",\n    \"className\": \"token punctuation\"\n  }, \"{\"), \"$status\", mdx(\"span\", {\n    parentName: \"code\",\n    \"className\": \"token punctuation\"\n  }, \"}\"), \" \", mdx(\"span\", {\n    parentName: \"code\",\n    \"className\": \"token operator\"\n  }, \"=\"), \" \", mdx(\"span\", {\n    parentName: \"code\",\n    \"className\": \"token keyword\"\n  }, \"await\"), \" \", mdx(\"span\", {\n    parentName: \"code\",\n    \"className\": \"token function\"\n  }, \"nikita\"), mdx(\"span\", {\n    parentName: \"code\",\n    \"className\": \"token punctuation\"\n  }, \".\"), mdx(\"span\", {\n    parentName: \"code\",\n    \"className\": \"token function\"\n  }, \"call\"), mdx(\"span\", {\n    parentName: \"code\",\n    \"className\": \"token punctuation\"\n  }, \"(\"), mdx(\"span\", {\n    parentName: \"code\",\n    \"className\": \"token punctuation\"\n  }, \"{\"), \"\\n    \", mdx(\"span\", {\n    parentName: \"code\",\n    \"className\": \"token literal-property property\"\n  }, \"target\"), mdx(\"span\", {\n    parentName: \"code\",\n    \"className\": \"token operator\"\n  }, \":\"), \" \", mdx(\"span\", {\n    parentName: \"code\",\n    \"className\": \"token string\"\n  }, \"'/tmp/a_file'\"), \"\\n  \", mdx(\"span\", {\n    parentName: \"code\",\n    \"className\": \"token punctuation\"\n  }, \"}\"), mdx(\"span\", {\n    parentName: \"code\",\n    \"className\": \"token punctuation\"\n  }, \",\"), \" \", mdx(\"span\", {\n    parentName: \"code\",\n    \"className\": \"token string\"\n  }, \"'./lib/touch'\"), mdx(\"span\", {\n    parentName: \"code\",\n    \"className\": \"token punctuation\"\n  }, \")\"), \"\\n  assert\", mdx(\"span\", {\n    parentName: \"code\",\n    \"className\": \"token punctuation\"\n  }, \".\"), mdx(\"span\", {\n    parentName: \"code\",\n    \"className\": \"token function\"\n  }, \"equal\"), mdx(\"span\", {\n    parentName: \"code\",\n    \"className\": \"token punctuation\"\n  }, \"(\"), \"$status\", mdx(\"span\", {\n    parentName: \"code\",\n    \"className\": \"token punctuation\"\n  }, \",\"), \" \", mdx(\"span\", {\n    parentName: \"code\",\n    \"className\": \"token boolean\"\n  }, \"true\"), mdx(\"span\", {\n    parentName: \"code\",\n    \"className\": \"token punctuation\"\n  }, \")\"), \"\\n\", mdx(\"span\", {\n    parentName: \"code\",\n    \"className\": \"token punctuation\"\n  }, \"}\"), mdx(\"span\", {\n    parentName: \"code\",\n    \"className\": \"token punctuation\"\n  }, \")\"), mdx(\"span\", {\n    parentName: \"code\",\n    \"className\": \"token punctuation\"\n  }, \"(\"), mdx(\"span\", {\n    parentName: \"code\",\n    \"className\": \"token punctuation\"\n  }, \")\")))), mdx(\"h3\", {\n    \"id\": \"registering-actions\",\n    \"style\": {\n      \"position\": \"relative\"\n    }\n  }, mdx(\"a\", {\n    parentName: \"h3\",\n    \"href\": \"#registering-actions\",\n    \"aria-label\": \"registering actions permalink\",\n    \"className\": \"anchor before\"\n  }, mdx(\"svg\", {\n    parentName: \"a\",\n    \"aria-hidden\": \"true\",\n    \"focusable\": \"false\",\n    \"height\": \"16\",\n    \"version\": \"1.1\",\n    \"viewBox\": \"0 0 16 16\",\n    \"width\": \"16\"\n  }, mdx(\"path\", {\n    parentName: \"svg\",\n    \"fillRule\": \"evenodd\",\n    \"d\": \"M4 9h1v1H4c-1.5 0-3-1.69-3-3.5S2.55 3 4 3h4c1.45 0 3 1.69 3 3.5 0 1.41-.91 2.72-2 3.25V8.59c.58-.45 1-1.27 1-2.09C10 5.22 8.98 4 8 4H4c-.98 0-2 1.22-2 2.5S3 9 4 9zm9-3h-1v1h1c1 0 2 1.22 2 2.5S13.98 12 13 12H9c-.98 0-2-1.22-2-2.5 0-.83.42-1.64 1-2.09V6.25c-1.09.53-2 1.84-2 3.25C6 11.31 7.55 13 9 13h4c1.45 0 3-1.69 3-3.5S14.5 6 13 6z\"\n  }))), \"Registering actions\"), mdx(\"p\", null, \"Instead of using the \", mdx(\"code\", {\n    parentName: \"p\",\n    \"className\": \"language-text\"\n  }, \"call\"), \" action, it might be more comfortable to call our \", mdx(\"code\", {\n    parentName: \"p\",\n    \"className\": \"language-text\"\n  }, \"touch\"), \" action by its name. To do so, we will register it. Actions can be registered in the current Nikita session or globally. In the example below, we will register it in the session:\"), mdx(\"div\", {\n    \"className\": \"gatsby-highlight\",\n    \"data-language\": \"js\"\n  }, mdx(\"pre\", {\n    parentName: \"div\",\n    \"className\": \"language-js\"\n  }, mdx(\"code\", {\n    parentName: \"pre\",\n    \"className\": \"language-js\"\n  }, mdx(\"span\", {\n    parentName: \"code\",\n    \"className\": \"token comment\"\n  }, \"// Dependencies\"), \"\\n\", mdx(\"span\", {\n    parentName: \"code\",\n    \"className\": \"token keyword\"\n  }, \"const\"), \" assert \", mdx(\"span\", {\n    parentName: \"code\",\n    \"className\": \"token operator\"\n  }, \"=\"), \" \", mdx(\"span\", {\n    parentName: \"code\",\n    \"className\": \"token function\"\n  }, \"require\"), mdx(\"span\", {\n    parentName: \"code\",\n    \"className\": \"token punctuation\"\n  }, \"(\"), mdx(\"span\", {\n    parentName: \"code\",\n    \"className\": \"token string\"\n  }, \"'assert'\"), mdx(\"span\", {\n    parentName: \"code\",\n    \"className\": \"token punctuation\"\n  }, \")\"), mdx(\"span\", {\n    parentName: \"code\",\n    \"className\": \"token punctuation\"\n  }, \";\"), \"\\n\", mdx(\"span\", {\n    parentName: \"code\",\n    \"className\": \"token punctuation\"\n  }, \"(\"), mdx(\"span\", {\n    parentName: \"code\",\n    \"className\": \"token keyword\"\n  }, \"async\"), \" \", mdx(\"span\", {\n    parentName: \"code\",\n    \"className\": \"token punctuation\"\n  }, \"(\"), mdx(\"span\", {\n    parentName: \"code\",\n    \"className\": \"token punctuation\"\n  }, \")\"), \" \", mdx(\"span\", {\n    parentName: \"code\",\n    \"className\": \"token operator\"\n  }, \"=>\"), \" \", mdx(\"span\", {\n    parentName: \"code\",\n    \"className\": \"token punctuation\"\n  }, \"{\"), \"\\n  \", mdx(\"span\", {\n    parentName: \"code\",\n    \"className\": \"token comment\"\n  }, \"// New Nikita session\"), \"\\n  \", mdx(\"span\", {\n    parentName: \"code\",\n    \"className\": \"token keyword\"\n  }, \"var\"), \" \", mdx(\"span\", {\n    parentName: \"code\",\n    \"className\": \"token punctuation\"\n  }, \"{\"), \"$status\", mdx(\"span\", {\n    parentName: \"code\",\n    \"className\": \"token punctuation\"\n  }, \"}\"), \" \", mdx(\"span\", {\n    parentName: \"code\",\n    \"className\": \"token operator\"\n  }, \"=\"), \" \", mdx(\"span\", {\n    parentName: \"code\",\n    \"className\": \"token keyword\"\n  }, \"await\"), \" nikita\\n  \", mdx(\"span\", {\n    parentName: \"code\",\n    \"className\": \"token comment\"\n  }, \"// Register the touch action\"), \"\\n  \", mdx(\"span\", {\n    parentName: \"code\",\n    \"className\": \"token punctuation\"\n  }, \".\"), \"registry\", mdx(\"span\", {\n    parentName: \"code\",\n    \"className\": \"token punctuation\"\n  }, \".\"), mdx(\"span\", {\n    parentName: \"code\",\n    \"className\": \"token function\"\n  }, \"register\"), mdx(\"span\", {\n    parentName: \"code\",\n    \"className\": \"token punctuation\"\n  }, \"(\"), mdx(\"span\", {\n    parentName: \"code\",\n    \"className\": \"token punctuation\"\n  }, \"{\"), mdx(\"span\", {\n    parentName: \"code\",\n    \"className\": \"token literal-property property\"\n  }, \"touch\"), mdx(\"span\", {\n    parentName: \"code\",\n    \"className\": \"token operator\"\n  }, \":\"), \" \", mdx(\"span\", {\n    parentName: \"code\",\n    \"className\": \"token string\"\n  }, \"'./lib/touch'\"), mdx(\"span\", {\n    parentName: \"code\",\n    \"className\": \"token punctuation\"\n  }, \"}\"), mdx(\"span\", {\n    parentName: \"code\",\n    \"className\": \"token punctuation\"\n  }, \")\"), \"\\n  \", mdx(\"span\", {\n    parentName: \"code\",\n    \"className\": \"token comment\"\n  }, \"// Calling the registered action\"), \"\\n  \", mdx(\"span\", {\n    parentName: \"code\",\n    \"className\": \"token punctuation\"\n  }, \".\"), mdx(\"span\", {\n    parentName: \"code\",\n    \"className\": \"token function\"\n  }, \"touch\"), mdx(\"span\", {\n    parentName: \"code\",\n    \"className\": \"token punctuation\"\n  }, \"(\"), mdx(\"span\", {\n    parentName: \"code\",\n    \"className\": \"token punctuation\"\n  }, \"{\"), mdx(\"span\", {\n    parentName: \"code\",\n    \"className\": \"token literal-property property\"\n  }, \"target\"), mdx(\"span\", {\n    parentName: \"code\",\n    \"className\": \"token operator\"\n  }, \":\"), \" \", mdx(\"span\", {\n    parentName: \"code\",\n    \"className\": \"token string\"\n  }, \"'/tmp/a_file'\"), mdx(\"span\", {\n    parentName: \"code\",\n    \"className\": \"token punctuation\"\n  }, \"}\"), mdx(\"span\", {\n    parentName: \"code\",\n    \"className\": \"token punctuation\"\n  }, \")\"), \"\\n  \", mdx(\"span\", {\n    parentName: \"code\",\n    \"className\": \"token comment\"\n  }, \"// Validation\"), \"\\n  assert\", mdx(\"span\", {\n    parentName: \"code\",\n    \"className\": \"token punctuation\"\n  }, \".\"), mdx(\"span\", {\n    parentName: \"code\",\n    \"className\": \"token function\"\n  }, \"equal\"), mdx(\"span\", {\n    parentName: \"code\",\n    \"className\": \"token punctuation\"\n  }, \"(\"), \"$status\", mdx(\"span\", {\n    parentName: \"code\",\n    \"className\": \"token punctuation\"\n  }, \",\"), \" \", mdx(\"span\", {\n    parentName: \"code\",\n    \"className\": \"token boolean\"\n  }, \"true\"), mdx(\"span\", {\n    parentName: \"code\",\n    \"className\": \"token punctuation\"\n  }, \")\"), \"\\n\", mdx(\"span\", {\n    parentName: \"code\",\n    \"className\": \"token punctuation\"\n  }, \"}\"), mdx(\"span\", {\n    parentName: \"code\",\n    \"className\": \"token punctuation\"\n  }, \")\"), mdx(\"span\", {\n    parentName: \"code\",\n    \"className\": \"token punctuation\"\n  }, \"(\"), mdx(\"span\", {\n    parentName: \"code\",\n    \"className\": \"token punctuation\"\n  }, \")\")))), mdx(\"h2\", {\n    \"id\": \"real-life-example\",\n    \"style\": {\n      \"position\": \"relative\"\n    }\n  }, mdx(\"a\", {\n    parentName: \"h2\",\n    \"href\": \"#real-life-example\",\n    \"aria-label\": \"real life example permalink\",\n    \"className\": \"anchor before\"\n  }, mdx(\"svg\", {\n    parentName: \"a\",\n    \"aria-hidden\": \"true\",\n    \"focusable\": \"false\",\n    \"height\": \"16\",\n    \"version\": \"1.1\",\n    \"viewBox\": \"0 0 16 16\",\n    \"width\": \"16\"\n  }, mdx(\"path\", {\n    parentName: \"svg\",\n    \"fillRule\": \"evenodd\",\n    \"d\": \"M4 9h1v1H4c-1.5 0-3-1.69-3-3.5S2.55 3 4 3h4c1.45 0 3 1.69 3 3.5 0 1.41-.91 2.72-2 3.25V8.59c.58-.45 1-1.27 1-2.09C10 5.22 8.98 4 8 4H4c-.98 0-2 1.22-2 2.5S3 9 4 9zm9-3h-1v1h1c1 0 2 1.22 2 2.5S13.98 12 13 12H9c-.98 0-2-1.22-2-2.5 0-.83.42-1.64 1-2.09V6.25c-1.09.53-2 1.84-2 3.25C6 11.31 7.55 13 9 13h4c1.45 0 3-1.69 3-3.5S14.5 6 13 6z\"\n  }))), \"Real-life example\"), mdx(\"p\", null, \"For the sake of this tutorial, we will create a basic Redis installation. The installation steps are:\"), mdx(\"ol\", null, mdx(\"li\", {\n    parentName: \"ol\"\n  }, \"Source compilation\", mdx(\"br\", {\n    parentName: \"li\"\n  }), mdx(\"em\", {\n    parentName: \"li\"\n  }, \"Learn how to execute shell commands and use conditions.\")), mdx(\"li\", {\n    parentName: \"ol\"\n  }, \"Redis configuration file\", mdx(\"br\", {\n    parentName: \"li\"\n  }), mdx(\"em\", {\n    parentName: \"li\"\n  }, \"Learn how to merge or overwrite a configuration by serializing a JavaScript vanilla object.\")), mdx(\"li\", {\n    parentName: \"ol\"\n  }, \"CLI reporting and logs\", mdx(\"br\", {\n    parentName: \"li\"\n  }), mdx(\"em\", {\n    parentName: \"li\"\n  }, \"Learn how to activate pretty reporting and detailed logs written in Markdown.\")), mdx(\"li\", {\n    parentName: \"ol\"\n  }, \"Get the server up and running\", mdx(\"br\", {\n    parentName: \"li\"\n  }), mdx(\"em\", {\n    parentName: \"li\"\n  }, \"Learn how to leverage exit code to alter the action status.\")), mdx(\"li\", {\n    parentName: \"ol\"\n  }, \"Checking the service health\", mdx(\"br\", {\n    parentName: \"li\"\n  }), mdx(\"em\", {\n    parentName: \"li\"\n  }, \"Learn how to use the \", mdx(\"code\", {\n    parentName: \"em\",\n    \"className\": \"language-text\"\n  }, \"relax\"), \" and \", mdx(\"code\", {\n    parentName: \"em\",\n    \"className\": \"language-text\"\n  }, \"shy\"), \" metadata.\")), mdx(\"li\", {\n    parentName: \"ol\"\n  }, \"SSH activation\", mdx(\"br\", {\n    parentName: \"li\"\n  }), mdx(\"em\", {\n    parentName: \"li\"\n  }, \"Learn how easy and transparent it is to activate SSH.\")), mdx(\"li\", {\n    parentName: \"ol\"\n  }, \"Composition\", mdx(\"br\", {\n    parentName: \"li\"\n  }), mdx(\"em\", {\n    parentName: \"li\"\n  }, \"Learn how to chain multiple actions sequentially and compose them as children of other actions.\"))), mdx(\"h3\", {\n    \"id\": \"1-source-compilation\",\n    \"style\": {\n      \"position\": \"relative\"\n    }\n  }, mdx(\"a\", {\n    parentName: \"h3\",\n    \"href\": \"#1-source-compilation\",\n    \"aria-label\": \"1 source compilation permalink\",\n    \"className\": \"anchor before\"\n  }, mdx(\"svg\", {\n    parentName: \"a\",\n    \"aria-hidden\": \"true\",\n    \"focusable\": \"false\",\n    \"height\": \"16\",\n    \"version\": \"1.1\",\n    \"viewBox\": \"0 0 16 16\",\n    \"width\": \"16\"\n  }, mdx(\"path\", {\n    parentName: \"svg\",\n    \"fillRule\": \"evenodd\",\n    \"d\": \"M4 9h1v1H4c-1.5 0-3-1.69-3-3.5S2.55 3 4 3h4c1.45 0 3 1.69 3 3.5 0 1.41-.91 2.72-2 3.25V8.59c.58-.45 1-1.27 1-2.09C10 5.22 8.98 4 8 4H4c-.98 0-2 1.22-2 2.5S3 9 4 9zm9-3h-1v1h1c1 0 2 1.22 2 2.5S13.98 12 13 12H9c-.98 0-2-1.22-2-2.5 0-.83.42-1.64 1-2.09V6.25c-1.09.53-2 1.84-2 3.25C6 11.31 7.55 13 9 13h4c1.45 0 3-1.69 3-3.5S14.5 6 13 6z\"\n  }))), \"1. Source compilation\"), mdx(\"p\", null, mdx(\"em\", {\n    parentName: \"p\"\n  }, \"Learn how to execute shell commands and use conditions.\")), mdx(\"p\", null, \"Following the \", mdx(\"a\", {\n    parentName: \"p\",\n    \"href\": \"https://redis.io/topics/quickstart\"\n  }, \"Redis quickstart guide\"), \", getting Redis up and ready is about downloading the package and executing the \", mdx(\"code\", {\n    parentName: \"p\",\n    \"className\": \"language-text\"\n  }, \"redis-server\"), \" command. We will do this with idempotence in mind.\"), mdx(\"p\", null, \"The existing \", mdx(\"code\", {\n    parentName: \"p\",\n    \"className\": \"language-text\"\n  }, \"nikita.file.download\"), \" action is used to dowload Redis:\"), mdx(\"div\", {\n    \"className\": \"gatsby-highlight\",\n    \"data-language\": \"js\"\n  }, mdx(\"pre\", {\n    parentName: \"div\",\n    \"className\": \"language-js\"\n  }, mdx(\"code\", {\n    parentName: \"pre\",\n    \"className\": \"language-js\"\n  }, mdx(\"span\", {\n    parentName: \"code\",\n    \"className\": \"token punctuation\"\n  }, \"(\"), mdx(\"span\", {\n    parentName: \"code\",\n    \"className\": \"token keyword\"\n  }, \"async\"), \" \", mdx(\"span\", {\n    parentName: \"code\",\n    \"className\": \"token punctuation\"\n  }, \"(\"), mdx(\"span\", {\n    parentName: \"code\",\n    \"className\": \"token punctuation\"\n  }, \")\"), \" \", mdx(\"span\", {\n    parentName: \"code\",\n    \"className\": \"token operator\"\n  }, \"=>\"), \" \", mdx(\"span\", {\n    parentName: \"code\",\n    \"className\": \"token punctuation\"\n  }, \"{\"), \"\\n  \", mdx(\"span\", {\n    parentName: \"code\",\n    \"className\": \"token keyword\"\n  }, \"var\"), \" \", mdx(\"span\", {\n    parentName: \"code\",\n    \"className\": \"token punctuation\"\n  }, \"{\"), \"$status\", mdx(\"span\", {\n    parentName: \"code\",\n    \"className\": \"token punctuation\"\n  }, \"}\"), \" \", mdx(\"span\", {\n    parentName: \"code\",\n    \"className\": \"token operator\"\n  }, \"=\"), \" \", mdx(\"span\", {\n    parentName: \"code\",\n    \"className\": \"token keyword\"\n  }, \"await\"), \" nikita\", mdx(\"span\", {\n    parentName: \"code\",\n    \"className\": \"token punctuation\"\n  }, \".\"), \"file\", mdx(\"span\", {\n    parentName: \"code\",\n    \"className\": \"token punctuation\"\n  }, \".\"), mdx(\"span\", {\n    parentName: \"code\",\n    \"className\": \"token function\"\n  }, \"download\"), mdx(\"span\", {\n    parentName: \"code\",\n    \"className\": \"token punctuation\"\n  }, \"(\"), mdx(\"span\", {\n    parentName: \"code\",\n    \"className\": \"token punctuation\"\n  }, \"{\"), \"\\n    \", mdx(\"span\", {\n    parentName: \"code\",\n    \"className\": \"token literal-property property\"\n  }, \"source\"), mdx(\"span\", {\n    parentName: \"code\",\n    \"className\": \"token operator\"\n  }, \":\"), \" \", mdx(\"span\", {\n    parentName: \"code\",\n    \"className\": \"token string\"\n  }, \"'http://download.redis.io/redis-stable.tar.gz'\"), mdx(\"span\", {\n    parentName: \"code\",\n    \"className\": \"token punctuation\"\n  }, \",\"), \"\\n    \", mdx(\"span\", {\n    parentName: \"code\",\n    \"className\": \"token literal-property property\"\n  }, \"target\"), mdx(\"span\", {\n    parentName: \"code\",\n    \"className\": \"token operator\"\n  }, \":\"), \" \", mdx(\"span\", {\n    parentName: \"code\",\n    \"className\": \"token string\"\n  }, \"'/tmp/nikita-tutorial/cache/redis-stable.tar.gz'\"), \"\\n  \", mdx(\"span\", {\n    parentName: \"code\",\n    \"className\": \"token punctuation\"\n  }, \"}\"), mdx(\"span\", {\n    parentName: \"code\",\n    \"className\": \"token punctuation\"\n  }, \")\"), \"\\n  console\", mdx(\"span\", {\n    parentName: \"code\",\n    \"className\": \"token punctuation\"\n  }, \".\"), mdx(\"span\", {\n    parentName: \"code\",\n    \"className\": \"token function\"\n  }, \"info\"), mdx(\"span\", {\n    parentName: \"code\",\n    \"className\": \"token punctuation\"\n  }, \"(\"), mdx(\"span\", {\n    parentName: \"code\",\n    \"className\": \"token string\"\n  }, \"'Redis downloaded:'\"), mdx(\"span\", {\n    parentName: \"code\",\n    \"className\": \"token punctuation\"\n  }, \",\"), \" $status \", mdx(\"span\", {\n    parentName: \"code\",\n    \"className\": \"token operator\"\n  }, \"?\"), \" \", mdx(\"span\", {\n    parentName: \"code\",\n    \"className\": \"token string\"\n  }, \"'\\u2714'\"), \" \", mdx(\"span\", {\n    parentName: \"code\",\n    \"className\": \"token operator\"\n  }, \":\"), \" \", mdx(\"span\", {\n    parentName: \"code\",\n    \"className\": \"token string\"\n  }, \"'-'\"), mdx(\"span\", {\n    parentName: \"code\",\n    \"className\": \"token punctuation\"\n  }, \")\"), \"\\n\", mdx(\"span\", {\n    parentName: \"code\",\n    \"className\": \"token punctuation\"\n  }, \"}\"), mdx(\"span\", {\n    parentName: \"code\",\n    \"className\": \"token punctuation\"\n  }, \")\"), mdx(\"span\", {\n    parentName: \"code\",\n    \"className\": \"token punctuation\"\n  }, \"(\"), mdx(\"span\", {\n    parentName: \"code\",\n    \"className\": \"token punctuation\"\n  }, \")\")))), mdx(\"p\", null, \"The second time \", mdx(\"code\", {\n    parentName: \"p\",\n    \"className\": \"language-text\"\n  }, \"nikita.file.download\"), \" is called, it checks if the target exists and bypasses the download in such case, thus speeding up the execution. You could also adjust this behavior based on the file signature by using one of the \\\"md5\\\", \\\"sha1\\\" and \\\"sha256\\\" configuration properties.\"), mdx(\"p\", null, \"To extract and compile Redis, a custom shell script is only be executed if a specific generated file does not already exist. Nikita comes with a few native conditions prefixed with \\\"$if\", mdx(\"em\", {\n    parentName: \"p\"\n  }, \"\\\" and their associated negation prefixed with \\\"$unless\"), \"\\\". The \", mdx(\"code\", {\n    parentName: \"p\",\n    \"className\": \"language-text\"\n  }, \"nikita.execute\"), \" action to execute shell scripts:\"), mdx(\"div\", {\n    \"className\": \"gatsby-highlight\",\n    \"data-language\": \"js\"\n  }, mdx(\"pre\", {\n    parentName: \"div\",\n    \"className\": \"language-js\"\n  }, mdx(\"code\", {\n    parentName: \"pre\",\n    \"className\": \"language-js\"\n  }, mdx(\"span\", {\n    parentName: \"code\",\n    \"className\": \"token punctuation\"\n  }, \"(\"), mdx(\"span\", {\n    parentName: \"code\",\n    \"className\": \"token keyword\"\n  }, \"async\"), \" \", mdx(\"span\", {\n    parentName: \"code\",\n    \"className\": \"token punctuation\"\n  }, \"(\"), mdx(\"span\", {\n    parentName: \"code\",\n    \"className\": \"token punctuation\"\n  }, \")\"), \" \", mdx(\"span\", {\n    parentName: \"code\",\n    \"className\": \"token operator\"\n  }, \"=>\"), \" \", mdx(\"span\", {\n    parentName: \"code\",\n    \"className\": \"token punctuation\"\n  }, \"{\"), \"\\n  \", mdx(\"span\", {\n    parentName: \"code\",\n    \"className\": \"token keyword\"\n  }, \"var\"), \" \", mdx(\"span\", {\n    parentName: \"code\",\n    \"className\": \"token punctuation\"\n  }, \"{\"), \"$status\", mdx(\"span\", {\n    parentName: \"code\",\n    \"className\": \"token punctuation\"\n  }, \"}\"), \" \", mdx(\"span\", {\n    parentName: \"code\",\n    \"className\": \"token operator\"\n  }, \"=\"), \" \", mdx(\"span\", {\n    parentName: \"code\",\n    \"className\": \"token keyword\"\n  }, \"await\"), \" nikita\", mdx(\"span\", {\n    parentName: \"code\",\n    \"className\": \"token punctuation\"\n  }, \".\"), mdx(\"span\", {\n    parentName: \"code\",\n    \"className\": \"token function\"\n  }, \"execute\"), mdx(\"span\", {\n    parentName: \"code\",\n    \"className\": \"token punctuation\"\n  }, \"(\"), mdx(\"span\", {\n    parentName: \"code\",\n    \"className\": \"token punctuation\"\n  }, \"{\"), \"\\n    \", mdx(\"span\", {\n    parentName: \"code\",\n    \"className\": \"token literal-property property\"\n  }, \"$unless_exists\"), mdx(\"span\", {\n    parentName: \"code\",\n    \"className\": \"token operator\"\n  }, \":\"), \" \", mdx(\"span\", {\n    parentName: \"code\",\n    \"className\": \"token string\"\n  }, \"'/tmp/nikita-tutorial/redis-stable/src/redis-server'\"), mdx(\"span\", {\n    parentName: \"code\",\n    \"className\": \"token punctuation\"\n  }, \",\"), \"\\n    \", mdx(\"span\", {\n    parentName: \"code\",\n    \"className\": \"token literal-property property\"\n  }, \"command\"), mdx(\"span\", {\n    parentName: \"code\",\n    \"className\": \"token operator\"\n  }, \":\"), \" \", mdx(\"span\", {\n    parentName: \"code\",\n    \"className\": \"token template-string\"\n  }, mdx(\"span\", {\n    parentName: \"span\",\n    \"className\": \"token template-punctuation string\"\n  }, \"`\"), mdx(\"span\", {\n    parentName: \"span\",\n    \"className\": \"token string\"\n  }, \"\\n    tar xzf /tmp/nikita-tutorial/cache/redis-stable.tar.gz -C /tmp/nikita-tutorial\\n    cd /tmp/nikita-tutorial/redis-stable\\n    make\\n    \"), mdx(\"span\", {\n    parentName: \"span\",\n    \"className\": \"token template-punctuation string\"\n  }, \"`\")), \"\\n  \", mdx(\"span\", {\n    parentName: \"code\",\n    \"className\": \"token punctuation\"\n  }, \"}\"), mdx(\"span\", {\n    parentName: \"code\",\n    \"className\": \"token punctuation\"\n  }, \")\"), \"\\n  console\", mdx(\"span\", {\n    parentName: \"code\",\n    \"className\": \"token punctuation\"\n  }, \".\"), mdx(\"span\", {\n    parentName: \"code\",\n    \"className\": \"token function\"\n  }, \"info\"), mdx(\"span\", {\n    parentName: \"code\",\n    \"className\": \"token punctuation\"\n  }, \"(\"), mdx(\"span\", {\n    parentName: \"code\",\n    \"className\": \"token string\"\n  }, \"'Redis compiled:'\"), mdx(\"span\", {\n    parentName: \"code\",\n    \"className\": \"token punctuation\"\n  }, \",\"), \" $status \", mdx(\"span\", {\n    parentName: \"code\",\n    \"className\": \"token operator\"\n  }, \"?\"), \" \", mdx(\"span\", {\n    parentName: \"code\",\n    \"className\": \"token string\"\n  }, \"'\\u2714'\"), \" \", mdx(\"span\", {\n    parentName: \"code\",\n    \"className\": \"token operator\"\n  }, \":\"), \" \", mdx(\"span\", {\n    parentName: \"code\",\n    \"className\": \"token string\"\n  }, \"'-'\"), mdx(\"span\", {\n    parentName: \"code\",\n    \"className\": \"token punctuation\"\n  }, \")\"), \"\\n\", mdx(\"span\", {\n    parentName: \"code\",\n    \"className\": \"token punctuation\"\n  }, \"}\"), mdx(\"span\", {\n    parentName: \"code\",\n    \"className\": \"token punctuation\"\n  }, \")\"), mdx(\"span\", {\n    parentName: \"code\",\n    \"className\": \"token punctuation\"\n  }, \"(\"), mdx(\"span\", {\n    parentName: \"code\",\n    \"className\": \"token punctuation\"\n  }, \")\")))), mdx(\"p\", null, \"It is annoying and not flexible to always provide the same an absolute base directory like \\\"/tmp/nikita-tutorial\\\" each time. Among many others, the \", mdx(\"code\", {\n    parentName: \"p\",\n    \"className\": \"language-text\"\n  }, \"nikita.execute\"), \" action comes with the \", mdx(\"code\", {\n    parentName: \"p\",\n    \"className\": \"language-text\"\n  }, \"cwd\"), \" configuration property. The acronym stands for \\\"current working directory\\\". The command is rewritten as:\"), mdx(\"div\", {\n    \"className\": \"gatsby-highlight\",\n    \"data-language\": \"js\"\n  }, mdx(\"pre\", {\n    parentName: \"div\",\n    \"className\": \"language-js\"\n  }, mdx(\"code\", {\n    parentName: \"pre\",\n    \"className\": \"language-js\"\n  }, mdx(\"span\", {\n    parentName: \"code\",\n    \"className\": \"token punctuation\"\n  }, \"(\"), mdx(\"span\", {\n    parentName: \"code\",\n    \"className\": \"token keyword\"\n  }, \"async\"), \" \", mdx(\"span\", {\n    parentName: \"code\",\n    \"className\": \"token punctuation\"\n  }, \"(\"), mdx(\"span\", {\n    parentName: \"code\",\n    \"className\": \"token punctuation\"\n  }, \")\"), \" \", mdx(\"span\", {\n    parentName: \"code\",\n    \"className\": \"token operator\"\n  }, \"=>\"), \" \", mdx(\"span\", {\n    parentName: \"code\",\n    \"className\": \"token punctuation\"\n  }, \"{\"), \"\\n  \", mdx(\"span\", {\n    parentName: \"code\",\n    \"className\": \"token keyword\"\n  }, \"var\"), \" \", mdx(\"span\", {\n    parentName: \"code\",\n    \"className\": \"token punctuation\"\n  }, \"{\"), \"$status\", mdx(\"span\", {\n    parentName: \"code\",\n    \"className\": \"token punctuation\"\n  }, \"}\"), \" \", mdx(\"span\", {\n    parentName: \"code\",\n    \"className\": \"token operator\"\n  }, \"=\"), \" \", mdx(\"span\", {\n    parentName: \"code\",\n    \"className\": \"token keyword\"\n  }, \"await\"), \" nikita\", mdx(\"span\", {\n    parentName: \"code\",\n    \"className\": \"token punctuation\"\n  }, \".\"), mdx(\"span\", {\n    parentName: \"code\",\n    \"className\": \"token function\"\n  }, \"execute\"), mdx(\"span\", {\n    parentName: \"code\",\n    \"className\": \"token punctuation\"\n  }, \"(\"), mdx(\"span\", {\n    parentName: \"code\",\n    \"className\": \"token punctuation\"\n  }, \"{\"), \"\\n    \", mdx(\"span\", {\n    parentName: \"code\",\n    \"className\": \"token literal-property property\"\n  }, \"$unless_exists\"), mdx(\"span\", {\n    parentName: \"code\",\n    \"className\": \"token operator\"\n  }, \":\"), \" \", mdx(\"span\", {\n    parentName: \"code\",\n    \"className\": \"token string\"\n  }, \"'/tmp/nikita-tutorial/redis-stable/src/redis-server'\"), mdx(\"span\", {\n    parentName: \"code\",\n    \"className\": \"token punctuation\"\n  }, \",\"), \"\\n    \", mdx(\"span\", {\n    parentName: \"code\",\n    \"className\": \"token literal-property property\"\n  }, \"command\"), mdx(\"span\", {\n    parentName: \"code\",\n    \"className\": \"token operator\"\n  }, \":\"), \" \", mdx(\"span\", {\n    parentName: \"code\",\n    \"className\": \"token template-string\"\n  }, mdx(\"span\", {\n    parentName: \"span\",\n    \"className\": \"token template-punctuation string\"\n  }, \"`\"), mdx(\"span\", {\n    parentName: \"span\",\n    \"className\": \"token string\"\n  }, \"\\n    tar xzf cache/redis-stable.tar.gz\\n    cd redis-stable\\n    make\\n    \"), mdx(\"span\", {\n    parentName: \"span\",\n    \"className\": \"token template-punctuation string\"\n  }, \"`\")), mdx(\"span\", {\n    parentName: \"code\",\n    \"className\": \"token punctuation\"\n  }, \",\"), \"\\n    \", mdx(\"span\", {\n    parentName: \"code\",\n    \"className\": \"token literal-property property\"\n  }, \"cwd\"), mdx(\"span\", {\n    parentName: \"code\",\n    \"className\": \"token operator\"\n  }, \":\"), \" \", mdx(\"span\", {\n    parentName: \"code\",\n    \"className\": \"token string\"\n  }, \"'/tmp/nikita-tutorial'\"), mdx(\"span\", {\n    parentName: \"code\",\n    \"className\": \"token punctuation\"\n  }, \",\"), \"  \", mdx(\"span\", {\n    parentName: \"code\",\n    \"className\": \"token comment\"\n  }, \"// Define current working directory\"), \"\\n  \", mdx(\"span\", {\n    parentName: \"code\",\n    \"className\": \"token punctuation\"\n  }, \"}\"), mdx(\"span\", {\n    parentName: \"code\",\n    \"className\": \"token punctuation\"\n  }, \")\"), \"\\n  console\", mdx(\"span\", {\n    parentName: \"code\",\n    \"className\": \"token punctuation\"\n  }, \".\"), mdx(\"span\", {\n    parentName: \"code\",\n    \"className\": \"token function\"\n  }, \"info\"), mdx(\"span\", {\n    parentName: \"code\",\n    \"className\": \"token punctuation\"\n  }, \"(\"), mdx(\"span\", {\n    parentName: \"code\",\n    \"className\": \"token string\"\n  }, \"'Redis compiled:'\"), mdx(\"span\", {\n    parentName: \"code\",\n    \"className\": \"token punctuation\"\n  }, \",\"), \" $status \", mdx(\"span\", {\n    parentName: \"code\",\n    \"className\": \"token operator\"\n  }, \"?\"), \" \", mdx(\"span\", {\n    parentName: \"code\",\n    \"className\": \"token string\"\n  }, \"'\\u2714'\"), \" \", mdx(\"span\", {\n    parentName: \"code\",\n    \"className\": \"token operator\"\n  }, \":\"), \" \", mdx(\"span\", {\n    parentName: \"code\",\n    \"className\": \"token string\"\n  }, \"'-'\"), mdx(\"span\", {\n    parentName: \"code\",\n    \"className\": \"token punctuation\"\n  }, \")\"), \"\\n\", mdx(\"span\", {\n    parentName: \"code\",\n    \"className\": \"token punctuation\"\n  }, \"}\"), mdx(\"span\", {\n    parentName: \"code\",\n    \"className\": \"token punctuation\"\n  }, \")\"), mdx(\"span\", {\n    parentName: \"code\",\n    \"className\": \"token punctuation\"\n  }, \"(\"), mdx(\"span\", {\n    parentName: \"code\",\n    \"className\": \"token punctuation\"\n  }, \")\")))), mdx(\"h3\", {\n    \"id\": \"2-redis-configuration-file\",\n    \"style\": {\n      \"position\": \"relative\"\n    }\n  }, mdx(\"a\", {\n    parentName: \"h3\",\n    \"href\": \"#2-redis-configuration-file\",\n    \"aria-label\": \"2 redis configuration file permalink\",\n    \"className\": \"anchor before\"\n  }, mdx(\"svg\", {\n    parentName: \"a\",\n    \"aria-hidden\": \"true\",\n    \"focusable\": \"false\",\n    \"height\": \"16\",\n    \"version\": \"1.1\",\n    \"viewBox\": \"0 0 16 16\",\n    \"width\": \"16\"\n  }, mdx(\"path\", {\n    parentName: \"svg\",\n    \"fillRule\": \"evenodd\",\n    \"d\": \"M4 9h1v1H4c-1.5 0-3-1.69-3-3.5S2.55 3 4 3h4c1.45 0 3 1.69 3 3.5 0 1.41-.91 2.72-2 3.25V8.59c.58-.45 1-1.27 1-2.09C10 5.22 8.98 4 8 4H4c-.98 0-2 1.22-2 2.5S3 9 4 9zm9-3h-1v1h1c1 0 2 1.22 2 2.5S13.98 12 13 12H9c-.98 0-2-1.22-2-2.5 0-.83.42-1.64 1-2.09V6.25c-1.09.53-2 1.84-2 3.25C6 11.31 7.55 13 9 13h4c1.45 0 3-1.69 3-3.5S14.5 6 13 6z\"\n  }))), \"2. Redis configuration file\"), mdx(\"p\", null, mdx(\"em\", {\n    parentName: \"p\"\n  }, \"Learn how to merge or overwrite a configuration by serializing a JavaScript vanilla object.\")), mdx(\"p\", null, \"Before starting the server, we create a configuration file. The Redis format is made of key-value pairs separated by spaces. This type of format can be handled with the \", mdx(\"code\", {\n    parentName: \"p\",\n    \"className\": \"language-text\"\n  }, \"nikita.file.properties\"), \" action with a custom \", mdx(\"code\", {\n    parentName: \"p\",\n    \"className\": \"language-text\"\n  }, \"separator\"), \" configuration set to one space. The action also comes with some handy config like \", mdx(\"code\", {\n    parentName: \"p\",\n    \"className\": \"language-text\"\n  }, \"comment\"), \" to preserve comments and \", mdx(\"code\", {\n    parentName: \"p\",\n    \"className\": \"language-text\"\n  }, \"merge\"), \" to preserve the properties already present in the file. \"), mdx(\"div\", {\n    \"className\": \"gatsby-highlight\",\n    \"data-language\": \"js\"\n  }, mdx(\"pre\", {\n    parentName: \"div\",\n    \"className\": \"language-js\"\n  }, mdx(\"code\", {\n    parentName: \"pre\",\n    \"className\": \"language-js\"\n  }, mdx(\"span\", {\n    parentName: \"code\",\n    \"className\": \"token punctuation\"\n  }, \"(\"), mdx(\"span\", {\n    parentName: \"code\",\n    \"className\": \"token keyword\"\n  }, \"async\"), \" \", mdx(\"span\", {\n    parentName: \"code\",\n    \"className\": \"token punctuation\"\n  }, \"(\"), mdx(\"span\", {\n    parentName: \"code\",\n    \"className\": \"token punctuation\"\n  }, \")\"), \" \", mdx(\"span\", {\n    parentName: \"code\",\n    \"className\": \"token operator\"\n  }, \"=>\"), \" \", mdx(\"span\", {\n    parentName: \"code\",\n    \"className\": \"token punctuation\"\n  }, \"{\"), \"\\n  \", mdx(\"span\", {\n    parentName: \"code\",\n    \"className\": \"token keyword\"\n  }, \"var\"), \" \", mdx(\"span\", {\n    parentName: \"code\",\n    \"className\": \"token punctuation\"\n  }, \"{\"), \"$status\", mdx(\"span\", {\n    parentName: \"code\",\n    \"className\": \"token punctuation\"\n  }, \"}\"), \" \", mdx(\"span\", {\n    parentName: \"code\",\n    \"className\": \"token operator\"\n  }, \"=\"), \" \", mdx(\"span\", {\n    parentName: \"code\",\n    \"className\": \"token keyword\"\n  }, \"await\"), \" nikita\", mdx(\"span\", {\n    parentName: \"code\",\n    \"className\": \"token punctuation\"\n  }, \".\"), \"file\", mdx(\"span\", {\n    parentName: \"code\",\n    \"className\": \"token punctuation\"\n  }, \".\"), mdx(\"span\", {\n    parentName: \"code\",\n    \"className\": \"token function\"\n  }, \"properties\"), mdx(\"span\", {\n    parentName: \"code\",\n    \"className\": \"token punctuation\"\n  }, \"(\"), mdx(\"span\", {\n    parentName: \"code\",\n    \"className\": \"token punctuation\"\n  }, \"{\"), \"\\n    \", mdx(\"span\", {\n    parentName: \"code\",\n    \"className\": \"token literal-property property\"\n  }, \"content\"), mdx(\"span\", {\n    parentName: \"code\",\n    \"className\": \"token operator\"\n  }, \":\"), \" \", mdx(\"span\", {\n    parentName: \"code\",\n    \"className\": \"token punctuation\"\n  }, \"{\"), \"\\n      \", mdx(\"span\", {\n    parentName: \"code\",\n    \"className\": \"token string-property property\"\n  }, \"'bind'\"), mdx(\"span\", {\n    parentName: \"code\",\n    \"className\": \"token operator\"\n  }, \":\"), \" \", mdx(\"span\", {\n    parentName: \"code\",\n    \"className\": \"token string\"\n  }, \"'127.0.0.1'\"), mdx(\"span\", {\n    parentName: \"code\",\n    \"className\": \"token punctuation\"\n  }, \",\"), \"\\n      \", mdx(\"span\", {\n    parentName: \"code\",\n    \"className\": \"token string-property property\"\n  }, \"'daemonize'\"), mdx(\"span\", {\n    parentName: \"code\",\n    \"className\": \"token operator\"\n  }, \":\"), \" \", mdx(\"span\", {\n    parentName: \"code\",\n    \"className\": \"token string\"\n  }, \"'yes'\"), mdx(\"span\", {\n    parentName: \"code\",\n    \"className\": \"token punctuation\"\n  }, \",\"), \"\\n      \", mdx(\"span\", {\n    parentName: \"code\",\n    \"className\": \"token string-property property\"\n  }, \"'protected-mode'\"), mdx(\"span\", {\n    parentName: \"code\",\n    \"className\": \"token operator\"\n  }, \":\"), \" \", mdx(\"span\", {\n    parentName: \"code\",\n    \"className\": \"token string\"\n  }, \"'yes'\"), mdx(\"span\", {\n    parentName: \"code\",\n    \"className\": \"token punctuation\"\n  }, \",\"), \"\\n      \", mdx(\"span\", {\n    parentName: \"code\",\n    \"className\": \"token string-property property\"\n  }, \"'port'\"), mdx(\"span\", {\n    parentName: \"code\",\n    \"className\": \"token operator\"\n  }, \":\"), \" \", mdx(\"span\", {\n    parentName: \"code\",\n    \"className\": \"token number\"\n  }, \"6379\"), \"\\n    \", mdx(\"span\", {\n    parentName: \"code\",\n    \"className\": \"token punctuation\"\n  }, \"}\"), mdx(\"span\", {\n    parentName: \"code\",\n    \"className\": \"token punctuation\"\n  }, \",\"), \"\\n    \", mdx(\"span\", {\n    parentName: \"code\",\n    \"className\": \"token literal-property property\"\n  }, \"separator\"), mdx(\"span\", {\n    parentName: \"code\",\n    \"className\": \"token operator\"\n  }, \":\"), \" \", mdx(\"span\", {\n    parentName: \"code\",\n    \"className\": \"token string\"\n  }, \"' '\"), mdx(\"span\", {\n    parentName: \"code\",\n    \"className\": \"token punctuation\"\n  }, \",\"), \"\\n    \", mdx(\"span\", {\n    parentName: \"code\",\n    \"className\": \"token literal-property property\"\n  }, \"target\"), mdx(\"span\", {\n    parentName: \"code\",\n    \"className\": \"token operator\"\n  }, \":\"), \" \", mdx(\"span\", {\n    parentName: \"code\",\n    \"className\": \"token string\"\n  }, \"'/tmp/nikita-tutorial/conf/redis.conf'\"), mdx(\"span\", {\n    parentName: \"code\",\n    \"className\": \"token punctuation\"\n  }, \",\"), \"\\n  \", mdx(\"span\", {\n    parentName: \"code\",\n    \"className\": \"token punctuation\"\n  }, \"}\"), mdx(\"span\", {\n    parentName: \"code\",\n    \"className\": \"token punctuation\"\n  }, \")\"), \"\\n  console\", mdx(\"span\", {\n    parentName: \"code\",\n    \"className\": \"token punctuation\"\n  }, \".\"), mdx(\"span\", {\n    parentName: \"code\",\n    \"className\": \"token function\"\n  }, \"info\"), mdx(\"span\", {\n    parentName: \"code\",\n    \"className\": \"token punctuation\"\n  }, \"(\"), mdx(\"span\", {\n    parentName: \"code\",\n    \"className\": \"token string\"\n  }, \"'Redis configuration set:'\"), mdx(\"span\", {\n    parentName: \"code\",\n    \"className\": \"token punctuation\"\n  }, \",\"), \" $status \", mdx(\"span\", {\n    parentName: \"code\",\n    \"className\": \"token operator\"\n  }, \"?\"), \" \", mdx(\"span\", {\n    parentName: \"code\",\n    \"className\": \"token string\"\n  }, \"'\\u2714'\"), \" \", mdx(\"span\", {\n    parentName: \"code\",\n    \"className\": \"token operator\"\n  }, \":\"), \" \", mdx(\"span\", {\n    parentName: \"code\",\n    \"className\": \"token string\"\n  }, \"'-'\"), mdx(\"span\", {\n    parentName: \"code\",\n    \"className\": \"token punctuation\"\n  }, \")\"), \"\\n\", mdx(\"span\", {\n    parentName: \"code\",\n    \"className\": \"token punctuation\"\n  }, \"}\"), mdx(\"span\", {\n    parentName: \"code\",\n    \"className\": \"token punctuation\"\n  }, \")\"), mdx(\"span\", {\n    parentName: \"code\",\n    \"className\": \"token punctuation\"\n  }, \"(\"), mdx(\"span\", {\n    parentName: \"code\",\n    \"className\": \"token punctuation\"\n  }, \")\")))), mdx(\"h3\", {\n    \"id\": \"3-cli-reporting-and-logs\",\n    \"style\": {\n      \"position\": \"relative\"\n    }\n  }, mdx(\"a\", {\n    parentName: \"h3\",\n    \"href\": \"#3-cli-reporting-and-logs\",\n    \"aria-label\": \"3 cli reporting and logs permalink\",\n    \"className\": \"anchor before\"\n  }, mdx(\"svg\", {\n    parentName: \"a\",\n    \"aria-hidden\": \"true\",\n    \"focusable\": \"false\",\n    \"height\": \"16\",\n    \"version\": \"1.1\",\n    \"viewBox\": \"0 0 16 16\",\n    \"width\": \"16\"\n  }, mdx(\"path\", {\n    parentName: \"svg\",\n    \"fillRule\": \"evenodd\",\n    \"d\": \"M4 9h1v1H4c-1.5 0-3-1.69-3-3.5S2.55 3 4 3h4c1.45 0 3 1.69 3 3.5 0 1.41-.91 2.72-2 3.25V8.59c.58-.45 1-1.27 1-2.09C10 5.22 8.98 4 8 4H4c-.98 0-2 1.22-2 2.5S3 9 4 9zm9-3h-1v1h1c1 0 2 1.22 2 2.5S13.98 12 13 12H9c-.98 0-2-1.22-2-2.5 0-.83.42-1.64 1-2.09V6.25c-1.09.53-2 1.84-2 3.25C6 11.31 7.55 13 9 13h4c1.45 0 3-1.69 3-3.5S14.5 6 13 6z\"\n  }))), \"3. CLI reporting and logs\"), mdx(\"p\", null, mdx(\"em\", {\n    parentName: \"p\"\n  }, \"Learn how to activate pretty reporting and detailed logs written in Markdown.\")), mdx(\"p\", null, \"So far, we retrieved the action output to manually print a message for the user with the \", mdx(\"code\", {\n    parentName: \"p\",\n    \"className\": \"language-text\"\n  }, \"console.info\"), \" function completed by character depending the the execution status. This process is automatically managed by the \", mdx(\"code\", {\n    parentName: \"p\",\n    \"className\": \"language-text\"\n  }, \"nikita.log.cli\"), \" action. A message is printed to the user terminal whenever the \", mdx(\"code\", {\n    parentName: \"p\",\n    \"className\": \"language-text\"\n  }, \"header\"), \" metadata property is present:\"), mdx(\"div\", {\n    \"className\": \"gatsby-highlight\",\n    \"data-language\": \"js\"\n  }, mdx(\"pre\", {\n    parentName: \"div\",\n    \"className\": \"language-js\"\n  }, mdx(\"code\", {\n    parentName: \"pre\",\n    \"className\": \"language-js\"\n  }, mdx(\"span\", {\n    parentName: \"code\",\n    \"className\": \"token function\"\n  }, \"nikita\"), mdx(\"span\", {\n    parentName: \"code\",\n    \"className\": \"token punctuation\"\n  }, \"(\"), mdx(\"span\", {\n    parentName: \"code\",\n    \"className\": \"token keyword\"\n  }, \"async\"), \" \", mdx(\"span\", {\n    parentName: \"code\",\n    \"className\": \"token keyword\"\n  }, \"function\"), mdx(\"span\", {\n    parentName: \"code\",\n    \"className\": \"token punctuation\"\n  }, \"(\"), mdx(\"span\", {\n    parentName: \"code\",\n    \"className\": \"token punctuation\"\n  }, \")\"), \" \", mdx(\"span\", {\n    parentName: \"code\",\n    \"className\": \"token punctuation\"\n  }, \"{\"), \"\\n  \", mdx(\"span\", {\n    parentName: \"code\",\n    \"className\": \"token comment\"\n  }, \"// Activate CLI reporting\"), \"\\n  \", mdx(\"span\", {\n    parentName: \"code\",\n    \"className\": \"token keyword\"\n  }, \"await\"), \" \", mdx(\"span\", {\n    parentName: \"code\",\n    \"className\": \"token keyword\"\n  }, \"this\"), mdx(\"span\", {\n    parentName: \"code\",\n    \"className\": \"token punctuation\"\n  }, \".\"), \"log\", mdx(\"span\", {\n    parentName: \"code\",\n    \"className\": \"token punctuation\"\n  }, \".\"), mdx(\"span\", {\n    parentName: \"code\",\n    \"className\": \"token function\"\n  }, \"cli\"), mdx(\"span\", {\n    parentName: \"code\",\n    \"className\": \"token punctuation\"\n  }, \"(\"), mdx(\"span\", {\n    parentName: \"code\",\n    \"className\": \"token punctuation\"\n  }, \")\"), \"\\n  \", mdx(\"span\", {\n    parentName: \"code\",\n    \"className\": \"token comment\"\n  }, \"// Call any action\"), \"\\n  \", mdx(\"span\", {\n    parentName: \"code\",\n    \"className\": \"token keyword\"\n  }, \"await\"), \" \", mdx(\"span\", {\n    parentName: \"code\",\n    \"className\": \"token keyword\"\n  }, \"this\"), mdx(\"span\", {\n    parentName: \"code\",\n    \"className\": \"token punctuation\"\n  }, \".\"), \"file\", mdx(\"span\", {\n    parentName: \"code\",\n    \"className\": \"token punctuation\"\n  }, \".\"), mdx(\"span\", {\n    parentName: \"code\",\n    \"className\": \"token function\"\n  }, \"properties\"), mdx(\"span\", {\n    parentName: \"code\",\n    \"className\": \"token punctuation\"\n  }, \"(\"), mdx(\"span\", {\n    parentName: \"code\",\n    \"className\": \"token punctuation\"\n  }, \"{\"), \"\\n    \", mdx(\"span\", {\n    parentName: \"code\",\n    \"className\": \"token literal-property property\"\n  }, \"$header\"), mdx(\"span\", {\n    parentName: \"code\",\n    \"className\": \"token operator\"\n  }, \":\"), \" \", mdx(\"span\", {\n    parentName: \"code\",\n    \"className\": \"token string\"\n  }, \"'Redis configuration'\"), mdx(\"span\", {\n    parentName: \"code\",\n    \"className\": \"token punctuation\"\n  }, \",\"), \" \", mdx(\"span\", {\n    parentName: \"code\",\n    \"className\": \"token comment\"\n  }, \"// CLI messages\"), \"\\n    \", mdx(\"span\", {\n    parentName: \"code\",\n    \"className\": \"token literal-property property\"\n  }, \"content\"), mdx(\"span\", {\n    parentName: \"code\",\n    \"className\": \"token operator\"\n  }, \":\"), \" \", mdx(\"span\", {\n    parentName: \"code\",\n    \"className\": \"token punctuation\"\n  }, \"{\"), \"\\n      \", mdx(\"span\", {\n    parentName: \"code\",\n    \"className\": \"token string-property property\"\n  }, \"'bind'\"), mdx(\"span\", {\n    parentName: \"code\",\n    \"className\": \"token operator\"\n  }, \":\"), \" \", mdx(\"span\", {\n    parentName: \"code\",\n    \"className\": \"token string\"\n  }, \"'127.0.0.1'\"), mdx(\"span\", {\n    parentName: \"code\",\n    \"className\": \"token punctuation\"\n  }, \",\"), \"\\n      \", mdx(\"span\", {\n    parentName: \"code\",\n    \"className\": \"token string-property property\"\n  }, \"'daemonize'\"), mdx(\"span\", {\n    parentName: \"code\",\n    \"className\": \"token operator\"\n  }, \":\"), \" \", mdx(\"span\", {\n    parentName: \"code\",\n    \"className\": \"token string\"\n  }, \"'yes'\"), mdx(\"span\", {\n    parentName: \"code\",\n    \"className\": \"token punctuation\"\n  }, \",\"), \"\\n      \", mdx(\"span\", {\n    parentName: \"code\",\n    \"className\": \"token string-property property\"\n  }, \"'protected-mode'\"), mdx(\"span\", {\n    parentName: \"code\",\n    \"className\": \"token operator\"\n  }, \":\"), \" \", mdx(\"span\", {\n    parentName: \"code\",\n    \"className\": \"token string\"\n  }, \"'yes'\"), mdx(\"span\", {\n    parentName: \"code\",\n    \"className\": \"token punctuation\"\n  }, \",\"), \"\\n      \", mdx(\"span\", {\n    parentName: \"code\",\n    \"className\": \"token string-property property\"\n  }, \"'port'\"), mdx(\"span\", {\n    parentName: \"code\",\n    \"className\": \"token operator\"\n  }, \":\"), \" \", mdx(\"span\", {\n    parentName: \"code\",\n    \"className\": \"token number\"\n  }, \"6379\"), mdx(\"span\", {\n    parentName: \"code\",\n    \"className\": \"token punctuation\"\n  }, \",\"), \"\\n    \", mdx(\"span\", {\n    parentName: \"code\",\n    \"className\": \"token punctuation\"\n  }, \"}\"), mdx(\"span\", {\n    parentName: \"code\",\n    \"className\": \"token punctuation\"\n  }, \",\"), \"\\n    \", mdx(\"span\", {\n    parentName: \"code\",\n    \"className\": \"token literal-property property\"\n  }, \"separator\"), mdx(\"span\", {\n    parentName: \"code\",\n    \"className\": \"token operator\"\n  }, \":\"), \" \", mdx(\"span\", {\n    parentName: \"code\",\n    \"className\": \"token string\"\n  }, \"' '\"), mdx(\"span\", {\n    parentName: \"code\",\n    \"className\": \"token punctuation\"\n  }, \",\"), \"\\n    \", mdx(\"span\", {\n    parentName: \"code\",\n    \"className\": \"token literal-property property\"\n  }, \"target\"), mdx(\"span\", {\n    parentName: \"code\",\n    \"className\": \"token operator\"\n  }, \":\"), \" \", mdx(\"span\", {\n    parentName: \"code\",\n    \"className\": \"token string\"\n  }, \"'/tmp/nikita-tutorial/redis-stable/redis.conf'\"), mdx(\"span\", {\n    parentName: \"code\",\n    \"className\": \"token punctuation\"\n  }, \",\"), \"\\n  \", mdx(\"span\", {\n    parentName: \"code\",\n    \"className\": \"token punctuation\"\n  }, \"}\"), mdx(\"span\", {\n    parentName: \"code\",\n    \"className\": \"token punctuation\"\n  }, \")\"), \"\\n\", mdx(\"span\", {\n    parentName: \"code\",\n    \"className\": \"token punctuation\"\n  }, \"}\"), mdx(\"span\", {\n    parentName: \"code\",\n    \"className\": \"token punctuation\"\n  }, \")\")))), mdx(\"p\", null, \"The message contains information such as the hostname or the IP address where the action is executed, the custom header, the status symbol, and the time of execution. It ends with \", mdx(\"code\", {\n    parentName: \"p\",\n    \"className\": \"language-text\"\n  }, \"\\u2665\"), \" to indicate the termination of the Nikita session:\"), mdx(\"div\", {\n    \"className\": \"gatsby-highlight\",\n    \"data-language\": \"bash\"\n  }, mdx(\"pre\", {\n    parentName: \"div\",\n    \"className\": \"language-bash\"\n  }, mdx(\"code\", {\n    parentName: \"pre\",\n    \"className\": \"language-bash\"\n  }, \"localhost   Redis configuration   \\u2714  109ms\\nlocalhost      \\u2665  \"))), mdx(\"p\", null, \"What if an action failed and the error message is not explicit enough? What if a system command failed and we need to dig and get detailed information? Nikita doesn't have to run as a black box. Multiple error reporting actions are made available such as the \", mdx(\"code\", {\n    parentName: \"p\",\n    \"className\": \"language-text\"\n  }, \"nikita.log.md\"), \" which writes logs in the Markdown format:\"), mdx(\"div\", {\n    \"className\": \"gatsby-highlight\",\n    \"data-language\": \"js\"\n  }, mdx(\"pre\", {\n    parentName: \"div\",\n    \"className\": \"language-js\"\n  }, mdx(\"code\", {\n    parentName: \"pre\",\n    \"className\": \"language-js\"\n  }, mdx(\"span\", {\n    parentName: \"code\",\n    \"className\": \"token function\"\n  }, \"nikita\"), mdx(\"span\", {\n    parentName: \"code\",\n    \"className\": \"token punctuation\"\n  }, \"(\"), mdx(\"span\", {\n    parentName: \"code\",\n    \"className\": \"token keyword\"\n  }, \"async\"), \" \", mdx(\"span\", {\n    parentName: \"code\",\n    \"className\": \"token keyword\"\n  }, \"function\"), mdx(\"span\", {\n    parentName: \"code\",\n    \"className\": \"token punctuation\"\n  }, \"(\"), mdx(\"span\", {\n    parentName: \"code\",\n    \"className\": \"token punctuation\"\n  }, \")\"), \" \", mdx(\"span\", {\n    parentName: \"code\",\n    \"className\": \"token punctuation\"\n  }, \"{\"), \"\\n  \", mdx(\"span\", {\n    parentName: \"code\",\n    \"className\": \"token comment\"\n  }, \"// Activate Markdown reporting\"), \"\\n  \", mdx(\"span\", {\n    parentName: \"code\",\n    \"className\": \"token keyword\"\n  }, \"await\"), \" \", mdx(\"span\", {\n    parentName: \"code\",\n    \"className\": \"token keyword\"\n  }, \"this\"), mdx(\"span\", {\n    parentName: \"code\",\n    \"className\": \"token punctuation\"\n  }, \".\"), \"log\", mdx(\"span\", {\n    parentName: \"code\",\n    \"className\": \"token punctuation\"\n  }, \".\"), mdx(\"span\", {\n    parentName: \"code\",\n    \"className\": \"token function\"\n  }, \"md\"), mdx(\"span\", {\n    parentName: \"code\",\n    \"className\": \"token punctuation\"\n  }, \"(\"), mdx(\"span\", {\n    parentName: \"code\",\n    \"className\": \"token punctuation\"\n  }, \"{\"), \"\\n    \", mdx(\"span\", {\n    parentName: \"code\",\n    \"className\": \"token literal-property property\"\n  }, \"basedir\"), mdx(\"span\", {\n    parentName: \"code\",\n    \"className\": \"token operator\"\n  }, \":\"), \" \", mdx(\"span\", {\n    parentName: \"code\",\n    \"className\": \"token string\"\n  }, \"'/tmp/nikita-tutorial/log'\"), \"\\n  \", mdx(\"span\", {\n    parentName: \"code\",\n    \"className\": \"token punctuation\"\n  }, \"}\"), mdx(\"span\", {\n    parentName: \"code\",\n    \"className\": \"token punctuation\"\n  }, \")\"), \"\\n  \", mdx(\"span\", {\n    parentName: \"code\",\n    \"className\": \"token comment\"\n  }, \"// Call any action\"), \"\\n  \", mdx(\"span\", {\n    parentName: \"code\",\n    \"className\": \"token keyword\"\n  }, \"await\"), \" \", mdx(\"span\", {\n    parentName: \"code\",\n    \"className\": \"token keyword\"\n  }, \"this\"), mdx(\"span\", {\n    parentName: \"code\",\n    \"className\": \"token punctuation\"\n  }, \".\"), \"file\", mdx(\"span\", {\n    parentName: \"code\",\n    \"className\": \"token punctuation\"\n  }, \".\"), mdx(\"span\", {\n    parentName: \"code\",\n    \"className\": \"token function\"\n  }, \"properties\"), mdx(\"span\", {\n    parentName: \"code\",\n    \"className\": \"token punctuation\"\n  }, \"(\"), mdx(\"span\", {\n    parentName: \"code\",\n    \"className\": \"token punctuation\"\n  }, \"{\"), \"\\n    \", mdx(\"span\", {\n    parentName: \"code\",\n    \"className\": \"token comment\"\n  }, \"// The Markdown header\"), \"\\n    \", mdx(\"span\", {\n    parentName: \"code\",\n    \"className\": \"token literal-property property\"\n  }, \"$header\"), mdx(\"span\", {\n    parentName: \"code\",\n    \"className\": \"token operator\"\n  }, \":\"), \" \", mdx(\"span\", {\n    parentName: \"code\",\n    \"className\": \"token string\"\n  }, \"'Redis configuration'\"), mdx(\"span\", {\n    parentName: \"code\",\n    \"className\": \"token punctuation\"\n  }, \",\"), \"\\n    \", mdx(\"span\", {\n    parentName: \"code\",\n    \"className\": \"token literal-property property\"\n  }, \"content\"), mdx(\"span\", {\n    parentName: \"code\",\n    \"className\": \"token operator\"\n  }, \":\"), \" \", mdx(\"span\", {\n    parentName: \"code\",\n    \"className\": \"token punctuation\"\n  }, \"{\"), \"\\n      \", mdx(\"span\", {\n    parentName: \"code\",\n    \"className\": \"token string-property property\"\n  }, \"'bind'\"), mdx(\"span\", {\n    parentName: \"code\",\n    \"className\": \"token operator\"\n  }, \":\"), \" \", mdx(\"span\", {\n    parentName: \"code\",\n    \"className\": \"token string\"\n  }, \"'127.0.0.1'\"), mdx(\"span\", {\n    parentName: \"code\",\n    \"className\": \"token punctuation\"\n  }, \",\"), \"\\n      \", mdx(\"span\", {\n    parentName: \"code\",\n    \"className\": \"token string-property property\"\n  }, \"'daemonize'\"), mdx(\"span\", {\n    parentName: \"code\",\n    \"className\": \"token operator\"\n  }, \":\"), \" \", mdx(\"span\", {\n    parentName: \"code\",\n    \"className\": \"token string\"\n  }, \"'yes'\"), mdx(\"span\", {\n    parentName: \"code\",\n    \"className\": \"token punctuation\"\n  }, \",\"), \"\\n      \", mdx(\"span\", {\n    parentName: \"code\",\n    \"className\": \"token string-property property\"\n  }, \"'protected-mode'\"), mdx(\"span\", {\n    parentName: \"code\",\n    \"className\": \"token operator\"\n  }, \":\"), \" \", mdx(\"span\", {\n    parentName: \"code\",\n    \"className\": \"token string\"\n  }, \"'yes'\"), mdx(\"span\", {\n    parentName: \"code\",\n    \"className\": \"token punctuation\"\n  }, \",\"), \"\\n      \", mdx(\"span\", {\n    parentName: \"code\",\n    \"className\": \"token string-property property\"\n  }, \"'port'\"), mdx(\"span\", {\n    parentName: \"code\",\n    \"className\": \"token operator\"\n  }, \":\"), \" \", mdx(\"span\", {\n    parentName: \"code\",\n    \"className\": \"token number\"\n  }, \"6379\"), \"\\n    \", mdx(\"span\", {\n    parentName: \"code\",\n    \"className\": \"token punctuation\"\n  }, \"}\"), mdx(\"span\", {\n    parentName: \"code\",\n    \"className\": \"token punctuation\"\n  }, \",\"), \"\\n    \", mdx(\"span\", {\n    parentName: \"code\",\n    \"className\": \"token literal-property property\"\n  }, \"separator\"), mdx(\"span\", {\n    parentName: \"code\",\n    \"className\": \"token operator\"\n  }, \":\"), \" \", mdx(\"span\", {\n    parentName: \"code\",\n    \"className\": \"token string\"\n  }, \"' '\"), mdx(\"span\", {\n    parentName: \"code\",\n    \"className\": \"token punctuation\"\n  }, \",\"), \"\\n    \", mdx(\"span\", {\n    parentName: \"code\",\n    \"className\": \"token literal-property property\"\n  }, \"target\"), mdx(\"span\", {\n    parentName: \"code\",\n    \"className\": \"token operator\"\n  }, \":\"), \" \", mdx(\"span\", {\n    parentName: \"code\",\n    \"className\": \"token string\"\n  }, \"'/tmp/nikita-tutorial/conf/redis.conf'\"), mdx(\"span\", {\n    parentName: \"code\",\n    \"className\": \"token punctuation\"\n  }, \",\"), \"\\n  \", mdx(\"span\", {\n    parentName: \"code\",\n    \"className\": \"token punctuation\"\n  }, \"}\"), mdx(\"span\", {\n    parentName: \"code\",\n    \"className\": \"token punctuation\"\n  }, \")\"), \"\\n\", mdx(\"span\", {\n    parentName: \"code\",\n    \"className\": \"token punctuation\"\n  }, \"}\"), mdx(\"span\", {\n    parentName: \"code\",\n    \"className\": \"token punctuation\"\n  }, \")\")))), mdx(\"p\", null, \"Under the hood, both the \", mdx(\"code\", {\n    parentName: \"p\",\n    \"className\": \"language-text\"\n  }, \"nikita.log.cli\"), \" and the \", mdx(\"code\", {\n    parentName: \"p\",\n    \"className\": \"language-text\"\n  }, \"nikita.log.md\"), \" actions leverage the native Node.js \", mdx(\"a\", {\n    parentName: \"p\",\n    \"href\": \"https://nodejs.org/api/events.html\"\n  }, \"event API\"), \". You can get more detailed information by visiting the \", mdx(\"a\", {\n    parentName: \"p\",\n    \"href\": \"/current/guide/logging_debugging/\"\n  }, \"Logging and Debugging\"), \" documentation.\"), mdx(\"p\", null, \"Finally, if you need to quickly access verbose debugging information, use the \", mdx(\"code\", {\n    parentName: \"p\",\n    \"className\": \"language-text\"\n  }, \"debug\"), \" metadata property:\"), mdx(\"div\", {\n    \"className\": \"gatsby-highlight\",\n    \"data-language\": \"js\"\n  }, mdx(\"pre\", {\n    parentName: \"div\",\n    \"className\": \"language-js\"\n  }, mdx(\"code\", {\n    parentName: \"pre\",\n    \"className\": \"language-js\"\n  }, mdx(\"span\", {\n    parentName: \"code\",\n    \"className\": \"token function\"\n  }, \"nikita\"), mdx(\"span\", {\n    parentName: \"code\",\n    \"className\": \"token punctuation\"\n  }, \"(\"), mdx(\"span\", {\n    parentName: \"code\",\n    \"className\": \"token punctuation\"\n  }, \"{\"), \"\\n  \", mdx(\"span\", {\n    parentName: \"code\",\n    \"className\": \"token literal-property property\"\n  }, \"$debug\"), mdx(\"span\", {\n    parentName: \"code\",\n    \"className\": \"token operator\"\n  }, \":\"), \" \", mdx(\"span\", {\n    parentName: \"code\",\n    \"className\": \"token boolean\"\n  }, \"true\"), \"\\n\", mdx(\"span\", {\n    parentName: \"code\",\n    \"className\": \"token punctuation\"\n  }, \"}\"), mdx(\"span\", {\n    parentName: \"code\",\n    \"className\": \"token punctuation\"\n  }, \",\"), \" \", mdx(\"span\", {\n    parentName: \"code\",\n    \"className\": \"token keyword\"\n  }, \"async\"), \" \", mdx(\"span\", {\n    parentName: \"code\",\n    \"className\": \"token keyword\"\n  }, \"function\"), mdx(\"span\", {\n    parentName: \"code\",\n    \"className\": \"token punctuation\"\n  }, \"(\"), mdx(\"span\", {\n    parentName: \"code\",\n    \"className\": \"token punctuation\"\n  }, \")\"), \" \", mdx(\"span\", {\n    parentName: \"code\",\n    \"className\": \"token punctuation\"\n  }, \"{\"), \"\\n  \", mdx(\"span\", {\n    parentName: \"code\",\n    \"className\": \"token keyword\"\n  }, \"await\"), \" \", mdx(\"span\", {\n    parentName: \"code\",\n    \"className\": \"token keyword\"\n  }, \"this\"), mdx(\"span\", {\n    parentName: \"code\",\n    \"className\": \"token punctuation\"\n  }, \".\"), \"file\", mdx(\"span\", {\n    parentName: \"code\",\n    \"className\": \"token punctuation\"\n  }, \".\"), mdx(\"span\", {\n    parentName: \"code\",\n    \"className\": \"token function\"\n  }, \"properties\"), mdx(\"span\", {\n    parentName: \"code\",\n    \"className\": \"token punctuation\"\n  }, \"(\"), mdx(\"span\", {\n    parentName: \"code\",\n    \"className\": \"token punctuation\"\n  }, \"{\"), \"\\n    \", mdx(\"span\", {\n    parentName: \"code\",\n    \"className\": \"token comment\"\n  }, \"// The Markdown header\"), \"\\n    \", mdx(\"span\", {\n    parentName: \"code\",\n    \"className\": \"token literal-property property\"\n  }, \"$header\"), mdx(\"span\", {\n    parentName: \"code\",\n    \"className\": \"token operator\"\n  }, \":\"), \" \", mdx(\"span\", {\n    parentName: \"code\",\n    \"className\": \"token string\"\n  }, \"'Redis configuration'\"), mdx(\"span\", {\n    parentName: \"code\",\n    \"className\": \"token punctuation\"\n  }, \",\"), \"\\n    \", mdx(\"span\", {\n    parentName: \"code\",\n    \"className\": \"token literal-property property\"\n  }, \"content\"), mdx(\"span\", {\n    parentName: \"code\",\n    \"className\": \"token operator\"\n  }, \":\"), \" \", mdx(\"span\", {\n    parentName: \"code\",\n    \"className\": \"token punctuation\"\n  }, \"{\"), \"\\n      \", mdx(\"span\", {\n    parentName: \"code\",\n    \"className\": \"token string-property property\"\n  }, \"'bind'\"), mdx(\"span\", {\n    parentName: \"code\",\n    \"className\": \"token operator\"\n  }, \":\"), \" \", mdx(\"span\", {\n    parentName: \"code\",\n    \"className\": \"token string\"\n  }, \"'127.0.0.1'\"), mdx(\"span\", {\n    parentName: \"code\",\n    \"className\": \"token punctuation\"\n  }, \",\"), \"\\n      \", mdx(\"span\", {\n    parentName: \"code\",\n    \"className\": \"token string-property property\"\n  }, \"'daemonize'\"), mdx(\"span\", {\n    parentName: \"code\",\n    \"className\": \"token operator\"\n  }, \":\"), \" \", mdx(\"span\", {\n    parentName: \"code\",\n    \"className\": \"token string\"\n  }, \"'yes'\"), mdx(\"span\", {\n    parentName: \"code\",\n    \"className\": \"token punctuation\"\n  }, \",\"), \"\\n      \", mdx(\"span\", {\n    parentName: \"code\",\n    \"className\": \"token string-property property\"\n  }, \"'protected-mode'\"), mdx(\"span\", {\n    parentName: \"code\",\n    \"className\": \"token operator\"\n  }, \":\"), \" \", mdx(\"span\", {\n    parentName: \"code\",\n    \"className\": \"token string\"\n  }, \"'yes'\"), mdx(\"span\", {\n    parentName: \"code\",\n    \"className\": \"token punctuation\"\n  }, \",\"), \"\\n      \", mdx(\"span\", {\n    parentName: \"code\",\n    \"className\": \"token string-property property\"\n  }, \"'port'\"), mdx(\"span\", {\n    parentName: \"code\",\n    \"className\": \"token operator\"\n  }, \":\"), \" \", mdx(\"span\", {\n    parentName: \"code\",\n    \"className\": \"token number\"\n  }, \"6379\"), \"\\n    \", mdx(\"span\", {\n    parentName: \"code\",\n    \"className\": \"token punctuation\"\n  }, \"}\"), mdx(\"span\", {\n    parentName: \"code\",\n    \"className\": \"token punctuation\"\n  }, \",\"), \"\\n    \", mdx(\"span\", {\n    parentName: \"code\",\n    \"className\": \"token literal-property property\"\n  }, \"separator\"), mdx(\"span\", {\n    parentName: \"code\",\n    \"className\": \"token operator\"\n  }, \":\"), \" \", mdx(\"span\", {\n    parentName: \"code\",\n    \"className\": \"token string\"\n  }, \"' '\"), mdx(\"span\", {\n    parentName: \"code\",\n    \"className\": \"token punctuation\"\n  }, \",\"), \"\\n    \", mdx(\"span\", {\n    parentName: \"code\",\n    \"className\": \"token literal-property property\"\n  }, \"target\"), mdx(\"span\", {\n    parentName: \"code\",\n    \"className\": \"token operator\"\n  }, \":\"), \" \", mdx(\"span\", {\n    parentName: \"code\",\n    \"className\": \"token string\"\n  }, \"'/tmp/nikita-tutorial/conf/redis.conf'\"), mdx(\"span\", {\n    parentName: \"code\",\n    \"className\": \"token punctuation\"\n  }, \",\"), \"\\n  \", mdx(\"span\", {\n    parentName: \"code\",\n    \"className\": \"token punctuation\"\n  }, \"}\"), mdx(\"span\", {\n    parentName: \"code\",\n    \"className\": \"token punctuation\"\n  }, \")\"), \"\\n\", mdx(\"span\", {\n    parentName: \"code\",\n    \"className\": \"token punctuation\"\n  }, \"}\"), mdx(\"span\", {\n    parentName: \"code\",\n    \"className\": \"token punctuation\"\n  }, \")\")))), mdx(\"h3\", {\n    \"id\": \"4-get-the-server-up-and-running\",\n    \"style\": {\n      \"position\": \"relative\"\n    }\n  }, mdx(\"a\", {\n    parentName: \"h3\",\n    \"href\": \"#4-get-the-server-up-and-running\",\n    \"aria-label\": \"4 get the server up and running permalink\",\n    \"className\": \"anchor before\"\n  }, mdx(\"svg\", {\n    parentName: \"a\",\n    \"aria-hidden\": \"true\",\n    \"focusable\": \"false\",\n    \"height\": \"16\",\n    \"version\": \"1.1\",\n    \"viewBox\": \"0 0 16 16\",\n    \"width\": \"16\"\n  }, mdx(\"path\", {\n    parentName: \"svg\",\n    \"fillRule\": \"evenodd\",\n    \"d\": \"M4 9h1v1H4c-1.5 0-3-1.69-3-3.5S2.55 3 4 3h4c1.45 0 3 1.69 3 3.5 0 1.41-.91 2.72-2 3.25V8.59c.58-.45 1-1.27 1-2.09C10 5.22 8.98 4 8 4H4c-.98 0-2 1.22-2 2.5S3 9 4 9zm9-3h-1v1h1c1 0 2 1.22 2 2.5S13.98 12 13 12H9c-.98 0-2-1.22-2-2.5 0-.83.42-1.64 1-2.09V6.25c-1.09.53-2 1.84-2 3.25C6 11.31 7.55 13 9 13h4c1.45 0 3-1.69 3-3.5S14.5 6 13 6z\"\n  }))), \"4. Get the server up and running\"), mdx(\"p\", null, mdx(\"em\", {\n    parentName: \"p\"\n  }, \"Learn how to leverage exit code to alter the action status.\")), mdx(\"p\", null, \"The Redis server is now configured and ready to be started. The status reflects whether the server was already started or not based on the \", mdx(\"a\", {\n    parentName: \"p\",\n    \"href\": \"https://tldp.org/LDP/abs/html/exitcodes.html\"\n  }, \"shell exit code\"), \". The value \", mdx(\"code\", {\n    parentName: \"p\",\n    \"className\": \"language-text\"\n  }, \"0\"), \" will indicate that the server was started, the value \", mdx(\"code\", {\n    parentName: \"p\",\n    \"className\": \"language-text\"\n  }, \"42\"), \" will indicate that it was already running and any other exit code will be treated as an error.\"), mdx(\"div\", {\n    \"className\": \"gatsby-highlight\",\n    \"data-language\": \"js\"\n  }, mdx(\"pre\", {\n    parentName: \"div\",\n    \"className\": \"language-js\"\n  }, mdx(\"code\", {\n    parentName: \"pre\",\n    \"className\": \"language-js\"\n  }, mdx(\"span\", {\n    parentName: \"code\",\n    \"className\": \"token function\"\n  }, \"nikita\"), mdx(\"span\", {\n    parentName: \"code\",\n    \"className\": \"token punctuation\"\n  }, \"(\"), mdx(\"span\", {\n    parentName: \"code\",\n    \"className\": \"token keyword\"\n  }, \"async\"), \" \", mdx(\"span\", {\n    parentName: \"code\",\n    \"className\": \"token keyword\"\n  }, \"function\"), mdx(\"span\", {\n    parentName: \"code\",\n    \"className\": \"token punctuation\"\n  }, \"(\"), mdx(\"span\", {\n    parentName: \"code\",\n    \"className\": \"token punctuation\"\n  }, \")\"), \" \", mdx(\"span\", {\n    parentName: \"code\",\n    \"className\": \"token punctuation\"\n  }, \"{\"), \"\\n  \", mdx(\"span\", {\n    parentName: \"code\",\n    \"className\": \"token keyword\"\n  }, \"await\"), \" \", mdx(\"span\", {\n    parentName: \"code\",\n    \"className\": \"token keyword\"\n  }, \"this\"), mdx(\"span\", {\n    parentName: \"code\",\n    \"className\": \"token punctuation\"\n  }, \".\"), \"log\", mdx(\"span\", {\n    parentName: \"code\",\n    \"className\": \"token punctuation\"\n  }, \".\"), mdx(\"span\", {\n    parentName: \"code\",\n    \"className\": \"token function\"\n  }, \"cli\"), mdx(\"span\", {\n    parentName: \"code\",\n    \"className\": \"token punctuation\"\n  }, \"(\"), mdx(\"span\", {\n    parentName: \"code\",\n    \"className\": \"token punctuation\"\n  }, \")\"), \"\\n  \", mdx(\"span\", {\n    parentName: \"code\",\n    \"className\": \"token keyword\"\n  }, \"await\"), \" \", mdx(\"span\", {\n    parentName: \"code\",\n    \"className\": \"token keyword\"\n  }, \"this\"), mdx(\"span\", {\n    parentName: \"code\",\n    \"className\": \"token punctuation\"\n  }, \".\"), mdx(\"span\", {\n    parentName: \"code\",\n    \"className\": \"token function\"\n  }, \"execute\"), mdx(\"span\", {\n    parentName: \"code\",\n    \"className\": \"token punctuation\"\n  }, \"(\"), mdx(\"span\", {\n    parentName: \"code\",\n    \"className\": \"token punctuation\"\n  }, \"{\"), \"\\n    \", mdx(\"span\", {\n    parentName: \"code\",\n    \"className\": \"token literal-property property\"\n  }, \"$header\"), mdx(\"span\", {\n    parentName: \"code\",\n    \"className\": \"token operator\"\n  }, \":\"), \" \", mdx(\"span\", {\n    parentName: \"code\",\n    \"className\": \"token string\"\n  }, \"'Startup'\"), mdx(\"span\", {\n    parentName: \"code\",\n    \"className\": \"token punctuation\"\n  }, \",\"), \"\\n    \", mdx(\"span\", {\n    parentName: \"code\",\n    \"className\": \"token literal-property property\"\n  }, \"code_skipped\"), mdx(\"span\", {\n    parentName: \"code\",\n    \"className\": \"token operator\"\n  }, \":\"), \" \", mdx(\"span\", {\n    parentName: \"code\",\n    \"className\": \"token number\"\n  }, \"42\"), mdx(\"span\", {\n    parentName: \"code\",\n    \"className\": \"token punctuation\"\n  }, \",\"), \"\\n    \", mdx(\"span\", {\n    parentName: \"code\",\n    \"className\": \"token literal-property property\"\n  }, \"command\"), mdx(\"span\", {\n    parentName: \"code\",\n    \"className\": \"token operator\"\n  }, \":\"), \" \", mdx(\"span\", {\n    parentName: \"code\",\n    \"className\": \"token template-string\"\n  }, mdx(\"span\", {\n    parentName: \"span\",\n    \"className\": \"token template-punctuation string\"\n  }, \"`\"), mdx(\"span\", {\n    parentName: \"span\",\n    \"className\": \"token string\"\n  }, \"\\n    # Exit code 3 if ping is successful\\n    redis-stable/src/redis-cli ping && exit 3\\n    # Otherwise start the server\\n    nohup redis-stable/src/redis-server conf/redis.conf &\\n    \"), mdx(\"span\", {\n    parentName: \"span\",\n    \"className\": \"token template-punctuation string\"\n  }, \"`\")), mdx(\"span\", {\n    parentName: \"code\",\n    \"className\": \"token punctuation\"\n  }, \",\"), \"\\n    \", mdx(\"span\", {\n    parentName: \"code\",\n    \"className\": \"token literal-property property\"\n  }, \"cwd\"), mdx(\"span\", {\n    parentName: \"code\",\n    \"className\": \"token operator\"\n  }, \":\"), \" \", mdx(\"span\", {\n    parentName: \"code\",\n    \"className\": \"token string\"\n  }, \"'/tmp/nikita-tutorial'\"), mdx(\"span\", {\n    parentName: \"code\",\n    \"className\": \"token punctuation\"\n  }, \",\"), \"\\n  \", mdx(\"span\", {\n    parentName: \"code\",\n    \"className\": \"token punctuation\"\n  }, \"}\"), mdx(\"span\", {\n    parentName: \"code\",\n    \"className\": \"token punctuation\"\n  }, \")\"), \"\\n\", mdx(\"span\", {\n    parentName: \"code\",\n    \"className\": \"token punctuation\"\n  }, \"}\"), mdx(\"span\", {\n    parentName: \"code\",\n    \"className\": \"token punctuation\"\n  }, \")\")))), mdx(\"h3\", {\n    \"id\": \"5-checking-the-service-health\",\n    \"style\": {\n      \"position\": \"relative\"\n    }\n  }, mdx(\"a\", {\n    parentName: \"h3\",\n    \"href\": \"#5-checking-the-service-health\",\n    \"aria-label\": \"5 checking the service health permalink\",\n    \"className\": \"anchor before\"\n  }, mdx(\"svg\", {\n    parentName: \"a\",\n    \"aria-hidden\": \"true\",\n    \"focusable\": \"false\",\n    \"height\": \"16\",\n    \"version\": \"1.1\",\n    \"viewBox\": \"0 0 16 16\",\n    \"width\": \"16\"\n  }, mdx(\"path\", {\n    parentName: \"svg\",\n    \"fillRule\": \"evenodd\",\n    \"d\": \"M4 9h1v1H4c-1.5 0-3-1.69-3-3.5S2.55 3 4 3h4c1.45 0 3 1.69 3 3.5 0 1.41-.91 2.72-2 3.25V8.59c.58-.45 1-1.27 1-2.09C10 5.22 8.98 4 8 4H4c-.98 0-2 1.22-2 2.5S3 9 4 9zm9-3h-1v1h1c1 0 2 1.22 2 2.5S13.98 12 13 12H9c-.98 0-2-1.22-2-2.5 0-.83.42-1.64 1-2.09V6.25c-1.09.53-2 1.84-2 3.25C6 11.31 7.55 13 9 13h4c1.45 0 3-1.69 3-3.5S14.5 6 13 6z\"\n  }))), \"5. Checking the service health\"), mdx(\"p\", null, mdx(\"em\", {\n    parentName: \"p\"\n  }, \"Learn how to use the \", mdx(\"code\", {\n    parentName: \"em\",\n    \"className\": \"language-text\"\n  }, \"relax\"), \" and \", mdx(\"code\", {\n    parentName: \"em\",\n    \"className\": \"language-text\"\n  }, \"shy\"), \" metadata.\")), mdx(\"p\", null, \"The Redis \", mdx(\"code\", {\n    parentName: \"p\",\n    \"className\": \"language-text\"\n  }, \"PING\"), \" command is expected to return \", mdx(\"code\", {\n    parentName: \"p\",\n    \"className\": \"language-text\"\n  }, \"PONG\"), \" if the server is healthy. Let's take this use case to illustrate the usage of the \", mdx(\"code\", {\n    parentName: \"p\",\n    \"className\": \"language-text\"\n  }, \"relax\"), \" and \", mdx(\"code\", {\n    parentName: \"p\",\n    \"className\": \"language-text\"\n  }, \"shy\"), \" metadata properties.\"), mdx(\"p\", null, \"The \", mdx(\"code\", {\n    parentName: \"p\",\n    \"className\": \"language-text\"\n  }, \"relax\"), \" metadata resolves the action successfully with the error placed inside the resulting output instead of rejecting the exception, thus allowing the Nikita session to exit gracefully while printing \", mdx(\"code\", {\n    parentName: \"p\",\n    \"className\": \"language-text\"\n  }, \"\\u2718\"), \" in case of any error. \"), mdx(\"p\", null, \"Similarly, the \", mdx(\"code\", {\n    parentName: \"p\",\n    \"className\": \"language-text\"\n  }, \"shy\"), \" metadata will allow us to set the status to \", mdx(\"code\", {\n    parentName: \"p\",\n    \"className\": \"language-text\"\n  }, \"true\"), \", but print \", mdx(\"code\", {\n    parentName: \"p\",\n    \"className\": \"language-text\"\n  }, \"-\"), \" on success without modifying the status of the parent \", mdx(\"code\", {\n    parentName: \"p\",\n    \"className\": \"language-text\"\n  }, \"nikita.call\"), \" action, because it is not considered as a change of state.\"), mdx(\"div\", {\n    \"className\": \"gatsby-highlight\",\n    \"data-language\": \"js\"\n  }, mdx(\"pre\", {\n    parentName: \"div\",\n    \"className\": \"language-js\"\n  }, mdx(\"code\", {\n    parentName: \"pre\",\n    \"className\": \"language-js\"\n  }, mdx(\"span\", {\n    parentName: \"code\",\n    \"className\": \"token function\"\n  }, \"nikita\"), mdx(\"span\", {\n    parentName: \"code\",\n    \"className\": \"token punctuation\"\n  }, \"(\"), mdx(\"span\", {\n    parentName: \"code\",\n    \"className\": \"token keyword\"\n  }, \"async\"), \" \", mdx(\"span\", {\n    parentName: \"code\",\n    \"className\": \"token keyword\"\n  }, \"function\"), mdx(\"span\", {\n    parentName: \"code\",\n    \"className\": \"token punctuation\"\n  }, \"(\"), mdx(\"span\", {\n    parentName: \"code\",\n    \"className\": \"token punctuation\"\n  }, \")\"), \" \", mdx(\"span\", {\n    parentName: \"code\",\n    \"className\": \"token punctuation\"\n  }, \"{\"), \"\\n  \", mdx(\"span\", {\n    parentName: \"code\",\n    \"className\": \"token keyword\"\n  }, \"await\"), \" \", mdx(\"span\", {\n    parentName: \"code\",\n    \"className\": \"token keyword\"\n  }, \"this\"), mdx(\"span\", {\n    parentName: \"code\",\n    \"className\": \"token punctuation\"\n  }, \".\"), \"log\", mdx(\"span\", {\n    parentName: \"code\",\n    \"className\": \"token punctuation\"\n  }, \".\"), mdx(\"span\", {\n    parentName: \"code\",\n    \"className\": \"token function\"\n  }, \"cli\"), mdx(\"span\", {\n    parentName: \"code\",\n    \"className\": \"token punctuation\"\n  }, \"(\"), mdx(\"span\", {\n    parentName: \"code\",\n    \"className\": \"token punctuation\"\n  }, \")\"), \"\\n  \", mdx(\"span\", {\n    parentName: \"code\",\n    \"className\": \"token keyword\"\n  }, \"await\"), \" \", mdx(\"span\", {\n    parentName: \"code\",\n    \"className\": \"token keyword\"\n  }, \"this\"), mdx(\"span\", {\n    parentName: \"code\",\n    \"className\": \"token punctuation\"\n  }, \".\"), mdx(\"span\", {\n    parentName: \"code\",\n    \"className\": \"token function\"\n  }, \"call\"), mdx(\"span\", {\n    parentName: \"code\",\n    \"className\": \"token punctuation\"\n  }, \"(\"), mdx(\"span\", {\n    parentName: \"code\",\n    \"className\": \"token punctuation\"\n  }, \"{\"), \"\\n    \", mdx(\"span\", {\n    parentName: \"code\",\n    \"className\": \"token literal-property property\"\n  }, \"$header\"), mdx(\"span\", {\n    parentName: \"code\",\n    \"className\": \"token operator\"\n  }, \":\"), \" \", mdx(\"span\", {\n    parentName: \"code\",\n    \"className\": \"token string\"\n  }, \"'Redis Check'\"), mdx(\"span\", {\n    parentName: \"code\",\n    \"className\": \"token punctuation\"\n  }, \",\"), \"\\n  \", mdx(\"span\", {\n    parentName: \"code\",\n    \"className\": \"token punctuation\"\n  }, \"}\"), mdx(\"span\", {\n    parentName: \"code\",\n    \"className\": \"token punctuation\"\n  }, \",\"), \" \", mdx(\"span\", {\n    parentName: \"code\",\n    \"className\": \"token keyword\"\n  }, \"function\"), mdx(\"span\", {\n    parentName: \"code\",\n    \"className\": \"token punctuation\"\n  }, \"(\"), mdx(\"span\", {\n    parentName: \"code\",\n    \"className\": \"token punctuation\"\n  }, \")\"), \" \", mdx(\"span\", {\n    parentName: \"code\",\n    \"className\": \"token punctuation\"\n  }, \"{\"), \"\\n    \", mdx(\"span\", {\n    parentName: \"code\",\n    \"className\": \"token keyword\"\n  }, \"this\"), mdx(\"span\", {\n    parentName: \"code\",\n    \"className\": \"token punctuation\"\n  }, \".\"), mdx(\"span\", {\n    parentName: \"code\",\n    \"className\": \"token function\"\n  }, \"execute\"), mdx(\"span\", {\n    parentName: \"code\",\n    \"className\": \"token punctuation\"\n  }, \"(\"), mdx(\"span\", {\n    parentName: \"code\",\n    \"className\": \"token punctuation\"\n  }, \"{\"), \"\\n      \", mdx(\"span\", {\n    parentName: \"code\",\n    \"className\": \"token literal-property property\"\n  }, \"$header\"), mdx(\"span\", {\n    parentName: \"code\",\n    \"className\": \"token operator\"\n  }, \":\"), \" \", mdx(\"span\", {\n    parentName: \"code\",\n    \"className\": \"token string\"\n  }, \"\\\"Check\\\"\"), mdx(\"span\", {\n    parentName: \"code\",\n    \"className\": \"token punctuation\"\n  }, \",\"), \"\\n      \", mdx(\"span\", {\n    parentName: \"code\",\n    \"className\": \"token literal-property property\"\n  }, \"$relax\"), mdx(\"span\", {\n    parentName: \"code\",\n    \"className\": \"token operator\"\n  }, \":\"), \" \", mdx(\"span\", {\n    parentName: \"code\",\n    \"className\": \"token boolean\"\n  }, \"true\"), mdx(\"span\", {\n    parentName: \"code\",\n    \"className\": \"token punctuation\"\n  }, \",\"), \"\\n      \", mdx(\"span\", {\n    parentName: \"code\",\n    \"className\": \"token literal-property property\"\n  }, \"$shy\"), mdx(\"span\", {\n    parentName: \"code\",\n    \"className\": \"token operator\"\n  }, \":\"), \" \", mdx(\"span\", {\n    parentName: \"code\",\n    \"className\": \"token boolean\"\n  }, \"true\"), mdx(\"span\", {\n    parentName: \"code\",\n    \"className\": \"token punctuation\"\n  }, \",\"), \"\\n      \", mdx(\"span\", {\n    parentName: \"code\",\n    \"className\": \"token literal-property property\"\n  }, \"cwd\"), mdx(\"span\", {\n    parentName: \"code\",\n    \"className\": \"token operator\"\n  }, \":\"), \" \", mdx(\"span\", {\n    parentName: \"code\",\n    \"className\": \"token string\"\n  }, \"'/tmp/nikita-tutorial'\"), mdx(\"span\", {\n    parentName: \"code\",\n    \"className\": \"token punctuation\"\n  }, \",\"), \"\\n      \", mdx(\"span\", {\n    parentName: \"code\",\n    \"className\": \"token literal-property property\"\n  }, \"command\"), mdx(\"span\", {\n    parentName: \"code\",\n    \"className\": \"token operator\"\n  }, \":\"), \" \", mdx(\"span\", {\n    parentName: \"code\",\n    \"className\": \"token string\"\n  }, \"'redis-stable/src/redis-cli -h 127.0.0.1 -p 6379 ping | grep PONG'\"), \"\\n    \", mdx(\"span\", {\n    parentName: \"code\",\n    \"className\": \"token punctuation\"\n  }, \"}\"), mdx(\"span\", {\n    parentName: \"code\",\n    \"className\": \"token punctuation\"\n  }, \")\"), \"\\n  \", mdx(\"span\", {\n    parentName: \"code\",\n    \"className\": \"token punctuation\"\n  }, \"}\"), mdx(\"span\", {\n    parentName: \"code\",\n    \"className\": \"token punctuation\"\n  }, \")\"), \"\\n\", mdx(\"span\", {\n    parentName: \"code\",\n    \"className\": \"token punctuation\"\n  }, \"}\"), mdx(\"span\", {\n    parentName: \"code\",\n    \"className\": \"token punctuation\"\n  }, \")\")))), mdx(\"p\", null, \"When the Redis server is started, it prints:\"), mdx(\"div\", {\n    \"className\": \"gatsby-highlight\",\n    \"data-language\": \"text\"\n  }, mdx(\"pre\", {\n    parentName: \"div\",\n    \"className\": \"language-text\"\n  }, mdx(\"code\", {\n    parentName: \"pre\",\n    \"className\": \"language-text\"\n  }, \"localhost   Redis Check : Check   -  12ms\\nlocalhost   Redis Check   -  18ms\\nlocalhost      \\u2665  \"))), mdx(\"p\", null, \"Running the same code without \", mdx(\"code\", {\n    parentName: \"p\",\n    \"className\": \"language-text\"\n  }, \"shy: true\"), \" would print:\"), mdx(\"div\", {\n    \"className\": \"gatsby-highlight\",\n    \"data-language\": \"text\"\n  }, mdx(\"pre\", {\n    parentName: \"div\",\n    \"className\": \"language-text\"\n  }, mdx(\"code\", {\n    parentName: \"pre\",\n    \"className\": \"language-text\"\n  }, \"localhost   Redis Check : Check   \\u2714  13ms\\nlocalhost   Redis Check   \\u2714  18ms\\nlocalhost      \\u2665  \"))), mdx(\"p\", null, \"When the Redis server is not started, it prints: \"), mdx(\"div\", {\n    \"className\": \"gatsby-highlight\",\n    \"data-language\": \"text\"\n  }, mdx(\"pre\", {\n    parentName: \"div\",\n    \"className\": \"language-text\"\n  }, mdx(\"code\", {\n    parentName: \"pre\",\n    \"className\": \"language-text\"\n  }, \"localhost   Redis Check : Check   \\u2718  12ms\\nlocalhost   Redis Check   -  17ms\\nlocalhost      \\u2665  \"))), mdx(\"h3\", {\n    \"id\": \"6-ssh-activation\",\n    \"style\": {\n      \"position\": \"relative\"\n    }\n  }, mdx(\"a\", {\n    parentName: \"h3\",\n    \"href\": \"#6-ssh-activation\",\n    \"aria-label\": \"6 ssh activation permalink\",\n    \"className\": \"anchor before\"\n  }, mdx(\"svg\", {\n    parentName: \"a\",\n    \"aria-hidden\": \"true\",\n    \"focusable\": \"false\",\n    \"height\": \"16\",\n    \"version\": \"1.1\",\n    \"viewBox\": \"0 0 16 16\",\n    \"width\": \"16\"\n  }, mdx(\"path\", {\n    parentName: \"svg\",\n    \"fillRule\": \"evenodd\",\n    \"d\": \"M4 9h1v1H4c-1.5 0-3-1.69-3-3.5S2.55 3 4 3h4c1.45 0 3 1.69 3 3.5 0 1.41-.91 2.72-2 3.25V8.59c.58-.45 1-1.27 1-2.09C10 5.22 8.98 4 8 4H4c-.98 0-2 1.22-2 2.5S3 9 4 9zm9-3h-1v1h1c1 0 2 1.22 2 2.5S13.98 12 13 12H9c-.98 0-2-1.22-2-2.5 0-.83.42-1.64 1-2.09V6.25c-1.09.53-2 1.84-2 3.25C6 11.31 7.55 13 9 13h4c1.45 0 3-1.69 3-3.5S14.5 6 13 6z\"\n  }))), \"6. SSH activation\"), mdx(\"p\", null, mdx(\"em\", {\n    parentName: \"p\"\n  }, \"Learn how easy and transparent it is to activate SSH.\")), mdx(\"p\", null, \"Nikita is written from the ground up to be transparent whether it is executed locally or over SSH. In fact, \", mdx(\"a\", {\n    parentName: \"p\",\n    \"href\": \"/project/developers/#tests-execution\"\n  }, \"the majority of the tests\"), \" are contextualized with an ssh argument and are executed twice. The first time locally when the connection is set to null and the second time remotely with an SSH configuration object.\"), mdx(\"p\", null, \"Calling \", mdx(\"code\", {\n    parentName: \"p\",\n    \"className\": \"language-text\"\n  }, \"nikita.ssh.open\"), \" and \", mdx(\"code\", {\n    parentName: \"p\",\n    \"className\": \"language-text\"\n  }, \"nikita.ssh.close\"), \" will associate Nikita's current session with and without an SSH connection. The \", mdx(\"code\", {\n    parentName: \"p\",\n    \"className\": \"language-text\"\n  }, \"nikita.ssh.open\"), \" action must be registered before scheduling any other actions and, inversely, the \", mdx(\"code\", {\n    parentName: \"p\",\n    \"className\": \"language-text\"\n  }, \"nikita.ssh.close\"), \" action must be registered last. \"), mdx(\"blockquote\", null, mdx(\"p\", {\n    parentName: \"blockquote\"\n  }, \"Note: both the \", mdx(\"code\", {\n    parentName: \"p\",\n    \"className\": \"language-text\"\n  }, \"nikita.log.cli\"), \" and \", mdx(\"code\", {\n    parentName: \"p\",\n    \"className\": \"language-text\"\n  }, \"nikital.log.md\"), \" actions are always executed locally. When SSH is setup, passing the \", mdx(\"code\", {\n    parentName: \"p\",\n    \"className\": \"language-text\"\n  }, \"$ssh\"), \" property to actions may activate and deactivate the SSH connection.\")), mdx(\"div\", {\n    \"className\": \"gatsby-highlight\",\n    \"data-language\": \"js\"\n  }, mdx(\"pre\", {\n    parentName: \"div\",\n    \"className\": \"language-js\"\n  }, mdx(\"code\", {\n    parentName: \"pre\",\n    \"className\": \"language-js\"\n  }, mdx(\"span\", {\n    parentName: \"code\",\n    \"className\": \"token function\"\n  }, \"nikita\"), mdx(\"span\", {\n    parentName: \"code\",\n    \"className\": \"token punctuation\"\n  }, \"(\"), mdx(\"span\", {\n    parentName: \"code\",\n    \"className\": \"token keyword\"\n  }, \"async\"), \" \", mdx(\"span\", {\n    parentName: \"code\",\n    \"className\": \"token keyword\"\n  }, \"function\"), mdx(\"span\", {\n    parentName: \"code\",\n    \"className\": \"token punctuation\"\n  }, \"(\"), mdx(\"span\", {\n    parentName: \"code\",\n    \"className\": \"token punctuation\"\n  }, \")\"), \" \", mdx(\"span\", {\n    parentName: \"code\",\n    \"className\": \"token punctuation\"\n  }, \"{\"), \"\\n  \", mdx(\"span\", {\n    parentName: \"code\",\n    \"className\": \"token keyword\"\n  }, \"await\"), \" \", mdx(\"span\", {\n    parentName: \"code\",\n    \"className\": \"token keyword\"\n  }, \"this\"), mdx(\"span\", {\n    parentName: \"code\",\n    \"className\": \"token punctuation\"\n  }, \".\"), \"log\", mdx(\"span\", {\n    parentName: \"code\",\n    \"className\": \"token punctuation\"\n  }, \".\"), mdx(\"span\", {\n    parentName: \"code\",\n    \"className\": \"token function\"\n  }, \"cli\"), mdx(\"span\", {\n    parentName: \"code\",\n    \"className\": \"token punctuation\"\n  }, \"(\"), mdx(\"span\", {\n    parentName: \"code\",\n    \"className\": \"token punctuation\"\n  }, \")\"), \"\\n  \", mdx(\"span\", {\n    parentName: \"code\",\n    \"className\": \"token comment\"\n  }, \"// Open the SSH Connection\"), \"\\n  \", mdx(\"span\", {\n    parentName: \"code\",\n    \"className\": \"token keyword\"\n  }, \"await\"), \" \", mdx(\"span\", {\n    parentName: \"code\",\n    \"className\": \"token keyword\"\n  }, \"this\"), mdx(\"span\", {\n    parentName: \"code\",\n    \"className\": \"token punctuation\"\n  }, \".\"), \"ssh\", mdx(\"span\", {\n    parentName: \"code\",\n    \"className\": \"token punctuation\"\n  }, \".\"), mdx(\"span\", {\n    parentName: \"code\",\n    \"className\": \"token function\"\n  }, \"open\"), mdx(\"span\", {\n    parentName: \"code\",\n    \"className\": \"token punctuation\"\n  }, \"(\"), mdx(\"span\", {\n    parentName: \"code\",\n    \"className\": \"token punctuation\"\n  }, \"{\"), \"\\n    \", mdx(\"span\", {\n    parentName: \"code\",\n    \"className\": \"token literal-property property\"\n  }, \"$header\"), mdx(\"span\", {\n    parentName: \"code\",\n    \"className\": \"token operator\"\n  }, \":\"), \" \", mdx(\"span\", {\n    parentName: \"code\",\n    \"className\": \"token string\"\n  }, \"'SSH open'\"), mdx(\"span\", {\n    parentName: \"code\",\n    \"className\": \"token punctuation\"\n  }, \",\"), \"\\n    \", mdx(\"span\", {\n    parentName: \"code\",\n    \"className\": \"token literal-property property\"\n  }, \"host\"), mdx(\"span\", {\n    parentName: \"code\",\n    \"className\": \"token operator\"\n  }, \":\"), \" \", mdx(\"span\", {\n    parentName: \"code\",\n    \"className\": \"token string\"\n  }, \"'127.0.0.1'\"), mdx(\"span\", {\n    parentName: \"code\",\n    \"className\": \"token punctuation\"\n  }, \",\"), \"\\n    \", mdx(\"span\", {\n    parentName: \"code\",\n    \"className\": \"token literal-property property\"\n  }, \"port\"), mdx(\"span\", {\n    parentName: \"code\",\n    \"className\": \"token operator\"\n  }, \":\"), \" \", mdx(\"span\", {\n    parentName: \"code\",\n    \"className\": \"token number\"\n  }, \"22\"), mdx(\"span\", {\n    parentName: \"code\",\n    \"className\": \"token punctuation\"\n  }, \",\"), \"\\n    \", mdx(\"span\", {\n    parentName: \"code\",\n    \"className\": \"token literal-property property\"\n  }, \"private_key_path\"), mdx(\"span\", {\n    parentName: \"code\",\n    \"className\": \"token operator\"\n  }, \":\"), \" \", mdx(\"span\", {\n    parentName: \"code\",\n    \"className\": \"token string\"\n  }, \"'~/.ssh/id_rsa'\"), mdx(\"span\", {\n    parentName: \"code\",\n    \"className\": \"token punctuation\"\n  }, \",\"), \"\\n    \", mdx(\"span\", {\n    parentName: \"code\",\n    \"className\": \"token literal-property property\"\n  }, \"username\"), mdx(\"span\", {\n    parentName: \"code\",\n    \"className\": \"token operator\"\n  }, \":\"), \" process\", mdx(\"span\", {\n    parentName: \"code\",\n    \"className\": \"token punctuation\"\n  }, \".\"), \"env\", mdx(\"span\", {\n    parentName: \"code\",\n    \"className\": \"token punctuation\"\n  }, \".\"), mdx(\"span\", {\n    parentName: \"code\",\n    \"className\": \"token constant\"\n  }, \"USER\"), \"\\n  \", mdx(\"span\", {\n    parentName: \"code\",\n    \"className\": \"token punctuation\"\n  }, \"}\"), mdx(\"span\", {\n    parentName: \"code\",\n    \"className\": \"token punctuation\"\n  }, \")\"), \"\\n  \", mdx(\"span\", {\n    parentName: \"code\",\n    \"className\": \"token comment\"\n  }, \"// Call one or multiple actions\"), \"\\n  \", mdx(\"span\", {\n    parentName: \"code\",\n    \"className\": \"token keyword\"\n  }, \"await\"), \" \", mdx(\"span\", {\n    parentName: \"code\",\n    \"className\": \"token keyword\"\n  }, \"this\"), mdx(\"span\", {\n    parentName: \"code\",\n    \"className\": \"token punctuation\"\n  }, \".\"), mdx(\"span\", {\n    parentName: \"code\",\n    \"className\": \"token function\"\n  }, \"call\"), mdx(\"span\", {\n    parentName: \"code\",\n    \"className\": \"token punctuation\"\n  }, \"(\"), mdx(\"span\", {\n    parentName: \"code\",\n    \"className\": \"token punctuation\"\n  }, \"(\"), mdx(\"span\", {\n    parentName: \"code\",\n    \"className\": \"token punctuation\"\n  }, \")\"), \" \", mdx(\"span\", {\n    parentName: \"code\",\n    \"className\": \"token operator\"\n  }, \"=>\"), \" \", mdx(\"span\", {\n    parentName: \"code\",\n    \"className\": \"token punctuation\"\n  }, \"{\"), \"\\n    console\", mdx(\"span\", {\n    parentName: \"code\",\n    \"className\": \"token punctuation\"\n  }, \".\"), mdx(\"span\", {\n    parentName: \"code\",\n    \"className\": \"token function\"\n  }, \"info\"), mdx(\"span\", {\n    parentName: \"code\",\n    \"className\": \"token punctuation\"\n  }, \"(\"), mdx(\"span\", {\n    parentName: \"code\",\n    \"className\": \"token string\"\n  }, \"'Business as usual'\"), mdx(\"span\", {\n    parentName: \"code\",\n    \"className\": \"token punctuation\"\n  }, \")\"), \"\\n  \", mdx(\"span\", {\n    parentName: \"code\",\n    \"className\": \"token punctuation\"\n  }, \"}\"), mdx(\"span\", {\n    parentName: \"code\",\n    \"className\": \"token punctuation\"\n  }, \")\"), \"\\n  \", mdx(\"span\", {\n    parentName: \"code\",\n    \"className\": \"token comment\"\n  }, \"// Close the SSH Connection\"), \"\\n  \", mdx(\"span\", {\n    parentName: \"code\",\n    \"className\": \"token keyword\"\n  }, \"await\"), \" \", mdx(\"span\", {\n    parentName: \"code\",\n    \"className\": \"token keyword\"\n  }, \"this\"), mdx(\"span\", {\n    parentName: \"code\",\n    \"className\": \"token punctuation\"\n  }, \".\"), \"ssh\", mdx(\"span\", {\n    parentName: \"code\",\n    \"className\": \"token punctuation\"\n  }, \".\"), mdx(\"span\", {\n    parentName: \"code\",\n    \"className\": \"token function\"\n  }, \"close\"), mdx(\"span\", {\n    parentName: \"code\",\n    \"className\": \"token punctuation\"\n  }, \"(\"), mdx(\"span\", {\n    parentName: \"code\",\n    \"className\": \"token punctuation\"\n  }, \"{\"), \"\\n    \", mdx(\"span\", {\n    parentName: \"code\",\n    \"className\": \"token literal-property property\"\n  }, \"$header\"), mdx(\"span\", {\n    parentName: \"code\",\n    \"className\": \"token operator\"\n  }, \":\"), \" \", mdx(\"span\", {\n    parentName: \"code\",\n    \"className\": \"token string\"\n  }, \"'SSH close'\"), mdx(\"span\", {\n    parentName: \"code\",\n    \"className\": \"token punctuation\"\n  }, \",\"), \"\\n  \", mdx(\"span\", {\n    parentName: \"code\",\n    \"className\": \"token punctuation\"\n  }, \"}\"), mdx(\"span\", {\n    parentName: \"code\",\n    \"className\": \"token punctuation\"\n  }, \")\"), \"\\n\", mdx(\"span\", {\n    parentName: \"code\",\n    \"className\": \"token punctuation\"\n  }, \"}\"), mdx(\"span\", {\n    parentName: \"code\",\n    \"className\": \"token punctuation\"\n  }, \")\")))), mdx(\"p\", null, \"The above example assumes that you can self connect with SSH locally. If this is not the case, SSH must be installed and listening on port 22 and you must follow the instructions targeting your operating system to get it up and running. A pair of SSH private and public keys, respectively installed in the files \\\"~/.ssh/id_rsa\\\" and \\\"~/.ssh/id_rsa.pub\\\", must be present and your public key must be registered inside \\\"~/.ssh/authorized_keys\\\". If this isn't already the case, you can run the following commands:\"), mdx(\"div\", {\n    \"className\": \"gatsby-highlight\",\n    \"data-language\": \"bash\"\n  }, mdx(\"pre\", {\n    parentName: \"div\",\n    \"className\": \"language-bash\"\n  }, mdx(\"code\", {\n    parentName: \"pre\",\n    \"className\": \"language-bash\"\n  }, mdx(\"span\", {\n    parentName: \"code\",\n    \"className\": \"token comment\"\n  }, \"# Detect if private key is already present\"), \"\\n\", mdx(\"span\", {\n    parentName: \"code\",\n    \"className\": \"token keyword\"\n  }, \"if\"), \" \", mdx(\"span\", {\n    parentName: \"code\",\n    \"className\": \"token punctuation\"\n  }, \"[\"), \" \", mdx(\"span\", {\n    parentName: \"code\",\n    \"className\": \"token operator\"\n  }, \"!\"), \" -f ~/.ssh/id_rsa \", mdx(\"span\", {\n    parentName: \"code\",\n    \"className\": \"token punctuation\"\n  }, \"]\"), mdx(\"span\", {\n    parentName: \"code\",\n    \"className\": \"token punctuation\"\n  }, \";\"), \" \", mdx(\"span\", {\n    parentName: \"code\",\n    \"className\": \"token keyword\"\n  }, \"then\"), \"\\n  \", mdx(\"span\", {\n    parentName: \"code\",\n    \"className\": \"token comment\"\n  }, \"# Generate private and public keys\"), \"\\n  ssh-keygen -t rsa -f ~/.ssh/id_rsa -N \", mdx(\"span\", {\n    parentName: \"code\",\n    \"className\": \"token string\"\n  }, \"''\"), \"\\n\", mdx(\"span\", {\n    parentName: \"code\",\n    \"className\": \"token keyword\"\n  }, \"fi\"), \"\\n\", mdx(\"span\", {\n    parentName: \"code\",\n    \"className\": \"token comment\"\n  }, \"# Allow self access\"), \"\\n\", mdx(\"span\", {\n    parentName: \"code\",\n    \"className\": \"token function\"\n  }, \"cat\"), \" ~/.ssh/id_rsa.pub \", mdx(\"span\", {\n    parentName: \"code\",\n    \"className\": \"token operator\"\n  }, \">>\"), \" ~/.ssh/authorized_keys\\n\", mdx(\"span\", {\n    parentName: \"code\",\n    \"className\": \"token comment\"\n  }, \"# Ensure permissions are valid\"), \"\\n\", mdx(\"span\", {\n    parentName: \"code\",\n    \"className\": \"token function\"\n  }, \"chmod\"), \" 0700 ~/.ssh\\n\", mdx(\"span\", {\n    parentName: \"code\",\n    \"className\": \"token function\"\n  }, \"chmod\"), \" 0600 ~/.ssh/authorized_keys\\n\", mdx(\"span\", {\n    parentName: \"code\",\n    \"className\": \"token comment\"\n  }, \"# Test access\"), \"\\n\", mdx(\"span\", {\n    parentName: \"code\",\n    \"className\": \"token function\"\n  }, \"ssh\"), \" \", mdx(\"span\", {\n    parentName: \"code\",\n    \"className\": \"token variable\"\n  }, mdx(\"span\", {\n    parentName: \"span\",\n    \"className\": \"token variable\"\n  }, \"`\"), mdx(\"span\", {\n    parentName: \"span\",\n    \"className\": \"token function\"\n  }, \"whoami\"), mdx(\"span\", {\n    parentName: \"span\",\n    \"className\": \"token variable\"\n  }, \"`\")), \"@127.0.0.1 \", mdx(\"span\", {\n    parentName: \"code\",\n    \"className\": \"token string\"\n  }, \"\\\"echo 'I am inside'; exit\\\"\")))), mdx(\"h3\", {\n    \"id\": \"7-composition\",\n    \"style\": {\n      \"position\": \"relative\"\n    }\n  }, mdx(\"a\", {\n    parentName: \"h3\",\n    \"href\": \"#7-composition\",\n    \"aria-label\": \"7 composition permalink\",\n    \"className\": \"anchor before\"\n  }, mdx(\"svg\", {\n    parentName: \"a\",\n    \"aria-hidden\": \"true\",\n    \"focusable\": \"false\",\n    \"height\": \"16\",\n    \"version\": \"1.1\",\n    \"viewBox\": \"0 0 16 16\",\n    \"width\": \"16\"\n  }, mdx(\"path\", {\n    parentName: \"svg\",\n    \"fillRule\": \"evenodd\",\n    \"d\": \"M4 9h1v1H4c-1.5 0-3-1.69-3-3.5S2.55 3 4 3h4c1.45 0 3 1.69 3 3.5 0 1.41-.91 2.72-2 3.25V8.59c.58-.45 1-1.27 1-2.09C10 5.22 8.98 4 8 4H4c-.98 0-2 1.22-2 2.5S3 9 4 9zm9-3h-1v1h1c1 0 2 1.22 2 2.5S13.98 12 13 12H9c-.98 0-2-1.22-2-2.5 0-.83.42-1.64 1-2.09V6.25c-1.09.53-2 1.84-2 3.25C6 11.31 7.55 13 9 13h4c1.45 0 3-1.69 3-3.5S14.5 6 13 6z\"\n  }))), \"7. Composition\"), mdx(\"p\", null, mdx(\"em\", {\n    parentName: \"p\"\n  }, \"Learn how to chain multiple actions sequentially and compose them as children of other actions.\")), mdx(\"p\", null, \"It is time to finalize our script and run all these actions sequentially. Every time an action is called, it is scheduled inside the internal Nikita session for later execution.\"), mdx(\"p\", null, \"It is also possible to group multiple actions into one action, creating a hierarchical representation and enabling composition. In our example, we will regroup all Redis actions related to the Redis installation into a single action.\"), mdx(\"div\", {\n    \"className\": \"gatsby-highlight\",\n    \"data-language\": \"js\"\n  }, mdx(\"pre\", {\n    parentName: \"div\",\n    \"className\": \"language-js\"\n  }, mdx(\"code\", {\n    parentName: \"pre\",\n    \"className\": \"language-js\"\n  }, mdx(\"span\", {\n    parentName: \"code\",\n    \"className\": \"token keyword\"\n  }, \"const\"), \" nikita \", mdx(\"span\", {\n    parentName: \"code\",\n    \"className\": \"token operator\"\n  }, \"=\"), \" \", mdx(\"span\", {\n    parentName: \"code\",\n    \"className\": \"token function\"\n  }, \"require\"), mdx(\"span\", {\n    parentName: \"code\",\n    \"className\": \"token punctuation\"\n  }, \"(\"), mdx(\"span\", {\n    parentName: \"code\",\n    \"className\": \"token string\"\n  }, \"'nikita'\"), mdx(\"span\", {\n    parentName: \"code\",\n    \"className\": \"token punctuation\"\n  }, \")\"), mdx(\"span\", {\n    parentName: \"code\",\n    \"className\": \"token punctuation\"\n  }, \";\"), \"\\n\", mdx(\"span\", {\n    parentName: \"code\",\n    \"className\": \"token keyword\"\n  }, \"const\"), \" cwd \", mdx(\"span\", {\n    parentName: \"code\",\n    \"className\": \"token operator\"\n  }, \"=\"), \" \", mdx(\"span\", {\n    parentName: \"code\",\n    \"className\": \"token string\"\n  }, \"'/tmp/nikita-tutorial'\"), mdx(\"span\", {\n    parentName: \"code\",\n    \"className\": \"token punctuation\"\n  }, \";\"), \"\\n\", mdx(\"span\", {\n    parentName: \"code\",\n    \"className\": \"token function\"\n  }, \"nikita\"), mdx(\"span\", {\n    parentName: \"code\",\n    \"className\": \"token punctuation\"\n  }, \"(\"), mdx(\"span\", {\n    parentName: \"code\",\n    \"className\": \"token keyword\"\n  }, \"async\"), \" \", mdx(\"span\", {\n    parentName: \"code\",\n    \"className\": \"token keyword\"\n  }, \"function\"), mdx(\"span\", {\n    parentName: \"code\",\n    \"className\": \"token punctuation\"\n  }, \"(\"), mdx(\"span\", {\n    parentName: \"code\",\n    \"className\": \"token punctuation\"\n  }, \")\"), \" \", mdx(\"span\", {\n    parentName: \"code\",\n    \"className\": \"token punctuation\"\n  }, \"{\"), \"\\n  \", mdx(\"span\", {\n    parentName: \"code\",\n    \"className\": \"token keyword\"\n  }, \"await\"), \" \", mdx(\"span\", {\n    parentName: \"code\",\n    \"className\": \"token keyword\"\n  }, \"this\"), mdx(\"span\", {\n    parentName: \"code\",\n    \"className\": \"token punctuation\"\n  }, \".\"), \"log\", mdx(\"span\", {\n    parentName: \"code\",\n    \"className\": \"token punctuation\"\n  }, \".\"), mdx(\"span\", {\n    parentName: \"code\",\n    \"className\": \"token function\"\n  }, \"cli\"), mdx(\"span\", {\n    parentName: \"code\",\n    \"className\": \"token punctuation\"\n  }, \"(\"), mdx(\"span\", {\n    parentName: \"code\",\n    \"className\": \"token punctuation\"\n  }, \")\"), \"\\n  \", mdx(\"span\", {\n    parentName: \"code\",\n    \"className\": \"token keyword\"\n  }, \"await\"), \" \", mdx(\"span\", {\n    parentName: \"code\",\n    \"className\": \"token keyword\"\n  }, \"this\"), mdx(\"span\", {\n    parentName: \"code\",\n    \"className\": \"token punctuation\"\n  }, \".\"), \"log\", mdx(\"span\", {\n    parentName: \"code\",\n    \"className\": \"token punctuation\"\n  }, \".\"), mdx(\"span\", {\n    parentName: \"code\",\n    \"className\": \"token function\"\n  }, \"md\"), mdx(\"span\", {\n    parentName: \"code\",\n    \"className\": \"token punctuation\"\n  }, \"(\"), mdx(\"span\", {\n    parentName: \"code\",\n    \"className\": \"token punctuation\"\n  }, \"{\"), \"\\n    \", mdx(\"span\", {\n    parentName: \"code\",\n    \"className\": \"token literal-property property\"\n  }, \"basedir\"), mdx(\"span\", {\n    parentName: \"code\",\n    \"className\": \"token operator\"\n  }, \":\"), \" \", mdx(\"span\", {\n    parentName: \"code\",\n    \"className\": \"token template-string\"\n  }, mdx(\"span\", {\n    parentName: \"span\",\n    \"className\": \"token template-punctuation string\"\n  }, \"`\"), mdx(\"span\", {\n    parentName: \"span\",\n    \"className\": \"token interpolation\"\n  }, mdx(\"span\", {\n    parentName: \"span\",\n    \"className\": \"token interpolation-punctuation punctuation\"\n  }, \"${\"), \"cwd\", mdx(\"span\", {\n    parentName: \"span\",\n    \"className\": \"token interpolation-punctuation punctuation\"\n  }, \"}\")), mdx(\"span\", {\n    parentName: \"span\",\n    \"className\": \"token string\"\n  }, \"/log\"), mdx(\"span\", {\n    parentName: \"span\",\n    \"className\": \"token template-punctuation string\"\n  }, \"`\")), \"\\n  \", mdx(\"span\", {\n    parentName: \"code\",\n    \"className\": \"token punctuation\"\n  }, \"}\"), mdx(\"span\", {\n    parentName: \"code\",\n    \"className\": \"token punctuation\"\n  }, \")\"), \"\\n  \", mdx(\"span\", {\n    parentName: \"code\",\n    \"className\": \"token keyword\"\n  }, \"await\"), \" \", mdx(\"span\", {\n    parentName: \"code\",\n    \"className\": \"token keyword\"\n  }, \"this\"), mdx(\"span\", {\n    parentName: \"code\",\n    \"className\": \"token punctuation\"\n  }, \".\"), \"ssh\", mdx(\"span\", {\n    parentName: \"code\",\n    \"className\": \"token punctuation\"\n  }, \".\"), mdx(\"span\", {\n    parentName: \"code\",\n    \"className\": \"token function\"\n  }, \"open\"), mdx(\"span\", {\n    parentName: \"code\",\n    \"className\": \"token punctuation\"\n  }, \"(\"), mdx(\"span\", {\n    parentName: \"code\",\n    \"className\": \"token punctuation\"\n  }, \"{\"), \"\\n    \", mdx(\"span\", {\n    parentName: \"code\",\n    \"className\": \"token literal-property property\"\n  }, \"$header\"), mdx(\"span\", {\n    parentName: \"code\",\n    \"className\": \"token operator\"\n  }, \":\"), \" \", mdx(\"span\", {\n    parentName: \"code\",\n    \"className\": \"token string\"\n  }, \"'SSH Open'\"), mdx(\"span\", {\n    parentName: \"code\",\n    \"className\": \"token punctuation\"\n  }, \",\"), \"\\n    \", mdx(\"span\", {\n    parentName: \"code\",\n    \"className\": \"token literal-property property\"\n  }, \"host\"), mdx(\"span\", {\n    parentName: \"code\",\n    \"className\": \"token operator\"\n  }, \":\"), \" \", mdx(\"span\", {\n    parentName: \"code\",\n    \"className\": \"token string\"\n  }, \"'127.0.0.1'\"), mdx(\"span\", {\n    parentName: \"code\",\n    \"className\": \"token punctuation\"\n  }, \",\"), \"\\n    \", mdx(\"span\", {\n    parentName: \"code\",\n    \"className\": \"token literal-property property\"\n  }, \"port\"), mdx(\"span\", {\n    parentName: \"code\",\n    \"className\": \"token operator\"\n  }, \":\"), \" \", mdx(\"span\", {\n    parentName: \"code\",\n    \"className\": \"token number\"\n  }, \"22\"), mdx(\"span\", {\n    parentName: \"code\",\n    \"className\": \"token punctuation\"\n  }, \",\"), \"\\n    \", mdx(\"span\", {\n    parentName: \"code\",\n    \"className\": \"token literal-property property\"\n  }, \"username\"), mdx(\"span\", {\n    parentName: \"code\",\n    \"className\": \"token operator\"\n  }, \":\"), \" process\", mdx(\"span\", {\n    parentName: \"code\",\n    \"className\": \"token punctuation\"\n  }, \".\"), \"env\", mdx(\"span\", {\n    parentName: \"code\",\n    \"className\": \"token punctuation\"\n  }, \".\"), mdx(\"span\", {\n    parentName: \"code\",\n    \"className\": \"token constant\"\n  }, \"USER\"), mdx(\"span\", {\n    parentName: \"code\",\n    \"className\": \"token punctuation\"\n  }, \",\"), \"\\n    \", mdx(\"span\", {\n    parentName: \"code\",\n    \"className\": \"token literal-property property\"\n  }, \"private_key_path\"), mdx(\"span\", {\n    parentName: \"code\",\n    \"className\": \"token operator\"\n  }, \":\"), \" \", mdx(\"span\", {\n    parentName: \"code\",\n    \"className\": \"token string\"\n  }, \"'~/.ssh/id_rsa'\"), \"\\n  \", mdx(\"span\", {\n    parentName: \"code\",\n    \"className\": \"token punctuation\"\n  }, \"}\"), mdx(\"span\", {\n    parentName: \"code\",\n    \"className\": \"token punctuation\"\n  }, \")\"), \"\\n  \", mdx(\"span\", {\n    parentName: \"code\",\n    \"className\": \"token keyword\"\n  }, \"await\"), \" \", mdx(\"span\", {\n    parentName: \"code\",\n    \"className\": \"token keyword\"\n  }, \"this\"), mdx(\"span\", {\n    parentName: \"code\",\n    \"className\": \"token punctuation\"\n  }, \".\"), mdx(\"span\", {\n    parentName: \"code\",\n    \"className\": \"token function\"\n  }, \"call\"), mdx(\"span\", {\n    parentName: \"code\",\n    \"className\": \"token punctuation\"\n  }, \"(\"), mdx(\"span\", {\n    parentName: \"code\",\n    \"className\": \"token punctuation\"\n  }, \"{\"), \"\\n    \", mdx(\"span\", {\n    parentName: \"code\",\n    \"className\": \"token literal-property property\"\n  }, \"$header\"), mdx(\"span\", {\n    parentName: \"code\",\n    \"className\": \"token operator\"\n  }, \":\"), \" \", mdx(\"span\", {\n    parentName: \"code\",\n    \"className\": \"token string\"\n  }, \"'Redis installation'\"), mdx(\"span\", {\n    parentName: \"code\",\n    \"className\": \"token punctuation\"\n  }, \",\"), \"\\n  \", mdx(\"span\", {\n    parentName: \"code\",\n    \"className\": \"token punctuation\"\n  }, \"}\"), mdx(\"span\", {\n    parentName: \"code\",\n    \"className\": \"token punctuation\"\n  }, \",\"), \" \", mdx(\"span\", {\n    parentName: \"code\",\n    \"className\": \"token keyword\"\n  }, \"async\"), \" \", mdx(\"span\", {\n    parentName: \"code\",\n    \"className\": \"token keyword\"\n  }, \"function\"), mdx(\"span\", {\n    parentName: \"code\",\n    \"className\": \"token punctuation\"\n  }, \"(\"), mdx(\"span\", {\n    parentName: \"code\",\n    \"className\": \"token punctuation\"\n  }, \")\"), \" \", mdx(\"span\", {\n    parentName: \"code\",\n    \"className\": \"token punctuation\"\n  }, \"{\"), \"\\n    \", mdx(\"span\", {\n    parentName: \"code\",\n    \"className\": \"token keyword\"\n  }, \"await\"), \" \", mdx(\"span\", {\n    parentName: \"code\",\n    \"className\": \"token keyword\"\n  }, \"this\"), mdx(\"span\", {\n    parentName: \"code\",\n    \"className\": \"token punctuation\"\n  }, \".\"), \"file\", mdx(\"span\", {\n    parentName: \"code\",\n    \"className\": \"token punctuation\"\n  }, \".\"), mdx(\"span\", {\n    parentName: \"code\",\n    \"className\": \"token function\"\n  }, \"download\"), mdx(\"span\", {\n    parentName: \"code\",\n    \"className\": \"token punctuation\"\n  }, \"(\"), mdx(\"span\", {\n    parentName: \"code\",\n    \"className\": \"token punctuation\"\n  }, \"{\"), \"\\n      \", mdx(\"span\", {\n    parentName: \"code\",\n    \"className\": \"token literal-property property\"\n  }, \"$header\"), mdx(\"span\", {\n    parentName: \"code\",\n    \"className\": \"token operator\"\n  }, \":\"), \" \", mdx(\"span\", {\n    parentName: \"code\",\n    \"className\": \"token string\"\n  }, \"'Downloading'\"), mdx(\"span\", {\n    parentName: \"code\",\n    \"className\": \"token punctuation\"\n  }, \",\"), \"\\n      \", mdx(\"span\", {\n    parentName: \"code\",\n    \"className\": \"token literal-property property\"\n  }, \"source\"), mdx(\"span\", {\n    parentName: \"code\",\n    \"className\": \"token operator\"\n  }, \":\"), \" \", mdx(\"span\", {\n    parentName: \"code\",\n    \"className\": \"token string\"\n  }, \"'http://download.redis.io/redis-stable.tar.gz'\"), mdx(\"span\", {\n    parentName: \"code\",\n    \"className\": \"token punctuation\"\n  }, \",\"), \"\\n      \", mdx(\"span\", {\n    parentName: \"code\",\n    \"className\": \"token literal-property property\"\n  }, \"target\"), mdx(\"span\", {\n    parentName: \"code\",\n    \"className\": \"token operator\"\n  }, \":\"), \" \", mdx(\"span\", {\n    parentName: \"code\",\n    \"className\": \"token template-string\"\n  }, mdx(\"span\", {\n    parentName: \"span\",\n    \"className\": \"token template-punctuation string\"\n  }, \"`\"), mdx(\"span\", {\n    parentName: \"span\",\n    \"className\": \"token interpolation\"\n  }, mdx(\"span\", {\n    parentName: \"span\",\n    \"className\": \"token interpolation-punctuation punctuation\"\n  }, \"${\"), \"cwd\", mdx(\"span\", {\n    parentName: \"span\",\n    \"className\": \"token interpolation-punctuation punctuation\"\n  }, \"}\")), mdx(\"span\", {\n    parentName: \"span\",\n    \"className\": \"token string\"\n  }, \"/cache/redis-stable.tar.gz\"), mdx(\"span\", {\n    parentName: \"span\",\n    \"className\": \"token template-punctuation string\"\n  }, \"`\")), \"\\n    \", mdx(\"span\", {\n    parentName: \"code\",\n    \"className\": \"token punctuation\"\n  }, \"}\"), mdx(\"span\", {\n    parentName: \"code\",\n    \"className\": \"token punctuation\"\n  }, \")\"), \"\\n    \", mdx(\"span\", {\n    parentName: \"code\",\n    \"className\": \"token keyword\"\n  }, \"await\"), \" \", mdx(\"span\", {\n    parentName: \"code\",\n    \"className\": \"token keyword\"\n  }, \"this\"), mdx(\"span\", {\n    parentName: \"code\",\n    \"className\": \"token punctuation\"\n  }, \".\"), mdx(\"span\", {\n    parentName: \"code\",\n    \"className\": \"token function\"\n  }, \"execute\"), mdx(\"span\", {\n    parentName: \"code\",\n    \"className\": \"token punctuation\"\n  }, \"(\"), mdx(\"span\", {\n    parentName: \"code\",\n    \"className\": \"token punctuation\"\n  }, \"{\"), \"\\n      \", mdx(\"span\", {\n    parentName: \"code\",\n    \"className\": \"token literal-property property\"\n  }, \"$header\"), mdx(\"span\", {\n    parentName: \"code\",\n    \"className\": \"token operator\"\n  }, \":\"), \" \", mdx(\"span\", {\n    parentName: \"code\",\n    \"className\": \"token string\"\n  }, \"'Compilation'\"), mdx(\"span\", {\n    parentName: \"code\",\n    \"className\": \"token punctuation\"\n  }, \",\"), \"\\n      \", mdx(\"span\", {\n    parentName: \"code\",\n    \"className\": \"token literal-property property\"\n  }, \"$unless_exists\"), mdx(\"span\", {\n    parentName: \"code\",\n    \"className\": \"token operator\"\n  }, \":\"), \" \", mdx(\"span\", {\n    parentName: \"code\",\n    \"className\": \"token template-string\"\n  }, mdx(\"span\", {\n    parentName: \"span\",\n    \"className\": \"token template-punctuation string\"\n  }, \"`\"), mdx(\"span\", {\n    parentName: \"span\",\n    \"className\": \"token interpolation\"\n  }, mdx(\"span\", {\n    parentName: \"span\",\n    \"className\": \"token interpolation-punctuation punctuation\"\n  }, \"${\"), \"cwd\", mdx(\"span\", {\n    parentName: \"span\",\n    \"className\": \"token interpolation-punctuation punctuation\"\n  }, \"}\")), mdx(\"span\", {\n    parentName: \"span\",\n    \"className\": \"token string\"\n  }, \"/redis-stable/src/redis-server\"), mdx(\"span\", {\n    parentName: \"span\",\n    \"className\": \"token template-punctuation string\"\n  }, \"`\")), mdx(\"span\", {\n    parentName: \"code\",\n    \"className\": \"token punctuation\"\n  }, \",\"), \"\\n      \", mdx(\"span\", {\n    parentName: \"code\",\n    \"className\": \"token literal-property property\"\n  }, \"cwd\"), mdx(\"span\", {\n    parentName: \"code\",\n    \"className\": \"token operator\"\n  }, \":\"), \" cwd\", mdx(\"span\", {\n    parentName: \"code\",\n    \"className\": \"token punctuation\"\n  }, \",\"), \"\\n      \", mdx(\"span\", {\n    parentName: \"code\",\n    \"className\": \"token literal-property property\"\n  }, \"command\"), mdx(\"span\", {\n    parentName: \"code\",\n    \"className\": \"token operator\"\n  }, \":\"), \" \", mdx(\"span\", {\n    parentName: \"code\",\n    \"className\": \"token template-string\"\n  }, mdx(\"span\", {\n    parentName: \"span\",\n    \"className\": \"token template-punctuation string\"\n  }, \"`\"), mdx(\"span\", {\n    parentName: \"span\",\n    \"className\": \"token string\"\n  }, \"\\n      tar xzf cache/redis-stable.tar.gz\\n      cd redis-stable\\n      make\\n      \"), mdx(\"span\", {\n    parentName: \"span\",\n    \"className\": \"token template-punctuation string\"\n  }, \"`\")), \"\\n    \", mdx(\"span\", {\n    parentName: \"code\",\n    \"className\": \"token punctuation\"\n  }, \"}\"), mdx(\"span\", {\n    parentName: \"code\",\n    \"className\": \"token punctuation\"\n  }, \")\"), \"\\n    \", mdx(\"span\", {\n    parentName: \"code\",\n    \"className\": \"token keyword\"\n  }, \"await\"), \" \", mdx(\"span\", {\n    parentName: \"code\",\n    \"className\": \"token keyword\"\n  }, \"this\"), mdx(\"span\", {\n    parentName: \"code\",\n    \"className\": \"token punctuation\"\n  }, \".\"), \"file\", mdx(\"span\", {\n    parentName: \"code\",\n    \"className\": \"token punctuation\"\n  }, \".\"), mdx(\"span\", {\n    parentName: \"code\",\n    \"className\": \"token function\"\n  }, \"properties\"), mdx(\"span\", {\n    parentName: \"code\",\n    \"className\": \"token punctuation\"\n  }, \"(\"), mdx(\"span\", {\n    parentName: \"code\",\n    \"className\": \"token punctuation\"\n  }, \"{\"), \"\\n      \", mdx(\"span\", {\n    parentName: \"code\",\n    \"className\": \"token literal-property property\"\n  }, \"$header\"), mdx(\"span\", {\n    parentName: \"code\",\n    \"className\": \"token operator\"\n  }, \":\"), \" \", mdx(\"span\", {\n    parentName: \"code\",\n    \"className\": \"token string\"\n  }, \"'Configuration'\"), mdx(\"span\", {\n    parentName: \"code\",\n    \"className\": \"token punctuation\"\n  }, \",\"), \"\\n      \", mdx(\"span\", {\n    parentName: \"code\",\n    \"className\": \"token literal-property property\"\n  }, \"target\"), mdx(\"span\", {\n    parentName: \"code\",\n    \"className\": \"token operator\"\n  }, \":\"), \" \", mdx(\"span\", {\n    parentName: \"code\",\n    \"className\": \"token template-string\"\n  }, mdx(\"span\", {\n    parentName: \"span\",\n    \"className\": \"token template-punctuation string\"\n  }, \"`\"), mdx(\"span\", {\n    parentName: \"span\",\n    \"className\": \"token interpolation\"\n  }, mdx(\"span\", {\n    parentName: \"span\",\n    \"className\": \"token interpolation-punctuation punctuation\"\n  }, \"${\"), \"cwd\", mdx(\"span\", {\n    parentName: \"span\",\n    \"className\": \"token interpolation-punctuation punctuation\"\n  }, \"}\")), mdx(\"span\", {\n    parentName: \"span\",\n    \"className\": \"token string\"\n  }, \"/conf/redis.conf\"), mdx(\"span\", {\n    parentName: \"span\",\n    \"className\": \"token template-punctuation string\"\n  }, \"`\")), mdx(\"span\", {\n    parentName: \"code\",\n    \"className\": \"token punctuation\"\n  }, \",\"), \"\\n      \", mdx(\"span\", {\n    parentName: \"code\",\n    \"className\": \"token literal-property property\"\n  }, \"separator\"), mdx(\"span\", {\n    parentName: \"code\",\n    \"className\": \"token operator\"\n  }, \":\"), \" \", mdx(\"span\", {\n    parentName: \"code\",\n    \"className\": \"token string\"\n  }, \"' '\"), mdx(\"span\", {\n    parentName: \"code\",\n    \"className\": \"token punctuation\"\n  }, \",\"), \"\\n      \", mdx(\"span\", {\n    parentName: \"code\",\n    \"className\": \"token literal-property property\"\n  }, \"content\"), mdx(\"span\", {\n    parentName: \"code\",\n    \"className\": \"token operator\"\n  }, \":\"), \" \", mdx(\"span\", {\n    parentName: \"code\",\n    \"className\": \"token punctuation\"\n  }, \"{\"), \"\\n        \", mdx(\"span\", {\n    parentName: \"code\",\n    \"className\": \"token string-property property\"\n  }, \"'bind'\"), mdx(\"span\", {\n    parentName: \"code\",\n    \"className\": \"token operator\"\n  }, \":\"), \" \", mdx(\"span\", {\n    parentName: \"code\",\n    \"className\": \"token string\"\n  }, \"'127.0.0.1'\"), mdx(\"span\", {\n    parentName: \"code\",\n    \"className\": \"token punctuation\"\n  }, \",\"), \"\\n        \", mdx(\"span\", {\n    parentName: \"code\",\n    \"className\": \"token string-property property\"\n  }, \"'daemonize'\"), mdx(\"span\", {\n    parentName: \"code\",\n    \"className\": \"token operator\"\n  }, \":\"), \" \", mdx(\"span\", {\n    parentName: \"code\",\n    \"className\": \"token string\"\n  }, \"'yes'\"), mdx(\"span\", {\n    parentName: \"code\",\n    \"className\": \"token punctuation\"\n  }, \",\"), \"\\n        \", mdx(\"span\", {\n    parentName: \"code\",\n    \"className\": \"token string-property property\"\n  }, \"'protected-mode'\"), mdx(\"span\", {\n    parentName: \"code\",\n    \"className\": \"token operator\"\n  }, \":\"), \" \", mdx(\"span\", {\n    parentName: \"code\",\n    \"className\": \"token string\"\n  }, \"'yes'\"), mdx(\"span\", {\n    parentName: \"code\",\n    \"className\": \"token punctuation\"\n  }, \",\"), \"\\n        \", mdx(\"span\", {\n    parentName: \"code\",\n    \"className\": \"token string-property property\"\n  }, \"'port'\"), mdx(\"span\", {\n    parentName: \"code\",\n    \"className\": \"token operator\"\n  }, \":\"), \" \", mdx(\"span\", {\n    parentName: \"code\",\n    \"className\": \"token number\"\n  }, \"6379\"), \"\\n      \", mdx(\"span\", {\n    parentName: \"code\",\n    \"className\": \"token punctuation\"\n  }, \"}\"), \"\\n    \", mdx(\"span\", {\n    parentName: \"code\",\n    \"className\": \"token punctuation\"\n  }, \"}\"), mdx(\"span\", {\n    parentName: \"code\",\n    \"className\": \"token punctuation\"\n  }, \")\"), \"\\n    \", mdx(\"span\", {\n    parentName: \"code\",\n    \"className\": \"token keyword\"\n  }, \"await\"), \" \", mdx(\"span\", {\n    parentName: \"code\",\n    \"className\": \"token keyword\"\n  }, \"this\"), mdx(\"span\", {\n    parentName: \"code\",\n    \"className\": \"token punctuation\"\n  }, \".\"), mdx(\"span\", {\n    parentName: \"code\",\n    \"className\": \"token function\"\n  }, \"execute\"), mdx(\"span\", {\n    parentName: \"code\",\n    \"className\": \"token punctuation\"\n  }, \"(\"), mdx(\"span\", {\n    parentName: \"code\",\n    \"className\": \"token punctuation\"\n  }, \"{\"), \"\\n      \", mdx(\"span\", {\n    parentName: \"code\",\n    \"className\": \"token literal-property property\"\n  }, \"$header\"), mdx(\"span\", {\n    parentName: \"code\",\n    \"className\": \"token operator\"\n  }, \":\"), \" \", mdx(\"span\", {\n    parentName: \"code\",\n    \"className\": \"token string\"\n  }, \"'Startup'\"), mdx(\"span\", {\n    parentName: \"code\",\n    \"className\": \"token punctuation\"\n  }, \",\"), \"\\n      \", mdx(\"span\", {\n    parentName: \"code\",\n    \"className\": \"token literal-property property\"\n  }, \"cwd\"), mdx(\"span\", {\n    parentName: \"code\",\n    \"className\": \"token operator\"\n  }, \":\"), \" cwd\", mdx(\"span\", {\n    parentName: \"code\",\n    \"className\": \"token punctuation\"\n  }, \",\"), \"\\n      \", mdx(\"span\", {\n    parentName: \"code\",\n    \"className\": \"token literal-property property\"\n  }, \"code_skipped\"), mdx(\"span\", {\n    parentName: \"code\",\n    \"className\": \"token operator\"\n  }, \":\"), \" \", mdx(\"span\", {\n    parentName: \"code\",\n    \"className\": \"token number\"\n  }, \"3\"), mdx(\"span\", {\n    parentName: \"code\",\n    \"className\": \"token punctuation\"\n  }, \",\"), \"\\n      \", mdx(\"span\", {\n    parentName: \"code\",\n    \"className\": \"token literal-property property\"\n  }, \"command\"), mdx(\"span\", {\n    parentName: \"code\",\n    \"className\": \"token operator\"\n  }, \":\"), \" \", mdx(\"span\", {\n    parentName: \"code\",\n    \"className\": \"token template-string\"\n  }, mdx(\"span\", {\n    parentName: \"span\",\n    \"className\": \"token template-punctuation string\"\n  }, \"`\"), mdx(\"span\", {\n    parentName: \"span\",\n    \"className\": \"token string\"\n  }, \"\\n      redis-stable/src/redis-cli ping && exit 3\\n      nohup redis-stable/src/redis-server conf/redis.conf &\\n      \"), mdx(\"span\", {\n    parentName: \"span\",\n    \"className\": \"token template-punctuation string\"\n  }, \"`\")), \"\\n    \", mdx(\"span\", {\n    parentName: \"code\",\n    \"className\": \"token punctuation\"\n  }, \"}\"), mdx(\"span\", {\n    parentName: \"code\",\n    \"className\": \"token punctuation\"\n  }, \")\"), \"\\n  \", mdx(\"span\", {\n    parentName: \"code\",\n    \"className\": \"token punctuation\"\n  }, \"}\"), mdx(\"span\", {\n    parentName: \"code\",\n    \"className\": \"token punctuation\"\n  }, \")\"), \"\\n  \", mdx(\"span\", {\n    parentName: \"code\",\n    \"className\": \"token keyword\"\n  }, \"await\"), \" \", mdx(\"span\", {\n    parentName: \"code\",\n    \"className\": \"token keyword\"\n  }, \"this\"), mdx(\"span\", {\n    parentName: \"code\",\n    \"className\": \"token punctuation\"\n  }, \".\"), mdx(\"span\", {\n    parentName: \"code\",\n    \"className\": \"token function\"\n  }, \"execute\"), mdx(\"span\", {\n    parentName: \"code\",\n    \"className\": \"token punctuation\"\n  }, \"(\"), mdx(\"span\", {\n    parentName: \"code\",\n    \"className\": \"token punctuation\"\n  }, \"{\"), \"\\n    \", mdx(\"span\", {\n    parentName: \"code\",\n    \"className\": \"token literal-property property\"\n  }, \"$header\"), mdx(\"span\", {\n    parentName: \"code\",\n    \"className\": \"token operator\"\n  }, \":\"), \" \", mdx(\"span\", {\n    parentName: \"code\",\n    \"className\": \"token string\"\n  }, \"'Redis Check'\"), mdx(\"span\", {\n    parentName: \"code\",\n    \"className\": \"token punctuation\"\n  }, \",\"), \"\\n    \", mdx(\"span\", {\n    parentName: \"code\",\n    \"className\": \"token literal-property property\"\n  }, \"$relax\"), mdx(\"span\", {\n    parentName: \"code\",\n    \"className\": \"token operator\"\n  }, \":\"), \" \", mdx(\"span\", {\n    parentName: \"code\",\n    \"className\": \"token boolean\"\n  }, \"true\"), mdx(\"span\", {\n    parentName: \"code\",\n    \"className\": \"token punctuation\"\n  }, \",\"), \"\\n    \", mdx(\"span\", {\n    parentName: \"code\",\n    \"className\": \"token literal-property property\"\n  }, \"$shy\"), mdx(\"span\", {\n    parentName: \"code\",\n    \"className\": \"token operator\"\n  }, \":\"), \" \", mdx(\"span\", {\n    parentName: \"code\",\n    \"className\": \"token boolean\"\n  }, \"true\"), mdx(\"span\", {\n    parentName: \"code\",\n    \"className\": \"token punctuation\"\n  }, \",\"), \"\\n    \", mdx(\"span\", {\n    parentName: \"code\",\n    \"className\": \"token literal-property property\"\n  }, \"cwd\"), mdx(\"span\", {\n    parentName: \"code\",\n    \"className\": \"token operator\"\n  }, \":\"), \" cwd\", mdx(\"span\", {\n    parentName: \"code\",\n    \"className\": \"token punctuation\"\n  }, \",\"), \"\\n    \", mdx(\"span\", {\n    parentName: \"code\",\n    \"className\": \"token literal-property property\"\n  }, \"command\"), mdx(\"span\", {\n    parentName: \"code\",\n    \"className\": \"token operator\"\n  }, \":\"), \" \", mdx(\"span\", {\n    parentName: \"code\",\n    \"className\": \"token string\"\n  }, \"'redis-stable/src/redis-cli -h 127.0.0.1 -p 6379 ping | grep PONG'\"), \"\\n  \", mdx(\"span\", {\n    parentName: \"code\",\n    \"className\": \"token punctuation\"\n  }, \"}\"), mdx(\"span\", {\n    parentName: \"code\",\n    \"className\": \"token punctuation\"\n  }, \")\"), \"\\n  \", mdx(\"span\", {\n    parentName: \"code\",\n    \"className\": \"token keyword\"\n  }, \"await\"), \" \", mdx(\"span\", {\n    parentName: \"code\",\n    \"className\": \"token keyword\"\n  }, \"this\"), mdx(\"span\", {\n    parentName: \"code\",\n    \"className\": \"token punctuation\"\n  }, \".\"), \"ssh\", mdx(\"span\", {\n    parentName: \"code\",\n    \"className\": \"token punctuation\"\n  }, \".\"), mdx(\"span\", {\n    parentName: \"code\",\n    \"className\": \"token function\"\n  }, \"close\"), mdx(\"span\", {\n    parentName: \"code\",\n    \"className\": \"token punctuation\"\n  }, \"(\"), mdx(\"span\", {\n    parentName: \"code\",\n    \"className\": \"token punctuation\"\n  }, \"{\"), \"\\n    \", mdx(\"span\", {\n    parentName: \"code\",\n    \"className\": \"token literal-property property\"\n  }, \"$header\"), mdx(\"span\", {\n    parentName: \"code\",\n    \"className\": \"token operator\"\n  }, \":\"), \" \", mdx(\"span\", {\n    parentName: \"code\",\n    \"className\": \"token string\"\n  }, \"'SSH Close'\"), \"\\n  \", mdx(\"span\", {\n    parentName: \"code\",\n    \"className\": \"token punctuation\"\n  }, \"}\"), mdx(\"span\", {\n    parentName: \"code\",\n    \"className\": \"token punctuation\"\n  }, \")\"), \"\\n\", mdx(\"span\", {\n    parentName: \"code\",\n    \"className\": \"token punctuation\"\n  }, \"}\"), mdx(\"span\", {\n    parentName: \"code\",\n    \"className\": \"token punctuation\"\n  }, \")\")))), mdx(\"p\", null, \"Finally, we will split this code into one file to pilot our application and two files to encapsulate our install and check actions. We will also enhance our actions with a more flexible configuration:\"), mdx(\"p\", null, \"File \\\"app.js\\\":\"), mdx(\"div\", {\n    \"className\": \"gatsby-highlight\",\n    \"data-language\": \"js\"\n  }, mdx(\"pre\", {\n    parentName: \"div\",\n    \"className\": \"language-js\"\n  }, mdx(\"code\", {\n    parentName: \"pre\",\n    \"className\": \"language-js\"\n  }, mdx(\"span\", {\n    parentName: \"code\",\n    \"className\": \"token comment\"\n  }, \"// Dependencies\"), \"\\n\", mdx(\"span\", {\n    parentName: \"code\",\n    \"className\": \"token keyword\"\n  }, \"const\"), \" nikita \", mdx(\"span\", {\n    parentName: \"code\",\n    \"className\": \"token operator\"\n  }, \"=\"), \" \", mdx(\"span\", {\n    parentName: \"code\",\n    \"className\": \"token function\"\n  }, \"require\"), mdx(\"span\", {\n    parentName: \"code\",\n    \"className\": \"token punctuation\"\n  }, \"(\"), mdx(\"span\", {\n    parentName: \"code\",\n    \"className\": \"token string\"\n  }, \"'nikita'\"), mdx(\"span\", {\n    parentName: \"code\",\n    \"className\": \"token punctuation\"\n  }, \")\"), mdx(\"span\", {\n    parentName: \"code\",\n    \"className\": \"token punctuation\"\n  }, \";\"), \"\\n\", mdx(\"span\", {\n    parentName: \"code\",\n    \"className\": \"token keyword\"\n  }, \"const\"), \" install \", mdx(\"span\", {\n    parentName: \"code\",\n    \"className\": \"token operator\"\n  }, \"=\"), \" \", mdx(\"span\", {\n    parentName: \"code\",\n    \"className\": \"token function\"\n  }, \"require\"), mdx(\"span\", {\n    parentName: \"code\",\n    \"className\": \"token punctuation\"\n  }, \"(\"), mdx(\"span\", {\n    parentName: \"code\",\n    \"className\": \"token string\"\n  }, \"'./lib/install'\"), mdx(\"span\", {\n    parentName: \"code\",\n    \"className\": \"token punctuation\"\n  }, \")\"), mdx(\"span\", {\n    parentName: \"code\",\n    \"className\": \"token punctuation\"\n  }, \";\"), \"\\n\", mdx(\"span\", {\n    parentName: \"code\",\n    \"className\": \"token keyword\"\n  }, \"const\"), \" check \", mdx(\"span\", {\n    parentName: \"code\",\n    \"className\": \"token operator\"\n  }, \"=\"), \" \", mdx(\"span\", {\n    parentName: \"code\",\n    \"className\": \"token function\"\n  }, \"require\"), mdx(\"span\", {\n    parentName: \"code\",\n    \"className\": \"token punctuation\"\n  }, \"(\"), mdx(\"span\", {\n    parentName: \"code\",\n    \"className\": \"token string\"\n  }, \"'./lib/check'\"), mdx(\"span\", {\n    parentName: \"code\",\n    \"className\": \"token punctuation\"\n  }, \")\"), mdx(\"span\", {\n    parentName: \"code\",\n    \"className\": \"token punctuation\"\n  }, \";\"), \"\\n\", mdx(\"span\", {\n    parentName: \"code\",\n    \"className\": \"token comment\"\n  }, \"// Configuration\"), \"\\n\", mdx(\"span\", {\n    parentName: \"code\",\n    \"className\": \"token keyword\"\n  }, \"const\"), \" config \", mdx(\"span\", {\n    parentName: \"code\",\n    \"className\": \"token operator\"\n  }, \"=\"), \" \", mdx(\"span\", {\n    parentName: \"code\",\n    \"className\": \"token punctuation\"\n  }, \"{\"), \"\\n  \", mdx(\"span\", {\n    parentName: \"code\",\n    \"className\": \"token literal-property property\"\n  }, \"ssh\"), mdx(\"span\", {\n    parentName: \"code\",\n    \"className\": \"token operator\"\n  }, \":\"), \" \", mdx(\"span\", {\n    parentName: \"code\",\n    \"className\": \"token punctuation\"\n  }, \"{\"), \"\\n    \", mdx(\"span\", {\n    parentName: \"code\",\n    \"className\": \"token literal-property property\"\n  }, \"host\"), mdx(\"span\", {\n    parentName: \"code\",\n    \"className\": \"token operator\"\n  }, \":\"), \" \", mdx(\"span\", {\n    parentName: \"code\",\n    \"className\": \"token string\"\n  }, \"'127.0.0.1'\"), mdx(\"span\", {\n    parentName: \"code\",\n    \"className\": \"token punctuation\"\n  }, \",\"), \"\\n    \", mdx(\"span\", {\n    parentName: \"code\",\n    \"className\": \"token literal-property property\"\n  }, \"port\"), mdx(\"span\", {\n    parentName: \"code\",\n    \"className\": \"token operator\"\n  }, \":\"), \" \", mdx(\"span\", {\n    parentName: \"code\",\n    \"className\": \"token number\"\n  }, \"22\"), mdx(\"span\", {\n    parentName: \"code\",\n    \"className\": \"token punctuation\"\n  }, \",\"), \"\\n    \", mdx(\"span\", {\n    parentName: \"code\",\n    \"className\": \"token literal-property property\"\n  }, \"private_key_path\"), mdx(\"span\", {\n    parentName: \"code\",\n    \"className\": \"token operator\"\n  }, \":\"), \" \", mdx(\"span\", {\n    parentName: \"code\",\n    \"className\": \"token string\"\n  }, \"'~/.ssh/id_rsa'\"), mdx(\"span\", {\n    parentName: \"code\",\n    \"className\": \"token punctuation\"\n  }, \",\"), \"\\n    \", mdx(\"span\", {\n    parentName: \"code\",\n    \"className\": \"token literal-property property\"\n  }, \"username\"), mdx(\"span\", {\n    parentName: \"code\",\n    \"className\": \"token operator\"\n  }, \":\"), \" process\", mdx(\"span\", {\n    parentName: \"code\",\n    \"className\": \"token punctuation\"\n  }, \".\"), \"env\", mdx(\"span\", {\n    parentName: \"code\",\n    \"className\": \"token punctuation\"\n  }, \".\"), mdx(\"span\", {\n    parentName: \"code\",\n    \"className\": \"token constant\"\n  }, \"USER\"), \"\\n  \", mdx(\"span\", {\n    parentName: \"code\",\n    \"className\": \"token punctuation\"\n  }, \"}\"), mdx(\"span\", {\n    parentName: \"code\",\n    \"className\": \"token punctuation\"\n  }, \",\"), \"\\n  \", mdx(\"span\", {\n    parentName: \"code\",\n    \"className\": \"token literal-property property\"\n  }, \"redis\"), mdx(\"span\", {\n    parentName: \"code\",\n    \"className\": \"token operator\"\n  }, \":\"), \" \", mdx(\"span\", {\n    parentName: \"code\",\n    \"className\": \"token punctuation\"\n  }, \"{\"), \"\\n    \", mdx(\"span\", {\n    parentName: \"code\",\n    \"className\": \"token literal-property property\"\n  }, \"cwd\"), mdx(\"span\", {\n    parentName: \"code\",\n    \"className\": \"token operator\"\n  }, \":\"), \" \", mdx(\"span\", {\n    parentName: \"code\",\n    \"className\": \"token string\"\n  }, \"'/tmp/nikita-tutorial'\"), mdx(\"span\", {\n    parentName: \"code\",\n    \"className\": \"token punctuation\"\n  }, \",\"), \"\\n    \", mdx(\"span\", {\n    parentName: \"code\",\n    \"className\": \"token literal-property property\"\n  }, \"config\"), mdx(\"span\", {\n    parentName: \"code\",\n    \"className\": \"token operator\"\n  }, \":\"), \" \", mdx(\"span\", {\n    parentName: \"code\",\n    \"className\": \"token punctuation\"\n  }, \"{\"), mdx(\"span\", {\n    parentName: \"code\",\n    \"className\": \"token punctuation\"\n  }, \"}\"), \"\\n  \", mdx(\"span\", {\n    parentName: \"code\",\n    \"className\": \"token punctuation\"\n  }, \"}\"), \"\\n\", mdx(\"span\", {\n    parentName: \"code\",\n    \"className\": \"token punctuation\"\n  }, \"}\"), mdx(\"span\", {\n    parentName: \"code\",\n    \"className\": \"token punctuation\"\n  }, \";\"), \"\\n\", mdx(\"span\", {\n    parentName: \"code\",\n    \"className\": \"token comment\"\n  }, \"// Run the application\"), \"\\n\", mdx(\"span\", {\n    parentName: \"code\",\n    \"className\": \"token punctuation\"\n  }, \"(\"), mdx(\"span\", {\n    parentName: \"code\",\n    \"className\": \"token keyword\"\n  }, \"async\"), \" \", mdx(\"span\", {\n    parentName: \"code\",\n    \"className\": \"token punctuation\"\n  }, \"(\"), mdx(\"span\", {\n    parentName: \"code\",\n    \"className\": \"token punctuation\"\n  }, \")\"), \" \", mdx(\"span\", {\n    parentName: \"code\",\n    \"className\": \"token operator\"\n  }, \"=>\"), \" \", mdx(\"span\", {\n    parentName: \"code\",\n    \"className\": \"token punctuation\"\n  }, \"{\"), \"\\n  \", mdx(\"span\", {\n    parentName: \"code\",\n    \"className\": \"token keyword\"\n  }, \"await\"), \" \", mdx(\"span\", {\n    parentName: \"code\",\n    \"className\": \"token function\"\n  }, \"nikita\"), mdx(\"span\", {\n    parentName: \"code\",\n    \"className\": \"token punctuation\"\n  }, \"(\"), mdx(\"span\", {\n    parentName: \"code\",\n    \"className\": \"token keyword\"\n  }, \"async\"), \" \", mdx(\"span\", {\n    parentName: \"code\",\n    \"className\": \"token keyword\"\n  }, \"function\"), mdx(\"span\", {\n    parentName: \"code\",\n    \"className\": \"token punctuation\"\n  }, \"(\"), mdx(\"span\", {\n    parentName: \"code\",\n    \"className\": \"token punctuation\"\n  }, \")\"), \" \", mdx(\"span\", {\n    parentName: \"code\",\n    \"className\": \"token punctuation\"\n  }, \"{\"), \"\\n    \", mdx(\"span\", {\n    parentName: \"code\",\n    \"className\": \"token keyword\"\n  }, \"await\"), \" \", mdx(\"span\", {\n    parentName: \"code\",\n    \"className\": \"token keyword\"\n  }, \"this\"), mdx(\"span\", {\n    parentName: \"code\",\n    \"className\": \"token punctuation\"\n  }, \".\"), \"log\", mdx(\"span\", {\n    parentName: \"code\",\n    \"className\": \"token punctuation\"\n  }, \".\"), mdx(\"span\", {\n    parentName: \"code\",\n    \"className\": \"token function\"\n  }, \"cli\"), mdx(\"span\", {\n    parentName: \"code\",\n    \"className\": \"token punctuation\"\n  }, \"(\"), mdx(\"span\", {\n    parentName: \"code\",\n    \"className\": \"token punctuation\"\n  }, \")\"), \"\\n    \", mdx(\"span\", {\n    parentName: \"code\",\n    \"className\": \"token keyword\"\n  }, \"await\"), \" \", mdx(\"span\", {\n    parentName: \"code\",\n    \"className\": \"token keyword\"\n  }, \"this\"), mdx(\"span\", {\n    parentName: \"code\",\n    \"className\": \"token punctuation\"\n  }, \".\"), \"log\", mdx(\"span\", {\n    parentName: \"code\",\n    \"className\": \"token punctuation\"\n  }, \".\"), mdx(\"span\", {\n    parentName: \"code\",\n    \"className\": \"token function\"\n  }, \"md\"), mdx(\"span\", {\n    parentName: \"code\",\n    \"className\": \"token punctuation\"\n  }, \"(\"), mdx(\"span\", {\n    parentName: \"code\",\n    \"className\": \"token punctuation\"\n  }, \"{\"), mdx(\"span\", {\n    parentName: \"code\",\n    \"className\": \"token literal-property property\"\n  }, \"basedir\"), mdx(\"span\", {\n    parentName: \"code\",\n    \"className\": \"token operator\"\n  }, \":\"), \" \", mdx(\"span\", {\n    parentName: \"code\",\n    \"className\": \"token string\"\n  }, \"'/tmp/nikita-tutorial/log'\"), mdx(\"span\", {\n    parentName: \"code\",\n    \"className\": \"token punctuation\"\n  }, \"}\"), mdx(\"span\", {\n    parentName: \"code\",\n    \"className\": \"token punctuation\"\n  }, \")\"), \"\\n    \", mdx(\"span\", {\n    parentName: \"code\",\n    \"className\": \"token keyword\"\n  }, \"await\"), \" \", mdx(\"span\", {\n    parentName: \"code\",\n    \"className\": \"token keyword\"\n  }, \"this\"), mdx(\"span\", {\n    parentName: \"code\",\n    \"className\": \"token punctuation\"\n  }, \".\"), \"ssh\", mdx(\"span\", {\n    parentName: \"code\",\n    \"className\": \"token punctuation\"\n  }, \".\"), mdx(\"span\", {\n    parentName: \"code\",\n    \"className\": \"token function\"\n  }, \"open\"), mdx(\"span\", {\n    parentName: \"code\",\n    \"className\": \"token punctuation\"\n  }, \"(\"), mdx(\"span\", {\n    parentName: \"code\",\n    \"className\": \"token punctuation\"\n  }, \"{\"), mdx(\"span\", {\n    parentName: \"code\",\n    \"className\": \"token literal-property property\"\n  }, \"$header\"), mdx(\"span\", {\n    parentName: \"code\",\n    \"className\": \"token operator\"\n  }, \":\"), \" \", mdx(\"span\", {\n    parentName: \"code\",\n    \"className\": \"token string\"\n  }, \"'SSH Open'\"), mdx(\"span\", {\n    parentName: \"code\",\n    \"className\": \"token punctuation\"\n  }, \"}\"), mdx(\"span\", {\n    parentName: \"code\",\n    \"className\": \"token punctuation\"\n  }, \",\"), \" config\", mdx(\"span\", {\n    parentName: \"code\",\n    \"className\": \"token punctuation\"\n  }, \".\"), \"ssh\", mdx(\"span\", {\n    parentName: \"code\",\n    \"className\": \"token punctuation\"\n  }, \")\"), \"\\n    \", mdx(\"span\", {\n    parentName: \"code\",\n    \"className\": \"token keyword\"\n  }, \"await\"), \" \", mdx(\"span\", {\n    parentName: \"code\",\n    \"className\": \"token keyword\"\n  }, \"this\"), mdx(\"span\", {\n    parentName: \"code\",\n    \"className\": \"token punctuation\"\n  }, \".\"), mdx(\"span\", {\n    parentName: \"code\",\n    \"className\": \"token function\"\n  }, \"call\"), mdx(\"span\", {\n    parentName: \"code\",\n    \"className\": \"token punctuation\"\n  }, \"(\"), mdx(\"span\", {\n    parentName: \"code\",\n    \"className\": \"token punctuation\"\n  }, \"{\"), mdx(\"span\", {\n    parentName: \"code\",\n    \"className\": \"token literal-property property\"\n  }, \"$header\"), mdx(\"span\", {\n    parentName: \"code\",\n    \"className\": \"token operator\"\n  }, \":\"), \" \", mdx(\"span\", {\n    parentName: \"code\",\n    \"className\": \"token string\"\n  }, \"'Redis Install'\"), mdx(\"span\", {\n    parentName: \"code\",\n    \"className\": \"token punctuation\"\n  }, \"}\"), mdx(\"span\", {\n    parentName: \"code\",\n    \"className\": \"token punctuation\"\n  }, \",\"), \" config\", mdx(\"span\", {\n    parentName: \"code\",\n    \"className\": \"token punctuation\"\n  }, \".\"), \"redis\", mdx(\"span\", {\n    parentName: \"code\",\n    \"className\": \"token punctuation\"\n  }, \",\"), \" install\", mdx(\"span\", {\n    parentName: \"code\",\n    \"className\": \"token punctuation\"\n  }, \")\"), \"\\n    \", mdx(\"span\", {\n    parentName: \"code\",\n    \"className\": \"token keyword\"\n  }, \"await\"), \" \", mdx(\"span\", {\n    parentName: \"code\",\n    \"className\": \"token keyword\"\n  }, \"this\"), mdx(\"span\", {\n    parentName: \"code\",\n    \"className\": \"token punctuation\"\n  }, \".\"), mdx(\"span\", {\n    parentName: \"code\",\n    \"className\": \"token function\"\n  }, \"call\"), mdx(\"span\", {\n    parentName: \"code\",\n    \"className\": \"token punctuation\"\n  }, \"(\"), mdx(\"span\", {\n    parentName: \"code\",\n    \"className\": \"token punctuation\"\n  }, \"{\"), mdx(\"span\", {\n    parentName: \"code\",\n    \"className\": \"token literal-property property\"\n  }, \"$header\"), mdx(\"span\", {\n    parentName: \"code\",\n    \"className\": \"token operator\"\n  }, \":\"), \" \", mdx(\"span\", {\n    parentName: \"code\",\n    \"className\": \"token string\"\n  }, \"'Redis Check'\"), mdx(\"span\", {\n    parentName: \"code\",\n    \"className\": \"token punctuation\"\n  }, \"}\"), mdx(\"span\", {\n    parentName: \"code\",\n    \"className\": \"token punctuation\"\n  }, \",\"), \" config\", mdx(\"span\", {\n    parentName: \"code\",\n    \"className\": \"token punctuation\"\n  }, \".\"), \"redis\", mdx(\"span\", {\n    parentName: \"code\",\n    \"className\": \"token punctuation\"\n  }, \",\"), \" check\", mdx(\"span\", {\n    parentName: \"code\",\n    \"className\": \"token punctuation\"\n  }, \")\"), \"\\n    \", mdx(\"span\", {\n    parentName: \"code\",\n    \"className\": \"token keyword\"\n  }, \"await\"), \" \", mdx(\"span\", {\n    parentName: \"code\",\n    \"className\": \"token keyword\"\n  }, \"this\"), mdx(\"span\", {\n    parentName: \"code\",\n    \"className\": \"token punctuation\"\n  }, \".\"), \"ssh\", mdx(\"span\", {\n    parentName: \"code\",\n    \"className\": \"token punctuation\"\n  }, \".\"), mdx(\"span\", {\n    parentName: \"code\",\n    \"className\": \"token function\"\n  }, \"close\"), mdx(\"span\", {\n    parentName: \"code\",\n    \"className\": \"token punctuation\"\n  }, \"(\"), mdx(\"span\", {\n    parentName: \"code\",\n    \"className\": \"token punctuation\"\n  }, \"{\"), mdx(\"span\", {\n    parentName: \"code\",\n    \"className\": \"token literal-property property\"\n  }, \"$header\"), mdx(\"span\", {\n    parentName: \"code\",\n    \"className\": \"token operator\"\n  }, \":\"), \" \", mdx(\"span\", {\n    parentName: \"code\",\n    \"className\": \"token string\"\n  }, \"'SSH Close'\"), mdx(\"span\", {\n    parentName: \"code\",\n    \"className\": \"token punctuation\"\n  }, \"}\"), mdx(\"span\", {\n    parentName: \"code\",\n    \"className\": \"token punctuation\"\n  }, \")\"), \"\\n  \", mdx(\"span\", {\n    parentName: \"code\",\n    \"className\": \"token punctuation\"\n  }, \"}\"), mdx(\"span\", {\n    parentName: \"code\",\n    \"className\": \"token punctuation\"\n  }, \")\"), \"\\n\", mdx(\"span\", {\n    parentName: \"code\",\n    \"className\": \"token punctuation\"\n  }, \"}\"), mdx(\"span\", {\n    parentName: \"code\",\n    \"className\": \"token punctuation\"\n  }, \")\"), mdx(\"span\", {\n    parentName: \"code\",\n    \"className\": \"token punctuation\"\n  }, \"(\"), mdx(\"span\", {\n    parentName: \"code\",\n    \"className\": \"token punctuation\"\n  }, \")\"), mdx(\"span\", {\n    parentName: \"code\",\n    \"className\": \"token punctuation\"\n  }, \";\")))), mdx(\"p\", null, \"File \\\"./lib/install.js\\\":\"), mdx(\"div\", {\n    \"className\": \"gatsby-highlight\",\n    \"data-language\": \"js\"\n  }, mdx(\"pre\", {\n    parentName: \"div\",\n    \"className\": \"language-js\"\n  }, mdx(\"code\", {\n    parentName: \"pre\",\n    \"className\": \"language-js\"\n  }, \"module\", mdx(\"span\", {\n    parentName: \"code\",\n    \"className\": \"token punctuation\"\n  }, \".\"), mdx(\"span\", {\n    parentName: \"code\",\n    \"className\": \"token function-variable function\"\n  }, \"exports\"), \" \", mdx(\"span\", {\n    parentName: \"code\",\n    \"className\": \"token operator\"\n  }, \"=\"), \" \", mdx(\"span\", {\n    parentName: \"code\",\n    \"className\": \"token keyword\"\n  }, \"async\"), \" \", mdx(\"span\", {\n    parentName: \"code\",\n    \"className\": \"token keyword\"\n  }, \"function\"), mdx(\"span\", {\n    parentName: \"code\",\n    \"className\": \"token punctuation\"\n  }, \"(\"), mdx(\"span\", {\n    parentName: \"code\",\n    \"className\": \"token parameter\"\n  }, mdx(\"span\", {\n    parentName: \"span\",\n    \"className\": \"token punctuation\"\n  }, \"{\"), \"config\", mdx(\"span\", {\n    parentName: \"span\",\n    \"className\": \"token punctuation\"\n  }, \"}\")), mdx(\"span\", {\n    parentName: \"code\",\n    \"className\": \"token punctuation\"\n  }, \")\"), \" \", mdx(\"span\", {\n    parentName: \"code\",\n    \"className\": \"token punctuation\"\n  }, \"{\"), \"\\n  \", mdx(\"span\", {\n    parentName: \"code\",\n    \"className\": \"token comment\"\n  }, \"// Default configs\"), \"\\n  \", mdx(\"span\", {\n    parentName: \"code\",\n    \"className\": \"token keyword\"\n  }, \"if\"), mdx(\"span\", {\n    parentName: \"code\",\n    \"className\": \"token punctuation\"\n  }, \"(\"), mdx(\"span\", {\n    parentName: \"code\",\n    \"className\": \"token operator\"\n  }, \"!\"), \"config\", mdx(\"span\", {\n    parentName: \"code\",\n    \"className\": \"token punctuation\"\n  }, \".\"), \"url\", mdx(\"span\", {\n    parentName: \"code\",\n    \"className\": \"token punctuation\"\n  }, \")\"), mdx(\"span\", {\n    parentName: \"code\",\n    \"className\": \"token punctuation\"\n  }, \"{\"), \" config\", mdx(\"span\", {\n    parentName: \"code\",\n    \"className\": \"token punctuation\"\n  }, \".\"), \"url \", mdx(\"span\", {\n    parentName: \"code\",\n    \"className\": \"token operator\"\n  }, \"=\"), \" \", mdx(\"span\", {\n    parentName: \"code\",\n    \"className\": \"token string\"\n  }, \"'http://download.redis.io/redis-stable.tar.gz'\"), \" \", mdx(\"span\", {\n    parentName: \"code\",\n    \"className\": \"token punctuation\"\n  }, \"}\"), \"\\n  \", mdx(\"span\", {\n    parentName: \"code\",\n    \"className\": \"token keyword\"\n  }, \"if\"), mdx(\"span\", {\n    parentName: \"code\",\n    \"className\": \"token punctuation\"\n  }, \"(\"), mdx(\"span\", {\n    parentName: \"code\",\n    \"className\": \"token operator\"\n  }, \"!\"), \"config\", mdx(\"span\", {\n    parentName: \"code\",\n    \"className\": \"token punctuation\"\n  }, \".\"), \"config\", mdx(\"span\", {\n    parentName: \"code\",\n    \"className\": \"token punctuation\"\n  }, \")\"), mdx(\"span\", {\n    parentName: \"code\",\n    \"className\": \"token punctuation\"\n  }, \"{\"), \" config\", mdx(\"span\", {\n    parentName: \"code\",\n    \"className\": \"token punctuation\"\n  }, \".\"), \"config \", mdx(\"span\", {\n    parentName: \"code\",\n    \"className\": \"token operator\"\n  }, \"=\"), \" \", mdx(\"span\", {\n    parentName: \"code\",\n    \"className\": \"token punctuation\"\n  }, \"{\"), mdx(\"span\", {\n    parentName: \"code\",\n    \"className\": \"token punctuation\"\n  }, \"}\"), \" \", mdx(\"span\", {\n    parentName: \"code\",\n    \"className\": \"token punctuation\"\n  }, \"}\"), \"\\n  \", mdx(\"span\", {\n    parentName: \"code\",\n    \"className\": \"token keyword\"\n  }, \"if\"), mdx(\"span\", {\n    parentName: \"code\",\n    \"className\": \"token punctuation\"\n  }, \"(\"), mdx(\"span\", {\n    parentName: \"code\",\n    \"className\": \"token operator\"\n  }, \"!\"), \"config\", mdx(\"span\", {\n    parentName: \"code\",\n    \"className\": \"token punctuation\"\n  }, \".\"), \"config\", mdx(\"span\", {\n    parentName: \"code\",\n    \"className\": \"token punctuation\"\n  }, \"[\"), mdx(\"span\", {\n    parentName: \"code\",\n    \"className\": \"token string\"\n  }, \"'bind'\"), mdx(\"span\", {\n    parentName: \"code\",\n    \"className\": \"token punctuation\"\n  }, \"]\"), mdx(\"span\", {\n    parentName: \"code\",\n    \"className\": \"token punctuation\"\n  }, \")\"), mdx(\"span\", {\n    parentName: \"code\",\n    \"className\": \"token punctuation\"\n  }, \"{\"), \" config\", mdx(\"span\", {\n    parentName: \"code\",\n    \"className\": \"token punctuation\"\n  }, \".\"), \"config\", mdx(\"span\", {\n    parentName: \"code\",\n    \"className\": \"token punctuation\"\n  }, \"[\"), mdx(\"span\", {\n    parentName: \"code\",\n    \"className\": \"token string\"\n  }, \"'bind'\"), mdx(\"span\", {\n    parentName: \"code\",\n    \"className\": \"token punctuation\"\n  }, \"]\"), \" \", mdx(\"span\", {\n    parentName: \"code\",\n    \"className\": \"token operator\"\n  }, \"=\"), \" \", mdx(\"span\", {\n    parentName: \"code\",\n    \"className\": \"token string\"\n  }, \"'127.0.0.1'\"), \" \", mdx(\"span\", {\n    parentName: \"code\",\n    \"className\": \"token punctuation\"\n  }, \"}\"), \"\\n  \", mdx(\"span\", {\n    parentName: \"code\",\n    \"className\": \"token keyword\"\n  }, \"if\"), mdx(\"span\", {\n    parentName: \"code\",\n    \"className\": \"token punctuation\"\n  }, \"(\"), mdx(\"span\", {\n    parentName: \"code\",\n    \"className\": \"token operator\"\n  }, \"!\"), \"config\", mdx(\"span\", {\n    parentName: \"code\",\n    \"className\": \"token punctuation\"\n  }, \".\"), \"config\", mdx(\"span\", {\n    parentName: \"code\",\n    \"className\": \"token punctuation\"\n  }, \"[\"), mdx(\"span\", {\n    parentName: \"code\",\n    \"className\": \"token string\"\n  }, \"'daemonize'\"), mdx(\"span\", {\n    parentName: \"code\",\n    \"className\": \"token punctuation\"\n  }, \"]\"), mdx(\"span\", {\n    parentName: \"code\",\n    \"className\": \"token punctuation\"\n  }, \")\"), mdx(\"span\", {\n    parentName: \"code\",\n    \"className\": \"token punctuation\"\n  }, \"{\"), \" config\", mdx(\"span\", {\n    parentName: \"code\",\n    \"className\": \"token punctuation\"\n  }, \".\"), \"config\", mdx(\"span\", {\n    parentName: \"code\",\n    \"className\": \"token punctuation\"\n  }, \"[\"), mdx(\"span\", {\n    parentName: \"code\",\n    \"className\": \"token string\"\n  }, \"'daemonize'\"), mdx(\"span\", {\n    parentName: \"code\",\n    \"className\": \"token punctuation\"\n  }, \"]\"), \" \", mdx(\"span\", {\n    parentName: \"code\",\n    \"className\": \"token operator\"\n  }, \"=\"), \" \", mdx(\"span\", {\n    parentName: \"code\",\n    \"className\": \"token string\"\n  }, \"'yes'\"), \" \", mdx(\"span\", {\n    parentName: \"code\",\n    \"className\": \"token punctuation\"\n  }, \"}\"), \"\\n  \", mdx(\"span\", {\n    parentName: \"code\",\n    \"className\": \"token keyword\"\n  }, \"if\"), mdx(\"span\", {\n    parentName: \"code\",\n    \"className\": \"token punctuation\"\n  }, \"(\"), mdx(\"span\", {\n    parentName: \"code\",\n    \"className\": \"token operator\"\n  }, \"!\"), \"config\", mdx(\"span\", {\n    parentName: \"code\",\n    \"className\": \"token punctuation\"\n  }, \".\"), \"config\", mdx(\"span\", {\n    parentName: \"code\",\n    \"className\": \"token punctuation\"\n  }, \"[\"), mdx(\"span\", {\n    parentName: \"code\",\n    \"className\": \"token string\"\n  }, \"'protected-mode'\"), mdx(\"span\", {\n    parentName: \"code\",\n    \"className\": \"token punctuation\"\n  }, \"]\"), mdx(\"span\", {\n    parentName: \"code\",\n    \"className\": \"token punctuation\"\n  }, \")\"), mdx(\"span\", {\n    parentName: \"code\",\n    \"className\": \"token punctuation\"\n  }, \"{\"), \" config\", mdx(\"span\", {\n    parentName: \"code\",\n    \"className\": \"token punctuation\"\n  }, \".\"), \"config\", mdx(\"span\", {\n    parentName: \"code\",\n    \"className\": \"token punctuation\"\n  }, \"[\"), mdx(\"span\", {\n    parentName: \"code\",\n    \"className\": \"token string\"\n  }, \"'protected-mode'\"), mdx(\"span\", {\n    parentName: \"code\",\n    \"className\": \"token punctuation\"\n  }, \"]\"), \" \", mdx(\"span\", {\n    parentName: \"code\",\n    \"className\": \"token operator\"\n  }, \"=\"), \" \", mdx(\"span\", {\n    parentName: \"code\",\n    \"className\": \"token string\"\n  }, \"'yes'\"), \" \", mdx(\"span\", {\n    parentName: \"code\",\n    \"className\": \"token punctuation\"\n  }, \"}\"), \"\\n  \", mdx(\"span\", {\n    parentName: \"code\",\n    \"className\": \"token keyword\"\n  }, \"if\"), mdx(\"span\", {\n    parentName: \"code\",\n    \"className\": \"token punctuation\"\n  }, \"(\"), mdx(\"span\", {\n    parentName: \"code\",\n    \"className\": \"token operator\"\n  }, \"!\"), \"config\", mdx(\"span\", {\n    parentName: \"code\",\n    \"className\": \"token punctuation\"\n  }, \".\"), \"config\", mdx(\"span\", {\n    parentName: \"code\",\n    \"className\": \"token punctuation\"\n  }, \"[\"), mdx(\"span\", {\n    parentName: \"code\",\n    \"className\": \"token string\"\n  }, \"'port'\"), mdx(\"span\", {\n    parentName: \"code\",\n    \"className\": \"token punctuation\"\n  }, \"]\"), mdx(\"span\", {\n    parentName: \"code\",\n    \"className\": \"token punctuation\"\n  }, \")\"), mdx(\"span\", {\n    parentName: \"code\",\n    \"className\": \"token punctuation\"\n  }, \"{\"), \" config\", mdx(\"span\", {\n    parentName: \"code\",\n    \"className\": \"token punctuation\"\n  }, \".\"), \"config\", mdx(\"span\", {\n    parentName: \"code\",\n    \"className\": \"token punctuation\"\n  }, \"[\"), mdx(\"span\", {\n    parentName: \"code\",\n    \"className\": \"token string\"\n  }, \"'port'\"), mdx(\"span\", {\n    parentName: \"code\",\n    \"className\": \"token punctuation\"\n  }, \"]\"), \" \", mdx(\"span\", {\n    parentName: \"code\",\n    \"className\": \"token operator\"\n  }, \"=\"), \" \", mdx(\"span\", {\n    parentName: \"code\",\n    \"className\": \"token number\"\n  }, \"6379\"), \" \", mdx(\"span\", {\n    parentName: \"code\",\n    \"className\": \"token punctuation\"\n  }, \"}\"), \"\\n  \", mdx(\"span\", {\n    parentName: \"code\",\n    \"className\": \"token comment\"\n  }, \"// Do the job\"), \"\\n  \", mdx(\"span\", {\n    parentName: \"code\",\n    \"className\": \"token keyword\"\n  }, \"await\"), \" \", mdx(\"span\", {\n    parentName: \"code\",\n    \"className\": \"token keyword\"\n  }, \"this\"), mdx(\"span\", {\n    parentName: \"code\",\n    \"className\": \"token punctuation\"\n  }, \".\"), \"file\", mdx(\"span\", {\n    parentName: \"code\",\n    \"className\": \"token punctuation\"\n  }, \".\"), mdx(\"span\", {\n    parentName: \"code\",\n    \"className\": \"token function\"\n  }, \"download\"), mdx(\"span\", {\n    parentName: \"code\",\n    \"className\": \"token punctuation\"\n  }, \"(\"), mdx(\"span\", {\n    parentName: \"code\",\n    \"className\": \"token punctuation\"\n  }, \"{\"), \"\\n    \", mdx(\"span\", {\n    parentName: \"code\",\n    \"className\": \"token literal-property property\"\n  }, \"$header\"), mdx(\"span\", {\n    parentName: \"code\",\n    \"className\": \"token operator\"\n  }, \":\"), \" \", mdx(\"span\", {\n    parentName: \"code\",\n    \"className\": \"token string\"\n  }, \"'Download'\"), mdx(\"span\", {\n    parentName: \"code\",\n    \"className\": \"token punctuation\"\n  }, \",\"), \"\\n    \", mdx(\"span\", {\n    parentName: \"code\",\n    \"className\": \"token literal-property property\"\n  }, \"source\"), mdx(\"span\", {\n    parentName: \"code\",\n    \"className\": \"token operator\"\n  }, \":\"), \" config\", mdx(\"span\", {\n    parentName: \"code\",\n    \"className\": \"token punctuation\"\n  }, \".\"), \"url\", mdx(\"span\", {\n    parentName: \"code\",\n    \"className\": \"token punctuation\"\n  }, \",\"), \"\\n    \", mdx(\"span\", {\n    parentName: \"code\",\n    \"className\": \"token literal-property property\"\n  }, \"target\"), mdx(\"span\", {\n    parentName: \"code\",\n    \"className\": \"token operator\"\n  }, \":\"), \" \", mdx(\"span\", {\n    parentName: \"code\",\n    \"className\": \"token template-string\"\n  }, mdx(\"span\", {\n    parentName: \"span\",\n    \"className\": \"token template-punctuation string\"\n  }, \"`\"), mdx(\"span\", {\n    parentName: \"span\",\n    \"className\": \"token interpolation\"\n  }, mdx(\"span\", {\n    parentName: \"span\",\n    \"className\": \"token interpolation-punctuation punctuation\"\n  }, \"${\"), \"config\", mdx(\"span\", {\n    parentName: \"span\",\n    \"className\": \"token punctuation\"\n  }, \".\"), \"cwd\", mdx(\"span\", {\n    parentName: \"span\",\n    \"className\": \"token interpolation-punctuation punctuation\"\n  }, \"}\")), mdx(\"span\", {\n    parentName: \"span\",\n    \"className\": \"token string\"\n  }, \"/cache/redis-stable.tar.gz\"), mdx(\"span\", {\n    parentName: \"span\",\n    \"className\": \"token template-punctuation string\"\n  }, \"`\")), \"\\n  \", mdx(\"span\", {\n    parentName: \"code\",\n    \"className\": \"token punctuation\"\n  }, \"}\"), mdx(\"span\", {\n    parentName: \"code\",\n    \"className\": \"token punctuation\"\n  }, \")\"), \"\\n  \", mdx(\"span\", {\n    parentName: \"code\",\n    \"className\": \"token keyword\"\n  }, \"await\"), \" \", mdx(\"span\", {\n    parentName: \"code\",\n    \"className\": \"token keyword\"\n  }, \"this\"), mdx(\"span\", {\n    parentName: \"code\",\n    \"className\": \"token punctuation\"\n  }, \".\"), mdx(\"span\", {\n    parentName: \"code\",\n    \"className\": \"token function\"\n  }, \"execute\"), mdx(\"span\", {\n    parentName: \"code\",\n    \"className\": \"token punctuation\"\n  }, \"(\"), mdx(\"span\", {\n    parentName: \"code\",\n    \"className\": \"token punctuation\"\n  }, \"{\"), \"\\n    \", mdx(\"span\", {\n    parentName: \"code\",\n    \"className\": \"token literal-property property\"\n  }, \"$header\"), mdx(\"span\", {\n    parentName: \"code\",\n    \"className\": \"token operator\"\n  }, \":\"), \" \", mdx(\"span\", {\n    parentName: \"code\",\n    \"className\": \"token string\"\n  }, \"'Compilation'\"), mdx(\"span\", {\n    parentName: \"code\",\n    \"className\": \"token punctuation\"\n  }, \",\"), \"\\n    \", mdx(\"span\", {\n    parentName: \"code\",\n    \"className\": \"token literal-property property\"\n  }, \"$unless_exists\"), mdx(\"span\", {\n    parentName: \"code\",\n    \"className\": \"token operator\"\n  }, \":\"), \" \", mdx(\"span\", {\n    parentName: \"code\",\n    \"className\": \"token template-string\"\n  }, mdx(\"span\", {\n    parentName: \"span\",\n    \"className\": \"token template-punctuation string\"\n  }, \"`\"), mdx(\"span\", {\n    parentName: \"span\",\n    \"className\": \"token interpolation\"\n  }, mdx(\"span\", {\n    parentName: \"span\",\n    \"className\": \"token interpolation-punctuation punctuation\"\n  }, \"${\"), \"config\", mdx(\"span\", {\n    parentName: \"span\",\n    \"className\": \"token punctuation\"\n  }, \".\"), \"cwd\", mdx(\"span\", {\n    parentName: \"span\",\n    \"className\": \"token interpolation-punctuation punctuation\"\n  }, \"}\")), mdx(\"span\", {\n    parentName: \"span\",\n    \"className\": \"token string\"\n  }, \"/redis-stable/src/redis-server\"), mdx(\"span\", {\n    parentName: \"span\",\n    \"className\": \"token template-punctuation string\"\n  }, \"`\")), mdx(\"span\", {\n    parentName: \"code\",\n    \"className\": \"token punctuation\"\n  }, \",\"), \"\\n    \", mdx(\"span\", {\n    parentName: \"code\",\n    \"className\": \"token literal-property property\"\n  }, \"cwd\"), mdx(\"span\", {\n    parentName: \"code\",\n    \"className\": \"token operator\"\n  }, \":\"), \" config\", mdx(\"span\", {\n    parentName: \"code\",\n    \"className\": \"token punctuation\"\n  }, \".\"), \"cwd\", mdx(\"span\", {\n    parentName: \"code\",\n    \"className\": \"token punctuation\"\n  }, \",\"), \"\\n    \", mdx(\"span\", {\n    parentName: \"code\",\n    \"className\": \"token literal-property property\"\n  }, \"command\"), mdx(\"span\", {\n    parentName: \"code\",\n    \"className\": \"token operator\"\n  }, \":\"), \" \", mdx(\"span\", {\n    parentName: \"code\",\n    \"className\": \"token template-string\"\n  }, mdx(\"span\", {\n    parentName: \"span\",\n    \"className\": \"token template-punctuation string\"\n  }, \"`\"), mdx(\"span\", {\n    parentName: \"span\",\n    \"className\": \"token string\"\n  }, \"\\n    tar xzf cache/redis-stable.tar.gz\\n    cd redis-stable\\n    make\\n    \"), mdx(\"span\", {\n    parentName: \"span\",\n    \"className\": \"token template-punctuation string\"\n  }, \"`\")), \"\\n  \", mdx(\"span\", {\n    parentName: \"code\",\n    \"className\": \"token punctuation\"\n  }, \"}\"), mdx(\"span\", {\n    parentName: \"code\",\n    \"className\": \"token punctuation\"\n  }, \")\"), \"\\n  \", mdx(\"span\", {\n    parentName: \"code\",\n    \"className\": \"token keyword\"\n  }, \"await\"), \" \", mdx(\"span\", {\n    parentName: \"code\",\n    \"className\": \"token keyword\"\n  }, \"this\"), mdx(\"span\", {\n    parentName: \"code\",\n    \"className\": \"token punctuation\"\n  }, \".\"), \"file\", mdx(\"span\", {\n    parentName: \"code\",\n    \"className\": \"token punctuation\"\n  }, \".\"), mdx(\"span\", {\n    parentName: \"code\",\n    \"className\": \"token function\"\n  }, \"properties\"), mdx(\"span\", {\n    parentName: \"code\",\n    \"className\": \"token punctuation\"\n  }, \"(\"), mdx(\"span\", {\n    parentName: \"code\",\n    \"className\": \"token punctuation\"\n  }, \"{\"), \"\\n    \", mdx(\"span\", {\n    parentName: \"code\",\n    \"className\": \"token literal-property property\"\n  }, \"$header\"), mdx(\"span\", {\n    parentName: \"code\",\n    \"className\": \"token operator\"\n  }, \":\"), \" \", mdx(\"span\", {\n    parentName: \"code\",\n    \"className\": \"token string\"\n  }, \"'Configuration'\"), mdx(\"span\", {\n    parentName: \"code\",\n    \"className\": \"token punctuation\"\n  }, \",\"), \"\\n    \", mdx(\"span\", {\n    parentName: \"code\",\n    \"className\": \"token literal-property property\"\n  }, \"target\"), mdx(\"span\", {\n    parentName: \"code\",\n    \"className\": \"token operator\"\n  }, \":\"), \" \", mdx(\"span\", {\n    parentName: \"code\",\n    \"className\": \"token template-string\"\n  }, mdx(\"span\", {\n    parentName: \"span\",\n    \"className\": \"token template-punctuation string\"\n  }, \"`\"), mdx(\"span\", {\n    parentName: \"span\",\n    \"className\": \"token interpolation\"\n  }, mdx(\"span\", {\n    parentName: \"span\",\n    \"className\": \"token interpolation-punctuation punctuation\"\n  }, \"${\"), \"config\", mdx(\"span\", {\n    parentName: \"span\",\n    \"className\": \"token punctuation\"\n  }, \".\"), \"cwd\", mdx(\"span\", {\n    parentName: \"span\",\n    \"className\": \"token interpolation-punctuation punctuation\"\n  }, \"}\")), mdx(\"span\", {\n    parentName: \"span\",\n    \"className\": \"token string\"\n  }, \"/conf/redis.conf\"), mdx(\"span\", {\n    parentName: \"span\",\n    \"className\": \"token template-punctuation string\"\n  }, \"`\")), mdx(\"span\", {\n    parentName: \"code\",\n    \"className\": \"token punctuation\"\n  }, \",\"), \"\\n    \", mdx(\"span\", {\n    parentName: \"code\",\n    \"className\": \"token literal-property property\"\n  }, \"separator\"), mdx(\"span\", {\n    parentName: \"code\",\n    \"className\": \"token operator\"\n  }, \":\"), \" \", mdx(\"span\", {\n    parentName: \"code\",\n    \"className\": \"token string\"\n  }, \"' '\"), mdx(\"span\", {\n    parentName: \"code\",\n    \"className\": \"token punctuation\"\n  }, \",\"), \"\\n    \", mdx(\"span\", {\n    parentName: \"code\",\n    \"className\": \"token literal-property property\"\n  }, \"content\"), mdx(\"span\", {\n    parentName: \"code\",\n    \"className\": \"token operator\"\n  }, \":\"), \" config\", mdx(\"span\", {\n    parentName: \"code\",\n    \"className\": \"token punctuation\"\n  }, \".\"), \"config\\n  \", mdx(\"span\", {\n    parentName: \"code\",\n    \"className\": \"token punctuation\"\n  }, \"}\"), mdx(\"span\", {\n    parentName: \"code\",\n    \"className\": \"token punctuation\"\n  }, \")\"), \"\\n  \", mdx(\"span\", {\n    parentName: \"code\",\n    \"className\": \"token keyword\"\n  }, \"await\"), \" \", mdx(\"span\", {\n    parentName: \"code\",\n    \"className\": \"token keyword\"\n  }, \"this\"), mdx(\"span\", {\n    parentName: \"code\",\n    \"className\": \"token punctuation\"\n  }, \".\"), mdx(\"span\", {\n    parentName: \"code\",\n    \"className\": \"token function\"\n  }, \"execute\"), mdx(\"span\", {\n    parentName: \"code\",\n    \"className\": \"token punctuation\"\n  }, \"(\"), mdx(\"span\", {\n    parentName: \"code\",\n    \"className\": \"token punctuation\"\n  }, \"{\"), \"\\n    \", mdx(\"span\", {\n    parentName: \"code\",\n    \"className\": \"token literal-property property\"\n  }, \"$header\"), mdx(\"span\", {\n    parentName: \"code\",\n    \"className\": \"token operator\"\n  }, \":\"), \" \", mdx(\"span\", {\n    parentName: \"code\",\n    \"className\": \"token string\"\n  }, \"'Startup'\"), mdx(\"span\", {\n    parentName: \"code\",\n    \"className\": \"token punctuation\"\n  }, \",\"), \"\\n    \", mdx(\"span\", {\n    parentName: \"code\",\n    \"className\": \"token literal-property property\"\n  }, \"cwd\"), mdx(\"span\", {\n    parentName: \"code\",\n    \"className\": \"token operator\"\n  }, \":\"), \" config\", mdx(\"span\", {\n    parentName: \"code\",\n    \"className\": \"token punctuation\"\n  }, \".\"), \"cwd\", mdx(\"span\", {\n    parentName: \"code\",\n    \"className\": \"token punctuation\"\n  }, \",\"), \"\\n    \", mdx(\"span\", {\n    parentName: \"code\",\n    \"className\": \"token literal-property property\"\n  }, \"code_skipped\"), mdx(\"span\", {\n    parentName: \"code\",\n    \"className\": \"token operator\"\n  }, \":\"), \" \", mdx(\"span\", {\n    parentName: \"code\",\n    \"className\": \"token number\"\n  }, \"3\"), mdx(\"span\", {\n    parentName: \"code\",\n    \"className\": \"token punctuation\"\n  }, \",\"), \"\\n    \", mdx(\"span\", {\n    parentName: \"code\",\n    \"className\": \"token literal-property property\"\n  }, \"command\"), mdx(\"span\", {\n    parentName: \"code\",\n    \"className\": \"token operator\"\n  }, \":\"), \" \", mdx(\"span\", {\n    parentName: \"code\",\n    \"className\": \"token template-string\"\n  }, mdx(\"span\", {\n    parentName: \"span\",\n    \"className\": \"token template-punctuation string\"\n  }, \"`\"), mdx(\"span\", {\n    parentName: \"span\",\n    \"className\": \"token string\"\n  }, \"\\n    redis-stable/src/redis-cli ping && exit 3\\n    nohup redis-stable/src/redis-server conf/redis.conf &\\n    \"), mdx(\"span\", {\n    parentName: \"span\",\n    \"className\": \"token template-punctuation string\"\n  }, \"`\")), \"\\n  \", mdx(\"span\", {\n    parentName: \"code\",\n    \"className\": \"token punctuation\"\n  }, \"}\"), mdx(\"span\", {\n    parentName: \"code\",\n    \"className\": \"token punctuation\"\n  }, \")\"), \"\\n\", mdx(\"span\", {\n    parentName: \"code\",\n    \"className\": \"token punctuation\"\n  }, \"}\")))), mdx(\"p\", null, \"File \\\"./lib/check.js\\\":\"), mdx(\"div\", {\n    \"className\": \"gatsby-highlight\",\n    \"data-language\": \"js\"\n  }, mdx(\"pre\", {\n    parentName: \"div\",\n    \"className\": \"language-js\"\n  }, mdx(\"code\", {\n    parentName: \"pre\",\n    \"className\": \"language-js\"\n  }, \"module\", mdx(\"span\", {\n    parentName: \"code\",\n    \"className\": \"token punctuation\"\n  }, \".\"), mdx(\"span\", {\n    parentName: \"code\",\n    \"className\": \"token function-variable function\"\n  }, \"exports\"), \" \", mdx(\"span\", {\n    parentName: \"code\",\n    \"className\": \"token operator\"\n  }, \"=\"), \" \", mdx(\"span\", {\n    parentName: \"code\",\n    \"className\": \"token keyword\"\n  }, \"async\"), \" \", mdx(\"span\", {\n    parentName: \"code\",\n    \"className\": \"token keyword\"\n  }, \"function\"), mdx(\"span\", {\n    parentName: \"code\",\n    \"className\": \"token punctuation\"\n  }, \"(\"), mdx(\"span\", {\n    parentName: \"code\",\n    \"className\": \"token parameter\"\n  }, mdx(\"span\", {\n    parentName: \"span\",\n    \"className\": \"token punctuation\"\n  }, \"{\"), \"config\", mdx(\"span\", {\n    parentName: \"span\",\n    \"className\": \"token punctuation\"\n  }, \"}\")), mdx(\"span\", {\n    parentName: \"code\",\n    \"className\": \"token punctuation\"\n  }, \")\"), \" \", mdx(\"span\", {\n    parentName: \"code\",\n    \"className\": \"token punctuation\"\n  }, \"{\"), \"\\n  \", mdx(\"span\", {\n    parentName: \"code\",\n    \"className\": \"token comment\"\n  }, \"// Get option from config if present\"), \"\\n  \", mdx(\"span\", {\n    parentName: \"code\",\n    \"className\": \"token keyword\"\n  }, \"if\"), mdx(\"span\", {\n    parentName: \"code\",\n    \"className\": \"token punctuation\"\n  }, \"(\"), \"config\", mdx(\"span\", {\n    parentName: \"code\",\n    \"className\": \"token punctuation\"\n  }, \".\"), \"config\", mdx(\"span\", {\n    parentName: \"code\",\n    \"className\": \"token punctuation\"\n  }, \")\"), mdx(\"span\", {\n    parentName: \"code\",\n    \"className\": \"token punctuation\"\n  }, \"{\"), \"\\n    \", mdx(\"span\", {\n    parentName: \"code\",\n    \"className\": \"token keyword\"\n  }, \"if\"), mdx(\"span\", {\n    parentName: \"code\",\n    \"className\": \"token punctuation\"\n  }, \"(\"), \"config\", mdx(\"span\", {\n    parentName: \"code\",\n    \"className\": \"token punctuation\"\n  }, \".\"), \"config\", mdx(\"span\", {\n    parentName: \"code\",\n    \"className\": \"token punctuation\"\n  }, \".\"), \"host\", mdx(\"span\", {\n    parentName: \"code\",\n    \"className\": \"token punctuation\"\n  }, \")\"), mdx(\"span\", {\n    parentName: \"code\",\n    \"className\": \"token punctuation\"\n  }, \"{\"), \" config\", mdx(\"span\", {\n    parentName: \"code\",\n    \"className\": \"token punctuation\"\n  }, \".\"), \"host \", mdx(\"span\", {\n    parentName: \"code\",\n    \"className\": \"token operator\"\n  }, \"=\"), \" config\", mdx(\"span\", {\n    parentName: \"code\",\n    \"className\": \"token punctuation\"\n  }, \".\"), \"config\", mdx(\"span\", {\n    parentName: \"code\",\n    \"className\": \"token punctuation\"\n  }, \".\"), \"host \", mdx(\"span\", {\n    parentName: \"code\",\n    \"className\": \"token punctuation\"\n  }, \"}\"), \"\\n    \", mdx(\"span\", {\n    parentName: \"code\",\n    \"className\": \"token keyword\"\n  }, \"if\"), mdx(\"span\", {\n    parentName: \"code\",\n    \"className\": \"token punctuation\"\n  }, \"(\"), \"config\", mdx(\"span\", {\n    parentName: \"code\",\n    \"className\": \"token punctuation\"\n  }, \".\"), \"config\", mdx(\"span\", {\n    parentName: \"code\",\n    \"className\": \"token punctuation\"\n  }, \".\"), \"port\", mdx(\"span\", {\n    parentName: \"code\",\n    \"className\": \"token punctuation\"\n  }, \")\"), mdx(\"span\", {\n    parentName: \"code\",\n    \"className\": \"token punctuation\"\n  }, \"{\"), \" config\", mdx(\"span\", {\n    parentName: \"code\",\n    \"className\": \"token punctuation\"\n  }, \".\"), \"port \", mdx(\"span\", {\n    parentName: \"code\",\n    \"className\": \"token operator\"\n  }, \"=\"), \" config\", mdx(\"span\", {\n    parentName: \"code\",\n    \"className\": \"token punctuation\"\n  }, \".\"), \"config\", mdx(\"span\", {\n    parentName: \"code\",\n    \"className\": \"token punctuation\"\n  }, \".\"), \"port \", mdx(\"span\", {\n    parentName: \"code\",\n    \"className\": \"token punctuation\"\n  }, \"}\"), \"\\n  \", mdx(\"span\", {\n    parentName: \"code\",\n    \"className\": \"token punctuation\"\n  }, \"}\"), \"\\n  \", mdx(\"span\", {\n    parentName: \"code\",\n    \"className\": \"token comment\"\n  }, \"// Default configs\"), \"\\n  \", mdx(\"span\", {\n    parentName: \"code\",\n    \"className\": \"token keyword\"\n  }, \"if\"), mdx(\"span\", {\n    parentName: \"code\",\n    \"className\": \"token punctuation\"\n  }, \"(\"), mdx(\"span\", {\n    parentName: \"code\",\n    \"className\": \"token operator\"\n  }, \"!\"), \"config\", mdx(\"span\", {\n    parentName: \"code\",\n    \"className\": \"token punctuation\"\n  }, \".\"), \"host\", mdx(\"span\", {\n    parentName: \"code\",\n    \"className\": \"token punctuation\"\n  }, \")\"), mdx(\"span\", {\n    parentName: \"code\",\n    \"className\": \"token punctuation\"\n  }, \"{\"), \" config\", mdx(\"span\", {\n    parentName: \"code\",\n    \"className\": \"token punctuation\"\n  }, \".\"), \"host \", mdx(\"span\", {\n    parentName: \"code\",\n    \"className\": \"token operator\"\n  }, \"=\"), \" \", mdx(\"span\", {\n    parentName: \"code\",\n    \"className\": \"token string\"\n  }, \"'127.0.0.1'\"), \" \", mdx(\"span\", {\n    parentName: \"code\",\n    \"className\": \"token punctuation\"\n  }, \"}\"), \"\\n  \", mdx(\"span\", {\n    parentName: \"code\",\n    \"className\": \"token keyword\"\n  }, \"if\"), mdx(\"span\", {\n    parentName: \"code\",\n    \"className\": \"token punctuation\"\n  }, \"(\"), mdx(\"span\", {\n    parentName: \"code\",\n    \"className\": \"token operator\"\n  }, \"!\"), \"config\", mdx(\"span\", {\n    parentName: \"code\",\n    \"className\": \"token punctuation\"\n  }, \".\"), \"port\", mdx(\"span\", {\n    parentName: \"code\",\n    \"className\": \"token punctuation\"\n  }, \")\"), mdx(\"span\", {\n    parentName: \"code\",\n    \"className\": \"token punctuation\"\n  }, \"{\"), \" config\", mdx(\"span\", {\n    parentName: \"code\",\n    \"className\": \"token punctuation\"\n  }, \".\"), \"port \", mdx(\"span\", {\n    parentName: \"code\",\n    \"className\": \"token operator\"\n  }, \"=\"), \" \", mdx(\"span\", {\n    parentName: \"code\",\n    \"className\": \"token number\"\n  }, \"6379\"), \" \", mdx(\"span\", {\n    parentName: \"code\",\n    \"className\": \"token punctuation\"\n  }, \"}\"), \"\\n  \", mdx(\"span\", {\n    parentName: \"code\",\n    \"className\": \"token comment\"\n  }, \"// Do the job\"), \"\\n  \", mdx(\"span\", {\n    parentName: \"code\",\n    \"className\": \"token keyword\"\n  }, \"return\"), \" \", mdx(\"span\", {\n    parentName: \"code\",\n    \"className\": \"token keyword\"\n  }, \"this\"), mdx(\"span\", {\n    parentName: \"code\",\n    \"className\": \"token punctuation\"\n  }, \".\"), mdx(\"span\", {\n    parentName: \"code\",\n    \"className\": \"token function\"\n  }, \"execute\"), mdx(\"span\", {\n    parentName: \"code\",\n    \"className\": \"token punctuation\"\n  }, \"(\"), mdx(\"span\", {\n    parentName: \"code\",\n    \"className\": \"token punctuation\"\n  }, \"{\"), \"\\n    \", mdx(\"span\", {\n    parentName: \"code\",\n    \"className\": \"token literal-property property\"\n  }, \"$header\"), mdx(\"span\", {\n    parentName: \"code\",\n    \"className\": \"token operator\"\n  }, \":\"), \" \", mdx(\"span\", {\n    parentName: \"code\",\n    \"className\": \"token string\"\n  }, \"'Check'\"), mdx(\"span\", {\n    parentName: \"code\",\n    \"className\": \"token punctuation\"\n  }, \",\"), \"\\n    \", mdx(\"span\", {\n    parentName: \"code\",\n    \"className\": \"token literal-property property\"\n  }, \"$relax\"), mdx(\"span\", {\n    parentName: \"code\",\n    \"className\": \"token operator\"\n  }, \":\"), \" \", mdx(\"span\", {\n    parentName: \"code\",\n    \"className\": \"token boolean\"\n  }, \"true\"), mdx(\"span\", {\n    parentName: \"code\",\n    \"className\": \"token punctuation\"\n  }, \",\"), \"\\n    \", mdx(\"span\", {\n    parentName: \"code\",\n    \"className\": \"token literal-property property\"\n  }, \"$shy\"), mdx(\"span\", {\n    parentName: \"code\",\n    \"className\": \"token operator\"\n  }, \":\"), \" \", mdx(\"span\", {\n    parentName: \"code\",\n    \"className\": \"token boolean\"\n  }, \"true\"), mdx(\"span\", {\n    parentName: \"code\",\n    \"className\": \"token punctuation\"\n  }, \",\"), \"\\n    \", mdx(\"span\", {\n    parentName: \"code\",\n    \"className\": \"token literal-property property\"\n  }, \"cwd\"), mdx(\"span\", {\n    parentName: \"code\",\n    \"className\": \"token operator\"\n  }, \":\"), \" config\", mdx(\"span\", {\n    parentName: \"code\",\n    \"className\": \"token punctuation\"\n  }, \".\"), \"cwd\", mdx(\"span\", {\n    parentName: \"code\",\n    \"className\": \"token punctuation\"\n  }, \",\"), \"\\n    \", mdx(\"span\", {\n    parentName: \"code\",\n    \"className\": \"token literal-property property\"\n  }, \"command\"), mdx(\"span\", {\n    parentName: \"code\",\n    \"className\": \"token operator\"\n  }, \":\"), \" \", mdx(\"span\", {\n    parentName: \"code\",\n    \"className\": \"token template-string\"\n  }, mdx(\"span\", {\n    parentName: \"span\",\n    \"className\": \"token template-punctuation string\"\n  }, \"`\"), mdx(\"span\", {\n    parentName: \"span\",\n    \"className\": \"token string\"\n  }, \"redis-stable/src/redis-cli -h \"), mdx(\"span\", {\n    parentName: \"span\",\n    \"className\": \"token interpolation\"\n  }, mdx(\"span\", {\n    parentName: \"span\",\n    \"className\": \"token interpolation-punctuation punctuation\"\n  }, \"${\"), \"config\", mdx(\"span\", {\n    parentName: \"span\",\n    \"className\": \"token punctuation\"\n  }, \".\"), \"host\", mdx(\"span\", {\n    parentName: \"span\",\n    \"className\": \"token interpolation-punctuation punctuation\"\n  }, \"}\")), mdx(\"span\", {\n    parentName: \"span\",\n    \"className\": \"token string\"\n  }, \" -p \"), mdx(\"span\", {\n    parentName: \"span\",\n    \"className\": \"token interpolation\"\n  }, mdx(\"span\", {\n    parentName: \"span\",\n    \"className\": \"token interpolation-punctuation punctuation\"\n  }, \"${\"), \"config\", mdx(\"span\", {\n    parentName: \"span\",\n    \"className\": \"token punctuation\"\n  }, \".\"), \"port\", mdx(\"span\", {\n    parentName: \"span\",\n    \"className\": \"token interpolation-punctuation punctuation\"\n  }, \"}\")), mdx(\"span\", {\n    parentName: \"span\",\n    \"className\": \"token string\"\n  }, \" ping\"), mdx(\"span\", {\n    parentName: \"span\",\n    \"className\": \"token template-punctuation string\"\n  }, \"`\")), \"\\n  \", mdx(\"span\", {\n    parentName: \"code\",\n    \"className\": \"token punctuation\"\n  }, \"}\"), mdx(\"span\", {\n    parentName: \"code\",\n    \"className\": \"token punctuation\"\n  }, \")\"), \"\\n\", mdx(\"span\", {\n    parentName: \"code\",\n    \"className\": \"token punctuation\"\n  }, \"}\")))));\n}\n;\nMDXContent.isMDXComponent = true;","tableOfContents":{"items":[{"url":"#tutorial","title":"Tutorial","items":[{"url":"#what-is-nikita","title":"What is Nikita?"},{"url":"#installation-instructions","title":"Installation instructions"},{"url":"#core-concepts","title":"Core concepts"},{"url":"#real-life-example","title":"Real-life example"}]}]}}}},"pageContext":{}},
    "staticQueryHashes": ["2288906906","393869461"]}